textDisplay,textOriginal,authorDisplayName,likeCount,publishedAt,updatedAt
"Засияй прекрасной звездой.Засияй прекрасной звездой.Засияй прекрасной звездой.Засияй прекрасной звездой.Нет в прачечной толп людей, что за чудный день.Пятну на белой рубашке ""прощай"" скажу наконец.Но чей же? Но чей же?В голове внезапно громкий голос зазвучал?Этого хочу! И того хочу! Он мне сказал.Так хотелось счастливым быть,Жизнь спокойно прожить.Лишь бы в руках удержать,Всё, что ты в сердца глубине скрываешь.Наполнив счастьем жизни до краев, покойся с миромБыть может даже глубоко в кипящем Аду я отыщу приют.Не нужно сострадания - смех звенящий подари на прощанье.Сияй звездой прекраснойСияй звездой прекраснойСияй звездой прекраснойЗабыл о чём-то важном...Засияй прекрасной звездой.Засияй прекрасной звездой.Засияй прекрасной звездой.Засияй прекрасной звездой.","Засияй прекрасной звездой.
Засияй прекрасной звездой.
Засияй прекрасной звездой.
Засияй прекрасной звездой.

Нет в прачечной толп людей, что за чудный день.
Пятну на белой рубашке ""прощай"" скажу наконец.
Но чей же? Но чей же?
В голове внезапно громкий голос зазвучал?
Этого хочу! И того хочу! Он мне сказал.

Так хотелось счастливым быть,
Жизнь спокойно прожить.
Лишь бы в руках удержать,
Всё, что ты в сердца глубине скрываешь.

Наполнив счастьем жизни до краев, покойся с миром
Быть может даже глубоко в кипящем Аду я отыщу приют.
Не нужно сострадания - смех звенящий подари на прощанье.

Сияй звездой прекрасной
Сияй звездой прекрасной
Сияй звездой прекрасной
Забыл о чём-то важном...

Засияй прекрасной звездой.
Засияй прекрасной звездой.
Засияй прекрасной звездой.
Засияй прекрасной звездой.",мусорка,14,2022-10-26T14:20:51Z,2022-10-26T14:20:51Z
魅力が溢れ過ぎている,魅力が溢れ過ぎている,わい。,7,2022-10-26T13:43:40Z,2022-10-26T13:43:40Z
米津さんの曲のMVって一癖あって何度見ても飽きない,米津さんの曲のMVって一癖あって何度見ても飽きない,りゅうのすけ さくらい,6,2022-10-26T13:50:57Z,2022-10-26T13:50:57Z
凄くいい歌詞だ,凄くいい歌詞だ,わにまる,5,2022-10-26T13:44:22Z,2022-10-26T13:44:22Z
曲がでるたびにその音楽が一番好きになるなんだよなぁ,曲がでるたびにその音楽が一番好きになるなんだよなぁ,ソドウ島の悪魔,6,2022-10-26T13:44:46Z,2022-10-26T13:44:46Z
歌だけでもすごいのにmvの満足感がやばいな…,歌だけでもすごいのにmvの満足感がやばいな…,ポケモンSV楽しみ,4,2022-10-26T13:52:10Z,2022-10-26T13:52:10Z
今日のライブ最高だった!!,今日のライブ最高だった!!,ウーロン茶 常温,6,2022-10-26T14:23:27Z,2022-10-26T14:23:27Z
ギャグが入っていて曲も中毒性があって見ても聞いても全然飽きないw,ギャグが入っていて曲も中毒性があって見ても聞いても全然飽きないw,ウイングマンダリアン,4,2022-10-26T13:52:56Z,2022-10-26T13:54:25Z
「「止まない雨はない」より先にその傘をくれよ 」字数は少ないのに、情報量が多い。古典を使った技術に過ぎないかもだけど、僕は鼻血が出るほど好きです。長年温めてたピースを、ようやくはめられる絵に米津さんが出会った、そんな高揚感を勝手に感じるほど、チェンソーマンにピッタリの歌詞だと思います。「良い子だけを迎える天国じゃ　どうも生きらんない」っていう歌詞には、地獄のような環境で生きる者の「天国は天国で退屈そうだから、自ら望んで天国を拒絶している」みたいな逞しさや反骨精神が伺えて好きです。地獄中毒者は天国みたいな世界じゃあもう満たされないんだろうなと思いました。,"「「止まない雨はない」より先にその傘をくれよ 」
字数は少ないのに、情報量が多い。古典を使った技術に過ぎないかもだけど、僕は鼻血が出るほど好きです。
長年温めてたピースを、ようやくはめられる絵に米津さんが出会った、そんな高揚感を勝手に感じるほど、チェンソーマンにピッタリの歌詞だと思います。
「良い子だけを迎える天国じゃ　どうも生きらんない」っていう歌詞には、地獄のような環境で生きる者の「天国は天国で退屈そうだから、自ら望んで天国を拒絶している」みたいな逞しさや反骨精神が伺えて好きです。地獄中毒者は天国みたいな世界じゃあもう満たされないんだろうなと思いました。",猫まみれ幸せ,5,2022-10-26T13:42:40Z,2022-10-26T13:42:40Z
ライブも最高でした😌,ライブも最高でした😌,Aoto,3,2022-10-26T13:46:49Z,2022-10-26T13:46:49Z
米津さんと常田さんが1つの画面に収まっていることに感動してます素敵な曲をありがとう！！,米津さんと常田さんが1つの画面に収まっていることに感動してます素敵な曲をありがとう！！,ンゴンゴゴ,7,2022-10-26T14:14:33Z,2022-10-26T14:14:33Z
"I expected this to be anything but a workout song.Love it,10/10.","I expected this to be anything but a workout song.
Love it,10/10.",Cali Qm,8,2022-10-26T13:52:58Z,2022-10-26T13:52:58Z
"Kenshi Yonezu's alter ego, with the biggest, strongest arms to boot: HACHI.","Kenshi Yonezu's alter ego, with the biggest, strongest arms to boot: HACHI.",elizabeth,2,2022-10-26T14:19:56Z,2022-10-26T14:19:56Z
うわー米津さんの曲の中で過去一好きです私的に,うわー米津さんの曲の中で過去一好きです私的に,moe,2,2022-10-26T13:51:44Z,2022-10-26T13:51:44Z
米津玄師の歌は私を狂わせる,米津玄師の歌は私を狂わせる,스카이카터,2,2022-10-26T13:39:03Z,2022-10-26T13:39:03Z
讃美歌の曲調でとんでもない事言ってるのすごくすき,讃美歌の曲調でとんでもない事言ってるのすごくすき,山田,3,2022-10-26T14:13:06Z,2022-10-26T14:13:06Z
好きすぎます……チェンソーマンのOPを手掛けると知った瞬間スマホ投げ出しそうになりました……素晴らしすぎてそろそろわたしの頭が禿げそうです( ੭⌯᷄ω⌯᷅ )これからも応援してます💪🔥,"好きすぎます……
チェンソーマンのOPを手掛けると知った瞬間スマホ投げ出しそうになりました……
素晴らしすぎてそろそろわたしの頭が禿げそうです( ੭⌯᷄ω⌯᷅ )
これからも応援してます💪🔥",紺,0,2022-10-26T13:37:07Z,2022-10-26T13:37:07Z
最近米津さんはユーモアを大切にしてるらしい,最近米津さんはユーモアを大切にしてるらしい,井上,2,2022-10-26T13:54:48Z,2022-10-26T13:54:48Z
超好聽,超好聽,允諾 陳,2,2022-10-26T14:20:04Z,2022-10-26T14:20:04Z
so good!,so good!,oreonero,2,2022-10-26T13:35:48Z,2022-10-26T13:35:48Z
最近のMVで1番癖強いの好き,最近のMVで1番癖強いの好き,Half Y,1,2022-10-26T13:40:41Z,2022-10-26T13:40:41Z
this is perfect,this is perfect,zen,0,2022-10-26T13:44:06Z,2022-10-26T13:44:06Z
Masterpiece,Masterpiece,Altero,0,2022-10-26T14:00:07Z,2022-10-26T14:00:07Z
ゆゆうたも言ってたけど何回も転調して気持ち悪いはずなのに頭から離れなくてかっこいいって思えるのマジで天才,ゆゆうたも言ってたけど何回も転調して気持ち悪いはずなのに頭から離れなくてかっこいいって思えるのマジで天才,山田太郎,3,2022-10-26T13:44:52Z,2022-10-26T13:44:52Z
幸せになりたい、楽していきていたい、努力の先にある輝く未来を欲してる感じが新しいですよね止まない雨はない(という上から目線の説得)よりその傘をくれよってところ凄く好きです🤭,"幸せになりたい、楽していきていたい、
努力の先にある輝く未来を欲してる感じが新しいですよね
止まない雨はない(という上から目線の説得)よりその傘をくれよ
ってところ凄く好きです🤭",長谷川ミミ,2,2022-10-26T14:25:04Z,2022-10-26T14:25:04Z
チェンソーマンの影響で国内より海外の視聴者が多く見るであろうこのMVでこんだけやらかしてるの好き,チェンソーマンの影響で国内より海外の視聴者が多く見るであろうこのMVでこんだけやらかしてるの好き,さいすり,3,2022-10-26T14:02:13Z,2022-10-26T14:02:13Z
曲の圧倒的センス、完敗なのだ〜。,曲の圧倒的センス、完敗なのだ〜。,Jangheon Ryu,2,2022-10-26T14:17:22Z,2022-10-26T14:17:22Z
"I wish I could listen to this song for the first time again, slaps so hard it never gets old. im so hyped for chainsawman anime to come out","I wish I could listen to this song for the first time again, slaps so hard it never gets old. im so hyped for chainsawman anime to come out",A/Z,1,2022-10-26T13:59:23Z,2022-10-26T13:59:23Z
aint no way this guy just made a kickass song for his workout montage,aint no way this guy just made a kickass song for his workout montage,Thái Đỗ Quốc,0,2022-10-26T14:01:36Z,2022-10-26T14:01:36Z
「努力 未来」って散々歌ってて筋トレもしてるのに最後に車から出てきた米津玄師がゴールかっさらうのマジでおもろい,「努力 未来」って散々歌ってて筋トレもしてるのに最後に車から出てきた米津玄師がゴールかっさらうのマジでおもろい,くり,2,2022-10-26T13:54:43Z,2022-10-26T13:54:43Z
悪ふざけが上手すぎる,悪ふざけが上手すぎる,林親,4,2022-10-26T14:16:35Z,2022-10-26T14:16:35Z
my man kenshi is too handsome that even truck-kun can't throw him to isekai.,my man kenshi is too handsome that even truck-kun can't throw him to isekai.,Natius Joshua,2,2022-10-26T13:49:52Z,2022-10-26T13:53:54Z
狂気じみててマジで好き,狂気じみててマジで好き,るい,0,2022-10-26T13:43:10Z,2022-10-26T13:43:10Z
Tremendo detalle de darle un poco de protagonismo al doble de riesgo que hacía las acrobacias jajajjasjasjasHermoso video y guion grafico.,"Tremendo detalle de darle un poco de protagonismo al doble de riesgo que hacía las acrobacias jajajjasjasjas

Hermoso video y guion grafico.",Xxlocful,7,2022-10-26T14:18:11Z,2022-10-26T14:18:11Z
I really liked the way he quarrel with Daiki!!!!!❤️‍🔥❤️‍🔥❤️‍🔥❤️‍🔥💥💥,I really liked the way he quarrel with Daiki!!!!!❤️‍🔥❤️‍🔥❤️‍🔥❤️‍🔥💥💥,マナ / Mana,1,2022-10-26T13:43:21Z,2022-10-26T13:44:52Z
米津さん、運転免許もってないから足トレしてる説が好きすぎる,米津さん、運転免許もってないから足トレしてる説が好きすぎる,水冷,4,2022-10-26T14:11:51Z,2022-10-26T14:11:51Z
This is also a pretty good workout song,This is also a pretty good workout song,JayantVermaYT,1,2022-10-26T13:57:14Z,2022-10-26T13:57:14Z
このMVの撮影絶対楽しい,このMVの撮影絶対楽しい,駄天使ジーク,2,2022-10-26T13:53:27Z,2022-10-26T13:53:27Z
音楽だけ聴いてるときは頭の中でチェーンソーンマンの映像流れてるから、画面見たときのムキムキ米津さんの衝撃半端ないw,音楽だけ聴いてるときは頭の中でチェーンソーンマンの映像流れてるから、画面見たときのムキムキ米津さんの衝撃半端ないw,ミラーマン。,1,2022-10-26T13:37:32Z,2022-10-26T13:37:32Z
いつもそうだが神曲と書いて新曲と読むにふさわしい,いつもそうだが神曲と書いて新曲と読むにふさわしい,アカハラタモリ,2,2022-10-26T13:48:24Z,2022-10-26T13:48:24Z
曲凄く良いのに映像面白すぎて頭に入ってこんだ😂,曲凄く良いのに映像面白すぎて頭に入ってこんだ😂,ふなま,2,2022-10-26T14:00:10Z,2022-10-26T14:00:10Z
曲もリズムが良くて声がいいから聞いてるとテンション上がる,曲もリズムが良くて声がいいから聞いてるとテンション上がる,りゅうのすけ さくらい,1,2022-10-26T14:05:54Z,2022-10-26T14:05:54Z
MVが毎度予想外過ぎるのよww,MVが毎度予想外過ぎるのよww,シリア さ,2,2022-10-26T13:59:09Z,2022-10-26T13:59:09Z
よくよく考えたらこのMV情報量の塊,よくよく考えたらこのMV情報量の塊,ベーコンベーコン,1,2022-10-26T13:58:22Z,2022-10-26T13:58:22Z
米津玄師最高!米津玄師最高!,"米津玄師最高!
米津玄師最高!",KAIKAI,0,2022-10-26T13:44:44Z,2022-10-26T13:44:44Z
こんな米津さんも滅茶好きや🥰,こんな米津さんも滅茶好きや🥰,ram,0,2022-10-26T13:37:17Z,2022-10-26T13:37:17Z
this mv is like a fever dream 💀,this mv is like a fever dream 💀,maestro,2,2022-10-26T14:24:37Z,2022-10-26T14:24:37Z
なんだこのすごいMV,なんだこのすごいMV,S H U N,1,2022-10-26T13:47:49Z,2022-10-26T13:47:49Z
あの頃の米津玄師と最近の米津玄師の良いとこどりな感じアツい,あの頃の米津玄師と最近の米津玄師の良いとこどりな感じアツい,ウパシチリ,1,2022-10-26T14:14:10Z,2022-10-26T14:14:10Z
ついったでふざけてるとか言われてたけどオシャレmvじゃないっすか！,ついったでふざけてるとか言われてたけどオシャレmvじゃないっすか！,ああ,3,2022-10-26T13:51:49Z,2022-10-26T13:51:49Z
The MV is just Gym Motivation for those still sweaty Makima Fans after chapter 89,The MV is just Gym Motivation for those still sweaty Makima Fans after chapter 89,A WeebTaku,1,2022-10-26T14:17:46Z,2022-10-26T14:17:46Z
これが筋肉の悪魔か......,これが筋肉の悪魔か......,norumaki,4,2022-10-26T14:18:58Z,2022-10-26T14:18:58Z
米津さんがめっちゃ体張ってる✨✨そりゃあ、片手でバーベル持ち上げているのを目の当たりにしたら頑張っちゃうよねw,"米津さんがめっちゃ体張ってる✨✨
そりゃあ、片手でバーベル持ち上げているのを目の当たりにしたら頑張っちゃうよねw",うまみ成分,2,2022-10-26T14:17:13Z,2022-10-26T14:17:13Z
ミックスナッツといい廻廻奇譚といい激しいアニソンはハズレがない,ミックスナッツといい廻廻奇譚といい激しいアニソンはハズレがない,Nagi X,1,2022-10-26T13:50:54Z,2022-10-26T13:50:54Z
絶対急上昇一位取る男,絶対急上昇一位取る男,イユル　iyuru,0,2022-10-26T13:57:32Z,2022-10-26T13:57:32Z
筋肉の悪魔アニメにいないと思ったら米津玄師と契約してMVに出てたのか,筋肉の悪魔アニメにいないと思ったら米津玄師と契約してMVに出てたのか,TOM,2,2022-10-26T14:17:55Z,2022-10-26T14:17:55Z
ホラー展開、最後まで楽しませてくれる,ホラー展開、最後まで楽しませてくれる,こめあい,1,2022-10-26T13:38:04Z,2022-10-26T13:38:04Z
サイコーー,サイコーー,ピョン吉,1,2022-10-26T14:18:33Z,2022-10-26T14:18:33Z
努力　未来　a beautiful star ってフレーズを考えたつんく♂もまた神やな。モーニング娘。でも当時人気曲やったけど、またこのフレーズが使われる日がくるとは…,"努力　未来　a beautiful star ってフレーズを考えたつんく♂もまた神やな。
モーニング娘。でも当時人気曲やったけど、またこのフレーズが使われる日がくるとは…",i siba,2,2022-10-26T13:53:52Z,2022-10-26T13:53:52Z
米津玄師が筋トレしてんのなんかシュールでおもろい,米津玄師が筋トレしてんのなんかシュールでおもろい,ゆずこしょう,1,2022-10-26T13:53:44Z,2022-10-26T13:53:44Z
"1:14カットされたので代わりに""筋肉の悪魔""になる米津玄師","1:14
カットされたので
代わりに""筋肉の悪魔""になる米津玄師",ﾄﾞｸﾀｰ ﾏｯｷﾞﾈｽ,2,2022-10-26T13:51:30Z,2022-10-26T13:51:58Z
なんとなくMAD HEAD LOVEを思い出した。めちゃくちゃで狂ってる感じ、最高。,なんとなくMAD HEAD LOVEを思い出した。めちゃくちゃで狂ってる感じ、最高。,m,2,2022-10-26T13:48:07Z,2022-10-26T13:48:07Z
真面目な顔でコミカルな米津玄師オモロw,真面目な顔でコミカルな米津玄師オモロw,おゆみ,1,2022-10-26T14:06:47Z,2022-10-26T14:06:47Z
"MY ACTUAL IDOL, LETS FCKN GOOOOOOOOOOOOOOOOOO","MY ACTUAL IDOL, LETS FCKN GOOOOOOOOOOOOOOOOOO",アンジェラ____神々,1,2022-10-26T14:24:44Z,2022-10-26T14:24:44Z
米津玄師と常田大希の最強タッグ。神曲すぎる。幸せ。,"米津玄師と常田大希の最強タッグ。
神曲すぎる。幸せ。",m user,3,2022-10-26T13:46:14Z,2022-10-26T13:46:14Z
「努力未来～」の歌詞、つんく♂さんにお借りしたって聞いてどんな仕上がりになるんだ！とワクワクしてた！米津カラーが濃いから、しばらくあの歌詞だって気づけなかった,"「努力未来～」の歌詞、つんく♂さんにお借りしたって聞いてどんな仕上がりになるんだ！とワクワクしてた！
米津カラーが濃いから、しばらくあの歌詞だって気づけなかった",None,2,2022-10-26T13:53:27Z,2022-10-26T13:53:27Z
筋肉の悪魔がここで回収されるのか…,筋肉の悪魔がここで回収されるのか…,キム次郎ナスの夜一,0,2022-10-26T14:03:50Z,2022-10-26T14:03:50Z
このチープさがたまらんw,このチープさがたまらんw,crouch-jp,2,2022-10-26T14:13:14Z,2022-10-26T14:13:14Z
awesome,awesome,Diego González,1,2022-10-26T14:13:08Z,2022-10-26T14:13:08Z
チェンソーマンみたいなイカれた世界観にめちゃめちゃマッチしてるこのMV,チェンソーマンみたいなイカれた世界観にめちゃめちゃマッチしてるこのMV,あ,2,2022-10-26T14:07:27Z,2022-10-26T14:07:27Z
アニメで飛ばされた筋肉の悪魔に取り憑かれてる説大好き,アニメで飛ばされた筋肉の悪魔に取り憑かれてる説大好き,ふぅくん,1,2022-10-26T13:57:36Z,2022-10-26T13:57:36Z
どうしたらこんな中毒性すげぇ曲作れるんですか,どうしたらこんな中毒性すげぇ曲作れるんですか,たそたそ,0,2022-10-26T13:43:49Z,2022-10-26T13:43:49Z
MAPPA「ちゃんとしたPVは米津玄師の方が作るやろ」米津「ちゃんとしたPVはMAPPAの方が作るやろ」,"MAPPA「ちゃんとしたPVは米津玄師の方が作るやろ」
米津「ちゃんとしたPVはMAPPAの方が作るやろ」",Doopo K,11,2022-10-26T13:50:49Z,2022-10-26T13:50:49Z
初っ端からすごい筋トレしててなんか笑っちゃった,初っ端からすごい筋トレしててなんか笑っちゃった,もこ,1,2022-10-26T14:08:09Z,2022-10-26T14:08:09Z
まじでビュチフッル•スター......,まじでビュチフッル•スター......,rowheart c,0,2022-10-26T13:35:19Z,2022-10-27T09:42:02Z
米津最高！米津最高！！オマエも米津最高と叫びなさい！！,"米津最高！米津最高！！
オマエも米津最高と叫びなさい！！",お茶,4,2022-10-26T14:10:56Z,2022-10-26T14:10:56Z
筋肉の悪魔は米津玄師だったんやな。,筋肉の悪魔は米津玄師だったんやな。,あくは,1,2022-10-26T14:08:45Z,2022-10-26T14:08:45Z
筋肉の悪魔の伏線回収きたwwww,筋肉の悪魔の伏線回収きたwwww,しろう,4,2022-10-26T14:23:44Z,2022-10-26T14:23:44Z
MVの米津さん、｢なんだアイツ、ムキムキでかっこいい……おれもああなりたい！うおおお！｣って感じに見えて笑いが止まらん😂,MVの米津さん、｢なんだアイツ、ムキムキでかっこいい……おれもああなりたい！うおおお！｣って感じに見えて笑いが止まらん😂,Miruki -,4,2022-10-26T14:16:49Z,2022-10-26T14:16:49Z
常田さん友情出演ということを聞いてようやくこのPVの米津さんがPV中に得た努力、友情、未来という普通のものが女性の笑い声の後に一瞬で消える＝マキマさんに与えられたもの全てをマキマさんに全て壊されたデンジと同じ状態を表している事に気がついて吐血した。,常田さん友情出演ということを聞いてようやくこのPVの米津さんがPV中に得た努力、友情、未来という普通のものが女性の笑い声の後に一瞬で消える＝マキマさんに与えられたもの全てをマキマさんに全て壊されたデンジと同じ状態を表している事に気がついて吐血した。,河本忍,3,2022-10-26T13:54:58Z,2022-10-26T13:54:58Z
最高じゃあないすか‥,最高じゃあないすか‥,あぶさん,0,2022-10-26T14:01:33Z,2022-10-26T14:01:33Z
チェーンソーのキックバック現象の事かと思わせ、まさかの筋トレの方っていう米津玄師ニヤニヤしながらMV撮影してそう,"チェーンソーのキックバック現象の事かと思わせ、まさかの筋トレの方っていう
米津玄師ニヤニヤしながらMV撮影してそう",庭のセイタカアワダチソウが俺の身長を抜きました,2,2022-10-26T13:47:41Z,2022-10-26T13:47:41Z
めちゃくちゃいい曲じゃなぁデンジぃ！…これワシが作った曲じゃないか？　ワシが作った曲じゃよな…ワシが作った曲じゃ！！！,"めちゃくちゃいい曲じゃなぁデンジぃ！
…これワシが作った曲じゃないか？　ワシが作った曲じゃよな…ワシが作った曲じゃ！！！",フクー,3,2022-10-26T13:52:24Z,2022-10-26T13:52:24Z
一生聴いてる,一生聴いてる,大腸菌,2,2022-10-26T13:49:12Z,2022-10-26T13:49:12Z
常田さんビジュ良すぎ,常田さんビジュ良すぎ,オニオンサーモン,3,2022-10-26T14:23:02Z,2022-10-26T14:23:02Z
1番好き,1番好き,やましゅん,1,2022-10-26T14:16:18Z,2022-10-26T14:16:18Z
カラオケのMVどうなるんだ...？このカオスなMVに対抗できるんか？,"カラオケのMVどうなるんだ...？
このカオスなMVに対抗できるんか？",そいぎんた,3,2022-10-26T14:07:49Z,2022-10-26T14:07:49Z
チェンソーマン  × 米津玄師  × King Gnu常田＝筋トレなるほど。,"チェンソーマン  × 米津玄師  × King Gnu常田
＝筋トレ
なるほど。",pon,3,2022-10-26T13:36:30Z,2022-10-26T13:36:30Z
モーニング娘。のウィアラはいきなりロシア民謡が始まるぶっ飛んだ曲なんだけど、この曲もいきなりクラシックが始まるぶっ飛んだ曲ですっごく好き,モーニング娘。のウィアラはいきなりロシア民謡が始まるぶっ飛んだ曲なんだけど、この曲もいきなりクラシックが始まるぶっ飛んだ曲ですっごく好き,みじんこ,1,2022-10-26T13:37:37Z,2022-10-26T13:37:37Z
2:37のコーラス好きすぎる後ろでハモッてる人誰か気になる,"2:37のコーラス好きすぎる
後ろでハモッてる人誰か気になる",Afundeyy,0,2022-10-26T14:06:09Z,2022-10-26T14:06:09Z
なんかもう新曲出す度急上昇1位の座かっさらってくじゃんw,なんかもう新曲出す度急上昇1位の座かっさらってくじゃんw,ELZ,1,2022-10-26T13:39:34Z,2022-10-26T13:39:34Z
2:19 車のナンバー、ハチなの熱いね！！,2:19 車のナンバー、ハチなの熱いね！！,yuki kusano,1,2022-10-26T14:22:44Z,2022-10-26T14:23:22Z
2:06ここホント好き,2:06ここホント好き,ああ,1,2022-10-26T14:12:23Z,2022-10-26T14:12:23Z
カットされた筋肉の悪魔がPV乗っ取るとは誰も思ってなかったわ,カットされた筋肉の悪魔がPV乗っ取るとは誰も思ってなかったわ,LL,1,2022-10-26T13:51:04Z,2022-10-26T13:51:04Z
"Schizophrenia being the drive to exercise, incredible","Schizophrenia being the drive to exercise, incredible",Alternetic,1,2022-10-26T14:22:31Z,2022-10-26T14:22:31Z
Twitterで筋肉の悪魔って言われててダメだった,Twitterで筋肉の悪魔って言われててダメだった,稲妻強盗 蝮のお銀,4,2022-10-26T14:16:37Z,2022-10-26T14:16:37Z
奇才すぎるｗｗｗｗｗ,奇才すぎるｗｗｗｗｗ,てぃーけー,0,2022-10-26T13:42:42Z,2022-10-26T13:42:42Z
アニメカットされたと思ったらここに筋肉の悪魔出よったw,アニメカットされたと思ったらここに筋肉の悪魔出よったw,クズ神,2,2022-10-26T14:09:41Z,2022-10-26T14:09:41Z
