textDisplay,textOriginal,authorDisplayName,likeCount,publishedAt,updatedAt
脈アリニキ、やっぱり空気感が段違いに面白い,脈アリニキ、やっぱり空気感が段違いに面白い,ピヨグチ,0,2022-10-26T15:14:39Z,2022-10-26T15:14:39Z
一発目にav女優にインタビュー行くのなんか好き笑,一発目にav女優にインタビュー行くのなんか好き笑,幕之内一歩,10,2022-10-26T12:52:29Z,2022-10-26T12:52:29Z
強くてかわいい和田さん推します,強くてかわいい和田さん推します,太郎 モバイル,9,2022-10-26T10:17:13Z,2022-10-26T10:17:13Z
海くんの棒読み感が好き,海くんの棒読み感が好き,アルヨ,0,2022-10-27T04:09:07Z,2022-10-27T04:09:07Z
ニヤニヤスケベな海は兄貴を越えることないよな、恥ずかしいから本気出してほしいぞ,ニヤニヤスケベな海は兄貴を越えることないよな、恥ずかしいから本気出してほしいぞ,YO Tube,1,2022-10-26T12:00:07Z,2022-10-26T12:00:07Z
パックネキのお腹のタプタプ感、あのくらいがちょうどいいんだよなぁ。好き。,パックネキのお腹のタプタプ感、あのくらいがちょうどいいんだよなぁ。好き。,tk sm,69,2022-10-26T10:21:25Z,2022-10-26T10:21:25Z
試合が終わったらゲンキ君に英会話教えてもらう仲になったら良いな🎵,試合が終わったらゲンキ君に英会話教えてもらう仲になったら良いな🎵,kj ng,1,2022-10-26T11:13:11Z,2022-10-26T11:13:11Z
フルコンのチャンピオンちょっとぽっちゃりでかわいい,フルコンのチャンピオンちょっとぽっちゃりでかわいい,小栗旬,3,2022-10-26T10:51:13Z,2022-10-26T10:51:13Z
海、八方美人だな。みんなに笑顔じゃ怪我人でるぞ,"海、八方美人だな。
みんなに笑顔じゃ怪我人でるぞ",金城大,14,2022-10-26T12:54:30Z,2022-10-26T12:54:30Z
やっぱ今回のオーディションは女子枠が最高なんだよねー,"やっぱ今回のオーディションは
女子枠が最高なんだよねー",S S,10,2022-10-26T10:48:01Z,2022-10-26T10:48:01Z
パックネキお腹だらしなくて好き,パックネキお腹だらしなくて好き,ぺぺ,1,2022-10-26T16:56:12Z,2022-10-26T16:56:12Z
エンメール着てる美女ドッキリでみらたむ出てたのに初めましての雰囲気出す海ピョン😹,エンメール着てる美女ドッキリでみらたむ出てたのに初めましての雰囲気出す海ピョン😹,ひ こ,17,2022-10-26T10:11:47Z,2022-10-26T10:11:47Z
緒方さん、ファンになったわw,緒方さん、ファンになったわw,tenチャンネル,4,2022-10-26T12:43:03Z,2022-10-26T12:43:03Z
RIZINはベラ対抗戦が決まって盛り上がってるのに対して海はブレイキングダウン…,RIZINはベラ対抗戦が決まって盛り上がってるのに対して海はブレイキングダウン…,偽ゆき,6,2022-10-26T13:36:13Z,2022-10-26T13:36:13Z
6:40 息ぴったりすぎる,6:40 息ぴったりすぎる,ki -,5,2022-10-26T11:09:35Z,2022-10-26T11:09:51Z
確かに女子のが面白い‼️双子に盛り上げて欲しい‼️,確かに女子のが面白い‼️双子に盛り上げて欲しい‼️,【M】,0,2022-10-26T21:14:20Z,2022-10-26T21:22:45Z
SATORUは喋りからラッパーのユーモアがあっていいね,SATORUは喋りからラッパーのユーモアがあっていいね,yoyo,4,2022-10-26T11:22:18Z,2022-10-26T11:22:18Z
全盛期のK-1復活してくれんかなー。マークハントとかの時代に。,"全盛期のK-1復活してくれんかなー。
マークハントとかの時代に。",saku,0,2022-10-27T08:54:36Z,2022-10-27T08:54:36Z
まさお最高ウケるの俺だけ笑？,まさお最高ウケるの俺だけ笑？,桜,5,2022-10-26T11:42:43Z,2022-10-26T11:42:43Z
バンさんがカッコ良すぎてやばい！,バンさんがカッコ良すぎてやばい！,ピケ,3,2022-10-26T11:49:51Z,2022-10-26T11:49:51Z
バンさん、好きになってしまう。,バンさん、好きになってしまう。,ナデナデ,2,2022-10-26T12:09:06Z,2022-10-26T12:09:06Z
とにかくちゃんよたが可愛すぎる！！！,とにかくちゃんよたが可愛すぎる！！！,アイアンマン玉毛,3,2022-10-26T12:27:46Z,2022-10-26T12:28:08Z
あのハーフ兄弟ドラマみたいで好きすぎる,あのハーフ兄弟ドラマみたいで好きすぎる,Rin ta,18,2022-10-26T10:10:55Z,2022-10-26T10:10:55Z
この双子格闘技経験ないって本当！？強そう...,"この双子格闘技経験ないって本当！？
強そう...",山田さん,0,2022-10-26T13:32:35Z,2022-10-26T13:32:35Z
緒方がんばれ！しばいてくれ！,緒方がんばれ！しばいてくれ！,ジョマ,35,2022-10-26T10:20:05Z,2022-10-26T10:20:05Z
当たり前だけどRIZINの会見見た後だと温度差半端ない,当たり前だけどRIZINの会見見た後だと温度差半端ない,迷子,4,2022-10-26T10:27:27Z,2022-10-26T10:27:27Z
朝倉兄弟にはブレイキングダウンより自分達の格闘技に専念してほしい。時間は限られてるよ,朝倉兄弟にはブレイキングダウンより自分達の格闘技に専念してほしい。時間は限られてるよ,chan meme,2,2022-10-26T13:59:42Z,2022-10-26T13:59:42Z
こめおも女子枠でいいんじゃない？,こめおも女子枠でいいんじゃない？,ハゲカッパ,52,2022-10-26T10:10:26Z,2022-10-26T10:10:26Z
やっぱ仲村さんカッコイイなー(^^)憧れる,やっぱ仲村さんカッコイイなー(^^)憧れる,夏目浩,0,2022-10-26T14:54:15Z,2022-10-26T14:54:15Z
このマネージャーの輩感よ笑笑上原美優のマネージャー思い出して、心臓がキュンなるわ、、、ややこしい事務所の子とか一杯いるんだろうな、、、,"このマネージャーの輩感よ笑笑
上原美優のマネージャー思い出して、心臓がキュンなるわ、、、
ややこしい事務所の子とか一杯いるんだろうな、、、",あいみしか勝たん！,1,2022-10-26T13:09:13Z,2022-10-26T13:09:13Z
バン仲村割と素直に言うんやね流石に1000万円はビビってたみたいだし,"バン仲村割と素直に言うんやね
流石に1000万円はビビってたみたいだし",のりお,8,2022-10-26T10:16:03Z,2022-10-26T10:16:03Z
バンさんが敬語なのが好印象です,バンさんが敬語なのが好印象です,かっぱ君,0,2022-10-26T13:52:16Z,2022-10-26T13:52:16Z
海くんはちゃんと「延々」って言ってるのに字幕が「永遠」になってて編集してる人頑張って！って思った,海くんはちゃんと「延々」って言ってるのに字幕が「永遠」になってて編集してる人頑張って！って思った,すわたま,27,2022-10-26T11:08:53Z,2022-10-26T11:08:53Z
海くん、映像の中であなたが1番強いから！,海くん、映像の中であなたが1番強いから！,苦殺乃撚吏負タヒ韲ン屠屔不乃爆タヒ翹ン怒痘瘡焼艫芋薯灤禿下愚痴苦殺病膂蔢荂灕,1,2022-10-26T11:48:24Z,2022-10-26T11:48:24Z
8:05 ほんまに1番輝いてる声質も容姿も何から何までおもろいwww,"8:05 ほんまに1番輝いてる
声質も容姿も何から何までおもろいwww",ym_ym,25,2022-10-26T10:35:08Z,2022-10-26T10:35:08Z
11:55海「代表ですから」代表「yeah…」,"11:55
海「代表ですから」
代表「yeah…」",矢野太我,13,2022-10-26T10:45:51Z,2022-10-26T10:45:51Z
バンさんの裏で、暇そうにしてるチョンツーエイおもろ,バンさんの裏で、暇そうにしてるチョンツーエイおもろ,HoneyLion,2,2022-10-26T12:49:15Z,2022-10-26T12:49:15Z
オーディション金払うからカットしたとこも全部見せて欲しい,オーディション金払うからカットしたとこも全部見せて欲しい,白ちゃん,2,2022-10-26T11:27:01Z,2022-10-26T11:27:01Z
緒方ちゃん楽しみだ！,緒方ちゃん楽しみだ！,スパつる,4,2022-10-26T12:48:07Z,2022-10-26T12:48:07Z
真っ先にちゃんよたのとこ行っててさすがです,真っ先にちゃんよたのとこ行っててさすがです,wnnn,1,2022-10-26T16:17:19Z,2022-10-26T16:17:19Z
2対1は本当に見てて気分悪かったわ。緒方さん頑張ってください！！！,"2対1は本当に見てて気分悪かったわ。
緒方さん頑張ってください！！！",のあ,15,2022-10-26T11:24:49Z,2022-10-26T11:25:43Z
ちゃんよた、頑張れ〜！,ちゃんよた、頑張れ〜！,ロイ,4,2022-10-26T10:45:13Z,2022-10-26T10:45:13Z
凶器攻撃で後遺症残るレベルの怪我させるのはさすがにやばすぎ。盛り上がったら何でもいいならナイフで刺すのもありなんかって話になる,凶器攻撃で後遺症残るレベルの怪我させるのはさすがにやばすぎ。盛り上がったら何でもいいならナイフで刺すのもありなんかって話になる,たんたん,9,2022-10-26T13:01:56Z,2022-10-26T13:01:56Z
おかっぱの女の子や緒方ゆりなさんたくさんインタビューしてあげてありがとうございました😃,おかっぱの女の子や緒方ゆりなさんたくさんインタビューしてあげてありがとうございました😃,Yume,8,2022-10-26T10:42:52Z,2022-10-26T10:42:52Z
みらたむって人、田舎のヤンキー娘コンビみたいなのでよくみるドラッグストアとかコンビニで大声で話してるタイプだよね,"みらたむって人、田舎のヤンキー娘コンビみたいなのでよくみる
ドラッグストアとかコンビニで大声で話してるタイプだよね",ほたる,34,2022-10-26T10:22:31Z,2022-10-26T10:22:31Z
ちゃんよたの声好きだわ,ちゃんよたの声好きだわ,田海,2,2022-10-26T12:49:04Z,2022-10-26T12:49:04Z
3:53カットされてたけど緒方さん本人のTwitterの投稿にあるけどイスを使われて怪我をされたとの事😢😢,"3:53

カットされてたけど
緒方さん本人のTwitterの投稿にあるけどイスを使われて怪我をされたとの事😢😢",morye film,13,2022-10-26T11:38:03Z,2022-10-26T11:38:03Z
バンちゃん最高！,バンちゃん最高！,たーちゃん,5,2022-10-26T10:08:37Z,2022-10-26T10:08:37Z
海は優しいな～ちゃんと話聞いてあげて。お兄さんどうでもいい話の時の顔怖いよ～,海は優しいな～ちゃんと話聞いてあげて。お兄さんどうでもいい話の時の顔怖いよ～,yuuki0815 m,1,2022-10-26T12:52:44Z,2022-10-26T12:52:44Z
海は当たりが柔らかいしインタビュー上手い😊,海は当たりが柔らかいしインタビュー上手い😊,t so,0,2022-10-26T21:19:23Z,2022-10-26T21:19:23Z
運営としては飲酒、武器攻撃を許すのですか？実際怪我をしている訳ですから傷害事件ですよ！最低限のルールがないと見てい気分悪い,"運営としては飲酒、武器攻撃を許すのですか？実際怪我をしている訳ですから傷害事件ですよ！
最低限のルールがないと見てい気分悪い",KING,8,2022-10-26T12:55:07Z,2022-10-26T12:55:07Z
海君のインタビュー。かわぇー、みんな優しい人になってるけど、海君の試合が一番観たいよー,海君のインタビュー。かわぇー、みんな優しい人になってるけど、海君の試合が一番観たいよー,松崎焚き火作法,0,2022-10-27T09:19:52Z,2022-10-27T09:19:52Z
みらたむといーたろがリング上でぶっ飛ばされるの楽しみにしてます,みらたむといーたろがリング上でぶっ飛ばされるの楽しみにしてます,あ,22,2022-10-26T11:01:51Z,2022-10-26T11:01:51Z
オーディション裏ではみんな仲良いと思ってたけど違った,オーディション裏ではみんな仲良いと思ってたけど違った,あ あ,0,2022-10-27T10:43:26Z,2022-10-27T10:43:26Z
まさお好きすぎるww,まさお好きすぎるww,アリアナフレンズ,6,2022-10-26T10:51:28Z,2022-10-26T10:51:28Z
バン中村の腕の組み方がもう余裕を感じるよね…笑,バン中村の腕の組み方がもう余裕を感じるよね…笑,伊藤智哉,5,2022-10-26T11:42:39Z,2022-10-26T11:42:39Z
オーディションで飲酒はやめさせた方がいいかと,"オーディションで飲酒は
やめさせた方がいいかと",hiiro hiiro,7,2022-10-26T12:41:10Z,2022-10-26T12:41:10Z
裏でもあんな風にウザ絡みしてるなんてエンターテイメントではないね。,裏でもあんな風にウザ絡みしてるなんてエンターテイメントではないね。,Y D,34,2022-10-26T10:36:19Z,2022-10-26T10:36:19Z
9:55悲しそうで可愛い,9:55悲しそうで可愛い,エンタメ侍,5,2022-10-26T10:46:23Z,2022-10-26T10:46:23Z
バン仲村さんがツボ過ぎる,バン仲村さんがツボ過ぎる,ゴア・マクベ,1,2022-10-26T11:04:38Z,2022-10-26T11:04:38Z
格闘技やってるガチ勢、TikTokなどのインフルエンサー勢が目立ってるけど、気合だけで戦う根性勢に期待！今回誰だろう,格闘技やってるガチ勢、TikTokなどのインフルエンサー勢が目立ってるけど、気合だけで戦う根性勢に期待！今回誰だろう,しゅらいむ,1,2022-10-26T10:51:27Z,2022-10-26T10:51:27Z
ブレイキングダウンならではじゃなくなってしまうけど、女子1R制じゃなく決着つくまで見たい。,ブレイキングダウンならではじゃなくなってしまうけど、女子1R制じゃなく決着つくまで見たい。,岬チャンネル,1,2022-10-26T17:03:20Z,2022-10-26T17:03:20Z
なるほど、裏側ですか急上昇おめでとうございます,"なるほど、裏側ですか
急上昇おめでとうございます",Chainsaw Man,0,2022-10-27T05:50:16Z,2022-10-27T05:50:16Z
双子サワやんとやって欲しいと思ってるの俺だけ？,"双子
サワやんとやって欲しいと思ってるの俺だけ？",める,3,2022-10-26T11:34:06Z,2022-10-26T11:54:33Z
SATORUが好きすぎる,SATORUが好きすぎる,ばっどなっつ,1,2022-10-26T13:42:50Z,2022-10-26T13:42:50Z
年末出て欲しいわベラトール戦,"年末出て欲しいわ
ベラトール戦",いっくん,0,2022-10-27T08:58:11Z,2022-10-27T08:58:11Z
ちゃんよた最高やな,ちゃんよた最高やな,あな,3,2022-10-26T10:49:04Z,2022-10-26T10:49:04Z
SATORUかっこええいい雰囲気纏ってるわ,"SATORUかっこええ
いい雰囲気纏ってるわ",タマウ・ラカユイ,0,2022-10-27T08:10:37Z,2022-10-27T08:10:37Z
なんか兄貴を裏で支える(?)弟っていいよなぁ,なんか兄貴を裏で支える(?)弟っていいよなぁ,醤油,4,2022-10-26T13:54:11Z,2022-10-26T13:54:11Z
2対1でパイプ椅子使っちゃうのは弱さを証明してる,2対1でパイプ椅子使っちゃうのは弱さを証明してる,H I,3,2022-10-26T15:57:30Z,2022-10-26T15:57:30Z
流石になんぼなんぼにも坂口あんりさんが色々心配んなってくるよな。どつきあいの喧嘩した事無い上に荒れまくった状況にも対応できるかどうか……。嫌味じゃなくてマジで大怪我んならんようにしてほしい。へずま嫁さんとの一戦。２人共好印象あったんでお互いの健闘を祈ります。双子兄弟さん。いかしてる。『オレら２人』て言い方が粋。バン仲村さんはジョークも本気もセンスありますよね。,"流石になんぼなんぼにも坂口あんりさんが色々心配んなってくるよな。どつきあいの喧嘩した事無い上に荒れまくった状況にも対応できるかどうか……。
嫌味じゃなくてマジで大怪我んならんようにしてほしい。
へずま嫁さんとの一戦。２人共好印象あったんでお互いの健闘を祈ります。
双子兄弟さん。いかしてる。
『オレら２人』て言い方が粋。
バン仲村さんはジョークも本気もセンスありますよね。",sir. crocodile,3,2022-10-26T11:44:00Z,2022-10-26T11:56:50Z
緒方さん本当に可哀想,緒方さん本当に可哀想,N A,20,2022-10-26T10:41:52Z,2022-10-26T10:41:52Z
バン仲村氏は、らんま1/2に登場した校長先生（アロハでウクレレ持ってたキャラ）に似ていると思うのだけれど、分かる人いるかなあ。,バン仲村氏は、らんま1/2に登場した校長先生（アロハでウクレレ持ってたキャラ）に似ていると思うのだけれど、分かる人いるかなあ。,synch vn,4,2022-10-26T13:52:02Z,2022-10-26T13:52:02Z
堀弁護士にいって、民事裁判してあげてください。主催者にも損害賠償して。警察には被害届だして刑事事件をだしましょう。うやむやにするの反対です。証拠映像あるわけだし。,堀弁護士にいって、民事裁判してあげてください。主催者にも損害賠償して。警察には被害届だして刑事事件をだしましょう。うやむやにするの反対です。証拠映像あるわけだし。,中島一,5,2022-10-26T10:36:33Z,2022-10-26T10:36:33Z
サムネ好きすぎる！,サムネ好きすぎる！,マキシマムキノコ,3,2022-10-26T10:31:44Z,2022-10-26T10:31:44Z
空手の達人同士の女子対決は熱いなぁ～あとsatoru は雰囲気あって好きだわ煽りも不快じゃない。,"空手の達人同士の女子対決は熱いなぁ～
あとsatoru は雰囲気あって好きだわ
煽りも不快じゃない。",白恋,0,2022-10-27T10:19:51Z,2022-10-27T10:19:51Z
海くんの雰囲気超いいな海くんのこと嫌いな人いなそう,海くんの雰囲気超いいな海くんのこと嫌いな人いなそう,69コール,0,2022-10-26T17:46:26Z,2022-10-26T17:46:26Z
正直この中村さんと１０人ニキの２人はを司会にしてもいい位だな,正直この中村さんと１０人ニキの２人はを司会にしてもいい位だな,カマキリブログ,2,2022-10-26T15:55:43Z,2022-10-26T15:55:43Z
バン中村がインタビュー受けてる時チョンツーウェイにしか目がいかない笑笑,バン中村がインタビュー受けてる時チョンツーウェイにしか目がいかない笑笑,じゅん かねこ,4,2022-10-26T12:50:52Z,2022-10-26T12:50:52Z
ちゃんよた出場は嬉しい！　女子は丸々カットされてるグループあるよね？,ちゃんよた出場は嬉しい！　女子は丸々カットされてるグループあるよね？,エルモ,1,2022-10-26T21:31:45Z,2022-10-26T21:31:45Z
ちゃんよた可愛すぎる！,ちゃんよた可愛すぎる！,まる,2,2022-10-26T10:53:25Z,2022-10-26T10:53:25Z
あの暴力された方全治4週間とか見たけど大丈夫かな？海くん怪我の様子とか聞いてみて欲しかった。,あの暴力された方全治4週間とか見たけど大丈夫かな？海くん怪我の様子とか聞いてみて欲しかった。,AKKI's art and diy,14,2022-10-26T10:31:07Z,2022-10-26T10:31:07Z
ちょっと喧嘩道やりたくなってきてる自分がいる,ちょっと喧嘩道やりたくなってきてる自分がいる,Roronoa Zoro,1,2022-10-26T15:00:17Z,2022-10-26T15:00:17Z
アフターニキ、素人に毛が生えた程度なんでどっこいどっこいの勝負出来るって煽ってない風煽り好き,アフターニキ、素人に毛が生えた程度なんでどっこいどっこいの勝負出来るって煽ってない風煽り好き,オポチュニティ,0,2022-10-26T17:52:08Z,2022-10-26T17:52:08Z
脈アリニキ好きだわー,脈アリニキ好きだわー,まちもち,3,2022-10-26T10:52:28Z,2022-10-26T10:52:28Z
海君の好みがわかるねー笑,海君の好みがわかるねー笑,kawasakistm22,0,2022-10-26T15:01:25Z,2022-10-26T15:01:25Z
極真のチャンピオンは、お腹が結構ダブついてるけど、ブランクは何年位有るのかな、チャンピオンの名に恥じない様に頑張れよ。,極真のチャンピオンは、お腹が結構ダブついてるけど、ブランクは何年位有るのかな、チャンピオンの名に恥じない様に頑張れよ。,kouki,1,2022-10-26T11:08:58Z,2022-10-26T11:08:58Z
比嘉兄弟に期待！,比嘉兄弟に期待！,ハリーケイン小杉,2,2022-10-26T11:28:40Z,2022-10-26T11:28:40Z
海は安心するw,海は安心するw,sena,2,2022-10-26T11:12:37Z,2022-10-26T11:12:37Z
お尻痛かった説は少し笑いました,お尻痛かった説は少し笑いました,母さんお肩を叩きまドーン!!,11,2022-10-26T10:33:00Z,2022-10-26T10:33:00Z
緒方への暴行は完全に傷害事件レベルなのに、運営の連中どうなってんのよ。暴れて盛り上がって興行収益が伸びれば、負傷者が出ても全て良し、なのか。,"緒方への暴行は完全に傷害事件レベルなのに、運営の連中どうなってんのよ。
暴れて盛り上がって興行収益が伸びれば、負傷者が出ても全て良し、なのか。",沢田健二,4,2022-10-26T14:55:51Z,2022-10-26T14:55:51Z
とりあえず、チャンピオン。ギャップで1ヶ月で腹筋バキバキにしてきて欲しい🥹,"とりあえず、チャンピオン。
ギャップで1ヶ月で腹筋バキバキにしてきて欲しい🥹",ポギポギ,0,2022-10-26T16:08:28Z,2022-10-26T16:08:28Z
サトルvs飯田ぜったい面白い！！,"サトルvs飯田
ぜったい面白い！！",さんあーちゃん,2,2022-10-26T12:29:49Z,2022-10-26T12:29:49Z
Braking downの格ゲーは作らないんでしょうか?昔は、良くK-1、はじめの一歩2などの育成ゲームを永遠に遊んでました。またその様なゲームで遊んでみたいですね！いつかクラウドで資金を募集した際は必ず参加させていただきます！笑,"Braking downの格ゲーは作らないんでしょうか?
昔は、良くK-1、はじめの一歩2などの育成ゲームを永遠に遊んでました。
またその様なゲームで遊んでみたいですね！
いつかクラウドで資金を募集した際は必ず参加させていただきます！笑",ハイドマンHydeman,0,2022-10-26T12:24:23Z,2022-10-26T12:24:23Z
緒方さんまじで綺麗だし好きだわ,緒方さんまじで綺麗だし好きだわ,まさとかげうら,33,2022-10-26T10:55:43Z,2022-10-26T10:55:43Z
双子とサワヤンやって欲しいな笑笑,双子とサワヤンやって欲しいな笑笑,迷子のおちびちゃん,0,2022-10-27T01:24:32Z,2022-10-27T01:24:32Z
緒方さん頑張って下さいボコボコにやっちゃって欲しい🔥,"緒方さん頑張って下さい
ボコボコにやっちゃって欲しい🔥",リンカーベル,42,2022-10-26T11:04:09Z,2022-10-26T11:04:09Z
海くん、意外に人見知り？,海くん、意外に人見知り？,ごっつええかんじ,3,2022-10-26T12:09:54Z,2022-10-26T12:09:54Z
9:00ブラジル対ポーランドめちゃめちゃ楽しみ,"9:00
ブラジル対ポーランドめちゃめちゃ楽しみ",ランゲルハンス島,13,2022-10-26T10:54:34Z,2022-10-26T10:54:34Z
サトル意外にオフは礼儀正しいのか❓️(笑)🤣,サトル意外にオフは礼儀正しいのか❓️(笑)🤣,まいける。,1,2022-10-26T16:02:09Z,2022-10-26T16:02:09Z
ブレイキングダウンの面白いところはみんな、なんでもアリの喧嘩なれはしてるけど格闘技ルールになると動き固くなるところ,ブレイキングダウンの面白いところはみんな、なんでもアリの喧嘩なれはしてるけど格闘技ルールになると動き固くなるところ,Alakazaaam‼︎‼︎,1,2022-10-27T05:03:58Z,2022-10-27T05:03:58Z
気まずいと言いつつAV女優から攻める海草,気まずいと言いつつAV女優から攻める海草,MISAKUHAMA彩芽イターZ,10,2022-10-26T20:11:22Z,2022-10-26T20:11:22Z
仮に飯田さんがケツ痛くて喋れなかったの想像したら草,仮に飯田さんがケツ痛くて喋れなかったの想像したら草,クリームハンド,5,2022-10-26T11:08:23Z,2022-10-26T11:08:23Z
バン仲村やっぱ1番好きですね！,バン仲村やっぱ1番好きですね！,ケンブリッジ飛鳥,0,2022-10-27T06:55:06Z,2022-10-27T06:55:06Z
ぽよんぽよんの空手チャンピオンが可愛い😊,ぽよんぽよんの空手チャンピオンが可愛い😊,S C,1,2022-10-27T05:48:06Z,2022-10-27T05:48:06Z
今回の女性オーディションは失敗。感情のままぶっ飛ばすという女性の悪い面が出てしまった。なんだかんだ言って男はあらゆる面で周囲を見て行動するんだなあと実感できた。,"今回の女性オーディションは失敗。感情のままぶっ飛ばすという女性の悪い面が出てしまった。
なんだかんだ言って男はあらゆる面で周囲を見て行動するんだなあと実感できた。",こうじ,7,2022-10-26T11:14:59Z,2022-10-26T11:14:59Z
褐色肌のブチ切れてた女の人超好き可愛い,"褐色肌のブチ切れてた女の人
超好き
可愛い",しゅう,0,2022-10-26T14:44:44Z,2022-10-26T14:44:44Z
ブレイキングダウンもいいんやけどアーチュレッタVS海が見たかった…,"ブレイキングダウンもいいんやけど
アーチュレッタVS海が見たかった…",無冠の帝王,2,2022-10-26T13:09:23Z,2022-10-26T13:09:23Z
8:08の人がちおもろい😂,8:08の人がちおもろい😂,あ,2,2022-10-26T13:46:53Z,2022-10-26T13:46:53Z
