text,start,duration
で言ったらいいんだけどいつ居るからね,1201.62,5.76
はいじゃあでは6巡目,1204.62,3.72
トミーだ,1207.38,4.7
蓮投手左投げ左打ち,1208.34,7.14
17478kg21歳大垣商業高校三菱,1212.08,5.8
自動車岡崎,1215.48,6.3
肘を柔らかく使ったこのタイプかだったら,1217.88,6.299
対左に強く買ってほしいね,1221.78,4.56
それだけお願い,1224.179,3.661
右の左投手より,1226.34,3.18
対左,1227.84,3.719
太陽左投手もいちいち少なかったんでこれ,1229.52,5.3
もこれはだからちょっと即戦力気味だね,1231.559,6.181
コース社会人なんですけども,1234.82,4.06
即戦略気味,1237.74,3.66
左は欲しいところではあるけどそんな何枚,1238.88,4.26
もいらないけど,1241.4,4.82
田口みたいなの欲しいけどどう,1243.14,3.08
まあまあいいねまあまあいいけど,1246.74,4.16
使えるんじゃない,1252.08,3.42
6位だったらやっぱり使えるピッチャー,1253.82,3.96
じゃないとちょっとタイガーそのちょっと,1255.5,5.24
ドラフトでちょっと気がかりなのがその,1257.78,5.16
コントロールの悪いピッチャーがちょっと,1260.74,4.12
この2年間,1262.94,2.64
昨年,1264.86,3.72
昨年21年ドラフトと20年で2人続い,1265.58,5.24
てるんですよ,1268.58,2.24
佐藤蓮投手とその,1271.039,5.041
鈴木投手今年の2位の創価大学から,1273.14,5.58
投手がストライクが入らないんですよこれ,1276.08,3.839
は,1278.72,4.319
ドラフトの上位ではやっぱり厳しいという,1279.919,7.081
のは僕は思うだからどうしてそうなったの,1283.039,6.421
かの原因は別にしてこれを改善しなきゃ,1287.0,4.26
いけないしドラフトでもやっぱりその選手,1289.46,3.18
もう,1291.26,3.48
選ばないようにしないといけないのね,1292.64,4.5
頑張ってほしいと思っても自力がない,1294.74,5.1
判断されがちになるのでなんとかこの今,1297.14,4.68
挙げた2人の投資は,1299.84,3.78
自分で頑張らないといけないのかなって,1301.82,4.859
いう気がするストライクが入らないと,1303.62,4.62
藤波当時もそうだったんだけどやっぱ,1306.679,4.321
厳しい今プロ野球は,1308.24,5.58
しかも上位だからさ兄さんいたらこの6位,1311.0,5.46
だったらまだね止めた投手だったら全然,1313.82,4.38
あれなんだけど止めたどうしよう,1316.46,5.459
コントロールが外だしまあただすぐ左が今,1318.2,7.02
必要か出たら厳しく投手っていう,1321.919,4.441
去年の阪神の,1325.22,3.0
ドラフト3位の,1326.36,2.76
党首は,1328.22,4.38
すごい成績悪くて来年は戦略タイプで,1329.12,5.58
田口投手のように活躍できればなぁなんて,1332.6,5.1
僕は思う次第ではあるあと岩田投手って,1334.7,4.32
いう,1337.7,4.38
当時の岩田って左のワンポイントこれをね,1339.02,5.34
岡田監督たちがどう使うか,1342.08,4.32
岩田を使ってほしい,1344.36,4.08
ワンパイでただ延長が12回だからそう,1346.4,4.5
なると中継ぎにロングマンがいるから,1348.44,3.9
必要になるから,1350.9,3.659
右の一員のしか投げられない左で1リング,1352.34,4.5
しか投げられない投手での数多くなると困,1354.559,3.36
るっていうとこでは,1356.84,3.959
厳しくなんかも中継ぎで,1357.919,5.341
複数人向けなのかなってこの,1360.799,4.081
富田選手もそこの,1363.26,3.72
争いをしてみたらどうかな,1364.88,3.36
後,1366.98,3.96
ストライク入れることが大前提になります,1368.24,6.0
ルーキの場合はそれがないとやっぱり,1370.94,5.219
伸びてきてないのよね,1374.24,4.2
手の気がかりですだから頑張って,1376.159,4.741
使うとこのスカウトこれも使うとか言って,1378.44,3.84
ましたいい投手だって,1380.9,3.0
すぐ使えると思います」って言ってたので,1382.28,2.94
期待します,1383.9,3.5
頑張ってください,1385.22,2.18
育成1巡目野口恭介選手,1387.86,4.22
育成は大卒だね今度はね,1394.34,4.74
一人一人です,1396.58,5.32
映像がないこの選手だけほんといくら探し,1399.08,4.02
たんですけど,1401.9,4.74
映像がちょっと見つからなくてですねでも,1403.1,6.72
右投げ右打ち外野手がはい,1406.64,5.159
やっぱり何かあったんだよ,1409.82,3.18
背が高いよ,1411.799,3.841
体は十分の180CM88キロでそうです,1413.0,5.58
ねだからやっぱりポテンシャルで買って,1415.64,4.44
撮ってるわけでタイガースのこのドラフト,1418.58,3.9
パーンとほとんど180CMオーバーそう,1420.08,6.06
ですね身長もいわゆる高身長が選手が多い,1422.48,6.0
ですよねやっぱり5ツールプレーヤー,1426.14,4.56
みたいなそういう選手がいいからあの映像,1428.48,3.36
はないけど,1430.7,2.28
すごく,1431.84,5.339
いい選手なんじゃないかなまあでも,1432.98,6.3
ドラフトでね育成選手って話がばあまり,1437.179,4.081
取らないんだけどもそれはやっぱり,1439.28,4.74
結構育成からしないから上がる確率も高い,1441.26,4.38
んでいいチームに入ったんじゃないかなと,1444.02,3.659
思いますでしかも外野手,1445.64,4.08
メディアが巡るうちっていうところがあり,1447.679,5.88
ますねはいいかがでしたでしょうか,1449.72,4.98
ドラフトの方は,1453.559,4.021
阪神タイガースに関してはねあの,1454.7,5.4
わかる部分もあるし球団のプラン通りに今,1457.58,4.38
進んでるんじゃないかと思います,1460.1,4.199
岡田監督含めて平田ヘッドコーチも2軍艦,1461.96,5.699
とか長くやってきましたそして笑う2軍,1464.299,5.041
カントリーに関しても1軍監督までやった,1467.659,3.961
だけの教えるプロフェッショナルであり,1469.34,3.3
ますから,1471.62,3.72
選手たちもどんどんどんどん入ってきて,1472.64,4.98
学べる機会も多いんじゃないかと思います,1475.34,3.719
僕と球場で,1477.62,3.0
会うことがあると思いますし,1479.059,3.421
グラウンドに出て解説されたら厳しいこと,1480.62,2.88
も言います,1482.48,3.48
仕事なんでねだけど愛情を持って接したい,1483.5,6.72
と思うしまあ良い先輩量も素晴らしく,1485.96,6.92
食事も美味しいし,1490.22,2.66
親御さんも何の心配もなく,1493.52,4.399
入ってきてもらえたらなとこう思います,1495.38,7.7
今回は阪神タイガース編でしたでは,1497.919,5.161
