textDisplay,textOriginal,authorDisplayName,likeCount,publishedAt,updatedAt
今回は見てる私も興奮しました❤かっこよく仕上がりましたね〜👏🏼,"今回は見てる私も興奮しました❤
かっこよく仕上がりましたね〜👏🏼",ひーさん,0,2022-10-25T13:45:30Z,2022-10-25T13:45:30Z
待ってましたマッハカスタムめちゃかっこいいです♪めちゃ似合いますいつも楽しく動画見てます。,"待ってました
マッハカスタムめちゃかっこいいです♪
めちゃ似合います
いつも楽しく動画見てます。",大輔,1,2022-10-25T10:26:54Z,2022-10-25T10:26:54Z
バイク乗ってないんですけど、いつも楽しんで観てます☺️,バイク乗ってないんですけど、いつも楽しんで観てます☺️,純一 木村,0,2022-10-26T10:45:57Z,2022-10-26T10:45:57Z
総長仕様でマッハのプラモ作りたいです😌,"総長仕様でマッハのプラモ
作りたいです😌",横山満良,0,2022-10-25T09:07:10Z,2022-10-25T09:47:56Z
｢撮影終わったら宇野走り行こうぜ｣の一言が聞けて自分まで嬉しい気持ちになりました！自分も色んなことに挑戦して人生謳歌します！作田さん宇野さんSATAbuilder'sの皆さんに感謝、押忍です！,"｢撮影終わったら宇野走り行こうぜ｣の一言が聞けて自分まで嬉しい気持ちになりました！

自分も色んなことに挑戦して人生謳歌します！

作田さん宇野さんSATAbuilder'sの皆さんに感謝、押忍です！",ATSUSHI86チャンネル,0,2022-10-25T14:39:31Z,2022-10-25T14:39:31Z
めっちゃ漢気仕様！押忍が似合う単車！　　　　　　押忍！,"めっちゃ漢気仕様！
押忍が似合う単車！
　　　　　　押忍！",2 tight,0,2022-10-25T13:10:39Z,2022-10-25T13:10:39Z
余計なことは言わず… 風防スタイルも、最高〜‼️‼️‼️ツーリング、アップされるの楽しみ〜😁‼️ 作田さん最高😄👍,"余計なことは言わず… 
風防スタイルも、最高〜‼️‼️‼️
ツーリング、アップされるの楽しみ〜
😁‼️ 作田さん最高😄👍",shun saka,0,2022-10-25T14:32:13Z,2022-10-25T14:32:13Z
芸術の域の渋いマッハやん😮よかね〜^_^,芸術の域の渋いマッハやん😮よかね〜^_^,hiro hiro,0,2022-10-25T10:03:18Z,2022-10-25T10:03:18Z
佐田さんのマッハが世界一かっこいい説,佐田さんのマッハが世界一かっこいい説,Reo,0,2022-10-25T09:59:34Z,2022-10-25T09:59:34Z
"総長❣オース❣奏でたことないけど最後まで見ましたぁ🤭総長はセンスの塊の人だから全てカッコイイ仕上がりになる😍👍ハンドルに手を置くと自然に右手が動く総長(,,>᎑<,,)カワイイ❤そしてエンジンをかけてる総長が一段とカッコイイ😍今日も総長に見惚れました♡(´,,•ω•,,`)ｷｭﾝ","総長❣オース❣

奏でたことないけど
最後まで見ましたぁ🤭

総長は
センスの塊の人だから
全てカッコイイ仕上がりになる😍👍

ハンドルに手を置くと
自然に右手が動く総長
(,,>᎑<,,)カワイイ❤

そして
エンジンをかけてる
総長が一段とカッコイイ😍

今日も総長に
見惚れました♡(´,,•ω•,,`)ｷｭﾝ",ピエロちゃん[㊾番],0,2022-10-26T01:21:15Z,2022-10-26T01:21:15Z
総長～バイクカスタムめっちゃカッコいい⤴️⤴️❗風防ステキ！早くバイクで走る総長見たい❗,総長～バイクカスタムめっちゃカッコいい⤴️⤴️❗風防ステキ！早くバイクで走る総長見たい❗,りこ おみ,1,2022-10-25T13:47:11Z,2022-10-25T13:47:11Z
マッハ350にする最高のカスタムすぎてたまらんとです☺️☺️☺️これからもかっこよく、族族に仕上げていってください❕,"マッハ350にする最高のカスタムすぎてたまらんとです☺️☺️☺️
これからもかっこよく、族族に仕上げていってください❕",じゃがりこ,0,2022-10-25T11:23:06Z,2022-10-25T11:23:06Z
短風防リーゼント最高ですね、細目の旧単車にはバッチリです👍,短風防リーゼント最高ですね、細目の旧単車にはバッチリです👍,光秀 山崎,0,2022-10-25T15:46:53Z,2022-10-25T15:46:53Z
風防絞るの懐かしい！自分は絞り失敗で２度程…パンっ！と真ん中から割った事あります笑っその度にカブを探すと言う…昔話笑ってか佐田さんのマッハ本当めっちゃくちゃ良い音しますよね♪聞くたびに痺れます！ついに完成で渋過ぎる！めっちゃカッコいいです♪また次回も楽しみにしてますね☆出来上がったマッハの走行もまた動画にしてくださいね！,風防絞るの懐かしい！自分は絞り失敗で２度程…パンっ！と真ん中から割った事あります笑っその度にカブを探すと言う…昔話笑ってか佐田さんのマッハ本当めっちゃくちゃ良い音しますよね♪聞くたびに痺れます！ついに完成で渋過ぎる！めっちゃカッコいいです♪また次回も楽しみにしてますね☆出来上がったマッハの走行もまた動画にしてくださいね！,竹嶌 亨,0,2022-10-25T13:54:47Z,2022-10-25T13:54:47Z
チョッコ兄さんの笑顔がいい,チョッコ兄さんの笑顔がいい,今日も爆釣,0,2022-10-25T11:22:55Z,2022-10-25T11:22:55Z
キタキタキタ、キター❤❤❤この時を待ってましたぁ〜🎉,"キタキタキタ、キター❤❤❤

この時を待ってましたぁ〜🎉",Y’scream,1,2022-10-25T09:36:28Z,2022-10-25T09:36:28Z
改めて横兄凄い！プロ!佐田さんとマッハ激渋です！,改めて横兄凄い！プロ!佐田さんとマッハ激渋です！,広利,0,2022-10-25T10:17:12Z,2022-10-25T10:17:12Z
風防と一緒に佐田さんもリーゼントにしたら最高だと思います！どっちが380かわからないかも！押忍！,風防と一緒に佐田さんもリーゼントにしたら最高だと思います！どっちが380かわからないかも！押忍！,西本誠,0,2022-10-25T18:27:41Z,2022-10-25T18:27:41Z
総長…渋美しいという新たな表現がぴったりなマッハです…！,"総長…
渋美しいという
新たな表現がぴったりな
マッハです…！",ペイ,0,2022-10-25T14:48:09Z,2022-10-25T14:48:09Z
リーゼント風防、かっこいいです👍,リーゼント風防、かっこいいです👍,まー坊,0,2022-10-25T10:11:22Z,2022-10-25T10:11:22Z
漢が増してカッコイイ🎉作田さんの笑顔がたまらない🤩,"漢が増してカッコイイ🎉
作田さんの笑顔がたまらない🤩",モバイルバッテリー,0,2022-10-26T03:02:40Z,2022-10-26T03:02:40Z
自分の理想のスタイルに少しずつ仕上げて行くの楽しいぃ〜ですよね〜😂👍,自分の理想のスタイルに少しずつ仕上げて行くの楽しいぃ〜ですよね〜😂👍,パパンダ,0,2022-10-25T10:32:17Z,2022-10-25T10:32:17Z
サムネが渋過ぎる！かっけぇー！！🥺,サムネが渋過ぎる！かっけぇー！！🥺,坂,1,2022-10-25T09:08:53Z,2022-10-25T09:08:53Z
風防めっちゃカッコイイっすね🙆‍♂️🙆‍♂️🙆‍♂️,風防めっちゃカッコイイっすね🙆‍♂️🙆‍♂️🙆‍♂️,kehaegusuri,0,2022-10-25T12:15:57Z,2022-10-25T12:15:57Z
渋い一台が完成しましたねー！総長！この後のツーリング動画も見たいっス！押忍！w,"渋い一台が完成しましたねー！

総長！この後のツーリング動画も見たいっス！押忍！w",清元,0,2022-10-25T15:46:10Z,2022-10-25T15:46:10Z
サムネイルが佐田のホビーでの写真のリメイク!!カッコいい!!,"サムネイルが佐田のホビーでの写真のリメイク!!
カッコいい!!",男の趣味は酒と車でしょう,11,2022-10-25T09:08:54Z,2022-10-25T09:08:54Z
万力がなかったので、家の前のドブ側溝板（コンクリート製）の間に風防の棒を差し込んで細いパイプでテコの原理を使って曲げてたのを思い出す♪,万力がなかったので、家の前のドブ側溝板（コンクリート製）の間に風防の棒を差し込んで細いパイプでテコの原理を使って曲げてたのを思い出す♪,須間金,0,2022-10-25T13:29:59Z,2022-10-25T13:30:38Z
今日も面白かったよ！いつもありがとうねー！,"今日も面白かったよ！
いつもありがとうねー！",檜山哲,0,2022-10-25T10:06:26Z,2022-10-25T10:06:26Z
やっぱり風防はリーゼントがカッコいいなぁ😍,やっぱり風防はリーゼントがカッコいいなぁ😍,青忍250,0,2022-10-25T10:58:27Z,2022-10-25T10:58:27Z
過去一番でカッコイイカスタム✨,過去一番でカッコイイカスタム✨,東海のチカリスト,0,2022-10-25T09:56:32Z,2022-10-25T09:56:32Z
総長つっぱりすぎですwでも最高です！！❤,"総長つっぱりすぎですw
でも最高です！！❤",カワサキレーシング北海道,0,2022-10-25T10:03:38Z,2022-10-25T10:03:38Z
風防かっこいいです！大好きでーーーす！,"風防かっこいいです！
大好きでーーーす！",河井俊也,0,2022-10-25T22:35:59Z,2022-10-25T22:35:59Z
マッハのミヤマスタイル最高です(*≧∀≦*)ナイス!!の言い方が釣りよかスタイル(b｀>▽<´),"マッハのミヤマスタイル最高です(*≧∀≦*)
ナイス!!の言い方が釣りよかスタイル(b｀>▽<´)",しろゼルとイエモン,0,2022-10-25T12:57:48Z,2022-10-25T12:57:48Z
うぅーわっ✨めっちゃめっちゃ✕100✨渋い＆カッコイイっす、総長のセンス大好きです、マジカッコイイ✕100,うぅーわっ✨めっちゃめっちゃ✕100✨渋い＆カッコイイっす、総長のセンス大好きです、マジカッコイイ✕100,リンヒロ,0,2022-10-25T13:09:06Z,2022-10-25T13:09:06Z
そら、音良くなったら走りに行きたくなりますわ(*´ч ` *)いつもの3倍アクセルブンブンだし高回転でクラッチミートしてきますわね( *´꒳`* ),そら、音良くなったら走りに行きたくなりますわ(*´ч ` *)いつもの3倍アクセルブンブンだし高回転でクラッチミートしてきますわね( *´꒳`* ),だーまや,0,2022-10-26T15:03:21Z,2022-10-26T15:03:21Z
短風防渋いなー👍,短風防渋いなー👍,Kz さと,0,2022-10-25T11:25:37Z,2022-10-25T11:25:37Z
マッハのカスタム完成したんですね😊あと次の動画楽しみにしてます押ー忍,マッハのカスタム完成したんですね😊あと次の動画楽しみにしてます押ー忍,ドラゴンドラゴン,0,2022-10-25T10:56:24Z,2022-10-25T10:56:24Z
初めてコメントさせてもらいます。自分も車、バイク、DIY、観葉植物好きでずっと見させて貰ってます。ちょっとづつ良くなってきてるんですが嫁が鬱になり自分自身も精神的にしんどくなったりする中、佐田さんの動画で笑ったり優しい気持ちにさせてもらったり元気貰ってます。有難うございます。お身体に気をつけて無理せず頑張って下さい！,"初めてコメントさせてもらいます。
自分も車、バイク、DIY、観葉植物好きでずっと見させて貰ってます。ちょっとづつ良くなってきてるんですが嫁が鬱になり自分自身も精神的にしんどくなったりする中、佐田さんの動画で笑ったり優しい気持ちにさせてもらったり元気貰ってます。有難うございます。お身体に気をつけて無理せず頑張って下さい！",かったん,0,2022-10-25T13:00:02Z,2022-10-25T13:00:02Z
仕事中  嫌な時間帯が この動画のおかげで  楽しい時間に変わりましたよ😊ツーストトリプル最高です,"仕事中  嫌な時間帯が この動画のおかげで  楽しい時間に変わりましたよ😊
ツーストトリプル最高です",Good Aozora,2,2022-10-25T11:38:14Z,2022-10-25T11:38:14Z
サムネかっこよすぎて、動画見てからもまたサムネ見に行ってしまった...,サムネかっこよすぎて、動画見てからもまたサムネ見に行ってしまった...,翔太松田,0,2022-10-25T12:12:21Z,2022-10-25T12:12:21Z
マッハがまた一段と渋カッコよくなりましたね😊俺も風防付けてるから何か嬉しいです👏,マッハがまた一段と渋カッコよくなりましたね😊俺も風防付けてるから何か嬉しいです👏,くぅちゃろ,0,2022-10-26T12:57:56Z,2022-10-26T12:57:56Z
2stほしくなります、風防めっちゃくちゃ渋いです,2stほしくなります、風防めっちゃくちゃ渋いです,χ ZEPHYR,0,2022-10-25T13:51:40Z,2022-10-25T13:51:40Z
歳とか関係なく、自分のやりたいことをできるという作田さんマジ尊敬できます。応援してます！！！！,"歳とか関係なく、自分のやりたいことを
できるという作田さんマジ尊敬できます。
応援してます！！！！",アンチを愛しアンチに愛されることが目標の人間yota。,22,2022-10-25T12:39:16Z,2022-10-25T12:39:16Z
佐田さんの　チャンネルは、いつみても、面白いよ！バイクもフィギュアも、いつみても、元気で楽しそうで、こっちまで、元気もらえますよ。頑張ってください^_^,佐田さんの　チャンネルは、いつみても、面白いよ！バイクもフィギュアも、いつみても、元気で楽しそうで、こっちまで、元気もらえますよ。頑張ってください^_^,おおとひろき,0,2022-10-25T22:13:08Z,2022-10-25T22:13:08Z
めっちゃかっこいい(๑>◡<๑),めっちゃかっこいい(๑>◡<๑),りょうた,0,2022-10-25T10:31:00Z,2022-10-25T10:31:00Z
次回　作田基地　内装工事　＃11　タイトルが楽しみ〜　押〜忍,次回　作田基地　内装工事　＃11　タイトルが楽しみ〜　押〜忍,Takuya,0,2022-10-25T09:09:21Z,2022-10-25T09:09:21Z
男のカスタム最高です！,男のカスタム最高です！,ミニブーブー2,0,2022-10-25T13:20:53Z,2022-10-25T13:20:53Z
クマにミヤマクワガタにヘラクレス原理のバリエーション豊か笑こうやって細部にまでこだわりを光らせて乗ってるんですね～☺️作田さんが跨がればなおカッコ良い❤️,"クマにミヤマクワガタにヘラクレス
原理のバリエーション豊か笑

こうやって細部にまで
こだわりを光らせて乗ってるんですね～☺️

作田さんが跨がれば
なおカッコ良い❤️",みぃ,0,2022-10-27T01:31:03Z,2022-10-27T01:31:03Z
激渋！！！旗棒付けたくなりますね〜,激渋！！！旗棒付けたくなりますね〜,日常チャンネル,0,2022-10-25T14:04:10Z,2022-10-25T14:04:10Z
渋過ぎて鼻血でそう🎉音も最＆高です👍,渋過ぎて鼻血でそう🎉音も最＆高です👍,MASAROYAL,0,2022-10-25T13:45:34Z,2022-10-25T13:45:34Z
サムネカッコ良すぎる,サムネカッコ良すぎる,ショウタ,0,2022-10-25T09:26:08Z,2022-10-25T09:26:08Z
な、懐かしいスタイルです！GSやバブ、4フォアも似合いますが、マッハ+短風防もキマッててシブい！,"な、懐かしいスタイルです！
GSやバブ、4フォアも似合いますが、マッハ+短風防もキマッててシブい！",川村武彦,0,2022-10-25T09:44:24Z,2022-10-25T09:44:24Z
や～毎回、思うけど本気で面白い❕唯一声を出して笑ってしまう🤣族育チャンネル(笑),や～毎回、思うけど本気で面白い❕唯一声を出して笑ってしまう🤣族育チャンネル(笑),かみやまさえ,0,2022-10-25T20:57:34Z,2022-10-25T20:57:34Z
めちゃくちゃかっこいい😍,めちゃくちゃかっこいい😍,W,0,2022-10-25T15:23:34Z,2022-10-25T15:23:34Z
やるんじゃないかと思ったら、やっぱ紐ブチったw走行音聞けるの楽しみだなぁ。SUGOのバイクイベントの雨率高いんで来て欲しい！特に2stミーティングは…,"やるんじゃないかと思ったら、やっぱ紐ブチったw
走行音聞けるの楽しみだなぁ。
SUGOのバイクイベントの雨率高いんで来て欲しい！
特に2stミーティングは…",Pocket Rocket,0,2022-10-25T14:27:18Z,2022-10-25T14:27:18Z
コレはヤバい！マッハめちゃくちゃカッコ良すぎ！僕のクルマも作田さんに見習って『赤ちゃ金ぞ』にしました！,"コレはヤバい！マッハめちゃくちゃカッコ良すぎ！
僕のクルマも作田さんに見習って『赤ちゃ金ぞ』にしました！",diversioner,0,2022-10-25T10:57:54Z,2022-10-25T10:57:54Z
自分好みにカスタム。更に進化❗️めちゃカッコよ❗️押忍です、総長。,"自分好みにカスタム。
更に進化❗️
めちゃカッコよ❗️
押忍です、総長。",yamaguchi Daiki,0,2022-10-26T20:49:31Z,2022-10-26T20:49:31Z
横兄さんのGSと作本さんのGSと総長のマッハのツーリングの動画を見てみたいです。,横兄さんのGSと作本さんのGSと総長のマッハのツーリングの動画を見てみたいです。,印南勇太,0,2022-10-25T09:51:22Z,2022-10-25T09:51:22Z
この方の動画みるようになって、子どもの頃の夢をみるようになりました,この方の動画みるようになって、子どもの頃の夢をみるようになりました,ゆゆう,0,2022-10-25T15:39:49Z,2022-10-25T15:39:49Z
素晴らしい😂押忍🔥,素晴らしい😂押忍🔥,Matsu,0,2022-10-25T09:50:43Z,2022-10-25T09:50:43Z
えっ、、、、かっこよ！いつも楽しい動画ありがとうございます！押忍,"えっ、、、、
かっこよ！

いつも楽しい動画ありがとうございます！押忍",成田翔平,0,2022-10-25T13:08:33Z,2022-10-25T13:08:33Z
いつもいつも楽しみすぎる😂🎉🎉,いつもいつも楽しみすぎる😂🎉🎉,ゴンタゴリラ,0,2022-10-25T09:23:23Z,2022-10-25T09:23:23Z
兄貴がフォーワンに風防付けてたの思い出します☺️マッハ激シブです👍,"兄貴がフォーワンに風防付けてたの思い出します☺️
マッハ激シブです👍",kei1けいちゃん,0,2022-10-25T11:12:43Z,2022-10-25T11:12:43Z
ここまでくると外装を紫メタにしたくなります(笑),ここまでくると外装を紫メタにしたくなります(笑),漢KAWASAKI,0,2022-10-25T14:21:54Z,2022-10-25T14:21:54Z
大人かどうかはわからないのですがwカッコいいカスタムですね🏍♡,"大人かどうかはわからないのですがw
カッコいいカスタムですね🏍♡",ひきこもり,0,2022-10-25T15:46:18Z,2022-10-25T15:46:18Z
総長似合うな〜,総長似合うな〜,明男中澤,0,2022-10-25T10:49:06Z,2022-10-25T10:49:06Z
めちゃめちゃカッコいいマッハ！,めちゃめちゃカッコいいマッハ！,ハチロク,0,2022-10-25T09:58:39Z,2022-10-25T09:58:39Z
やっぱり佐田のオートバイだったんですね。風防はリーゼント好きです。見かけた時、めっちゃ嬉しかったけど、一回しか見かけて無いんですよね。,"やっぱり佐田のオートバイだったんですね。
風防はリーゼント好きです。
見かけた時、めっちゃ嬉しかったけど、一回しか見かけて無いんですよね。",hide yama,0,2022-10-25T23:21:10Z,2022-10-25T23:21:10Z
夜は走りたい凄くわかります🤣,夜は走りたい凄くわかります🤣,nシゲル,0,2022-10-25T10:26:40Z,2022-10-25T10:26:40Z
あきおくんと地獄のりょーくんの融合！最高です！バリ渋でカッコイイ！,"あきおくんと地獄のりょーくんの融合！

最高です！

バリ渋でカッコイイ！",Kazuki Sugiyama,2,2022-10-25T10:13:25Z,2022-10-25T10:13:25Z
佐田さんが嬉しそうで😊楽しい✨ヨコ兄は本当に頼りになるネ😉走りに行くって佐田さんが言った時の、｢俺も！ 俺も！｣感がMAXのヨコ兄の顔、カワイイし。佐田さんが、ちゃんと礼節わきまえてキチンと お礼言った所、ステキ✨エンジン音、カッコ良かった♪次回も楽しみ😍🙌,"佐田さんが嬉しそうで😊楽しい✨
ヨコ兄は本当に頼りになるネ😉
走りに行くって佐田さんが言った時の、｢俺も！ 俺も！｣感がMAXのヨコ兄の顔、カワイイし。
佐田さんが、ちゃんと礼節わきまえてキチンと お礼言った所、ステキ✨
エンジン音、カッコ良かった♪
次回も楽しみ😍🙌",オリビアオリビア,0,2022-10-26T01:57:03Z,2022-10-26T01:57:03Z
マッハ回待ってました！！！！,マッハ回待ってました！！！！,けいちゃん,2,2022-10-25T09:00:24Z,2022-10-25T09:00:24Z
動画更新お疲れ様です😊激渋バリ格好良いですね😊リーゼント風貌最高♪私の現役時代のGT380もリーゼント風貌でアップハンをしぼってました😊Sugayaのショート管の直管でした😊次回の動画も楽しみに待たせて頂きます😎押🇯🇵忍,"動画更新お疲れ様です😊
激渋バリ格好良いですね😊リーゼント風貌最高♪私の現役時代のGT380もリーゼント風貌でアップハンをしぼってました😊Sugayaのショート管の直管でした😊
次回の動画も楽しみに待たせて頂きます😎押🇯🇵忍",skull,0,2022-10-25T09:42:09Z,2022-10-25T09:42:09Z
もし、お金とスペースがあるならは…ノーマルベースカスタムベース族車ベース観賞用保存用予備を、それぞれXJ、FX、マッハで欲しいよな〜,"もし、お金とスペースがあるならは…
ノーマルベース
カスタムベース
族車ベース
観賞用
保存用
予備

を、それぞれXJ、FX、マッハで欲しいよな〜",雨奈木戌,0,2022-10-25T10:53:12Z,2022-10-25T10:53:12Z
ひゃー今日も楽しかった😂横兄もヤンチャな顔になってて〜楽しいのがわかる〜大変な事もいっぱいなはずだけど…また楽しみにしてまぁす😊,"ひゃー今日も楽しかった😂
横兄もヤンチャな顔になってて〜楽しいのがわかる〜大変な事もいっぱいなはずだけど…また楽しみにしてまぁす😊",YUMIKO D,0,2022-10-25T11:49:12Z,2022-10-25T11:49:12Z
いつも楽しいけど、inコーストラインが1番好き🎶,いつも楽しいけど、inコーストラインが1番好き🎶,かっぱⓒ,0,2022-10-25T10:12:46Z,2022-10-25T10:12:46Z
俺もモンキーだけど風防付けてます。風防やっぱりカッコイイですよね✨,俺もモンキーだけど風防付けてます。風防やっぱりカッコイイですよね✨,ちろりん,0,2022-10-25T11:30:02Z,2022-10-25T11:30:02Z
マジ風防カッコよすぎ👍👍👍,マジ風防カッコよすぎ👍👍👍,まーさん,0,2022-10-25T13:38:26Z,2022-10-25T13:38:26Z
俺も、昔のガキの頃はこんなのがカッコいいと思ってたな。,俺も、昔のガキの頃はこんなのがカッコいいと思ってたな。,TK,1,2022-10-27T11:01:15Z,2022-10-27T11:01:15Z
音最高❗️ワクワクする❤,"音最高❗️
ワクワクする❤",則子 梅田,0,2022-10-26T03:59:48Z,2022-10-26T03:59:48Z
次は三段シィートだな風防と高さ同じにすれば完璧❗,次は三段シィートだな風防と高さ同じにすれば完璧❗,暗闇奉行,1,2022-10-25T11:00:30Z,2022-10-25T11:00:30Z
さらに音がよくなるって振り返ったときの目をキラキラ輝かせるこの男愛おしくてたまらない(⑉• •⑉)❤︎うわー、こんなこと言うとあれなんだろうけどフレーム黄色だったら最高にカッコイイのに､､､､と思ってしまうぅぅ,"さらに音がよくなるって振り返ったときの目をキラキラ輝かせるこの男

愛おしくてたまらない(⑉• •⑉)❤︎

うわー、こんなこと言うとあれなんだろうけど

フレーム黄色だったら最高にカッコイイのに､､､､と思ってしまうぅぅ",慢性愛情不足＠you_and_me_mnst,0,2022-10-26T04:49:30Z,2022-10-26T04:49:30Z
リーゼント短風防かっこいいネ😃,リーゼント短風防かっこいいネ😃,雪下,0,2022-10-25T10:23:17Z,2022-10-25T10:23:17Z
熊からのミヤマ😊やっぱりカスタムにはゴールはないですね。,熊からのミヤマ😊やっぱりカスタムにはゴールはないですね。,ジミー大西の後継者,0,2022-10-25T09:30:13Z,2022-10-25T09:30:13Z
熊システムええなぁ～（笑）,熊システムええなぁ～（笑）,真吾 重松,0,2022-10-25T10:02:40Z,2022-10-25T10:02:40Z
9:44 ハチロクに目がいってしまう車好き,9:44 ハチロクに目がいってしまう車好き,恒星の使者ザナビー,6,2022-10-25T10:15:55Z,2022-10-25T10:15:55Z
"マッハめちゃめちゃ決まってるやないですか‼️あとは3段つければｸﾞｯﾁｮﾌﾞ!( 。0 ∀0,) وこれからも自分好みにカスタムしてってください👍👍👍👍","マッハめちゃめちゃ決まってるやないですか‼️あとは3段つければｸﾞｯﾁｮﾌﾞ!( 。0 ∀0,) وこれからも自分好みにカスタムしてってください👍👍👍👍",姫路のクソガキ,1,2022-10-25T22:02:33Z,2022-10-25T22:02:33Z
