textDisplay,textOriginal,authorDisplayName,likeCount,publishedAt,updatedAt
お疲れ様です 日本でバイクが乗れなくなったのは 総長のせいになりますよ‼️押忍です。,お疲れ様です 日本でバイクが乗れなくなったのは 総長のせいになりますよ‼️押忍です。,ひろ瀬輝,1,2022-10-26T14:35:55Z,2022-10-26T14:35:55Z
んー、風防で拓ちゃんのリョーくんを思い出しちゃいました😂 ありがとうございました✨,"んー、風防で拓ちゃんのリョーくんを思い出しちゃいました😂 
ありがとうございました✨",RAIN,0,2022-10-25T12:57:40Z,2022-10-25T12:57:40Z
赤ちゃ金ぞ〜！！！かっけぇ🤤,"赤ちゃ金ぞ〜！！！
かっけぇ🤤",ホタテサラダ,0,2022-10-25T11:48:28Z,2022-10-25T11:48:28Z
これから冬ですから。GT380くんも暖かそうで良いじゃないですか〜笑,"これから冬ですから。GT380くんも
暖かそうで良いじゃないですか〜笑",アルデニーロ,0,2022-10-25T10:36:18Z,2022-10-25T10:36:18Z
紐ぶっちぎって泣いたとこ、爆笑🤣飯吹いた🤣短風防でリーゼント！悪だなぁ〜！でもコレが1番好きな形です😁,"紐ぶっちぎって泣いたとこ、爆笑🤣飯吹いた🤣
短風防でリーゼント！悪だなぁ〜！でもコレが1番好きな形です😁",まこまこ,1,2022-10-25T09:39:17Z,2022-10-25T09:39:17Z
よきー！！高校以来30数年バイク乗ってないですが、最近バイク熱上がってます…GSXヨシムラ集合管懐かしー！,"よきー！！高校以来30数年バイク乗ってないですが、最近バイク熱上がってます…
GSXヨシムラ集合管懐かしー！",岡崎義誉,0,2022-10-27T10:38:50Z,2022-10-27T10:38:50Z
紐の件。総長と同じタイミングで『あっ』って言う❣️,紐の件。総長と同じタイミングで『あっ』って言う❣️,松本拓,0,2022-10-25T11:34:54Z,2022-10-25T11:34:54Z
サムネかっこよ✨,サムネかっこよ✨,天パー,0,2022-10-25T12:33:10Z,2022-10-25T12:33:10Z
Siriのタイミングが神がかってるｗ,Siriのタイミングが神がかってるｗ,TMN7Nemuro,0,2022-10-26T00:18:18Z,2022-10-26T00:18:18Z
待ってました！YouTubeファイトです！押忍！！😊,"待ってました！
YouTubeファイトです！
押忍！！😊",sくん,0,2022-10-25T11:00:57Z,2022-10-25T11:00:57Z
マッハGOGO〜🥳🔥,マッハGOGO〜🥳🔥,ヨッチ,0,2022-10-25T09:02:42Z,2022-10-25T09:02:42Z
嗚呼～渋いです。元暴走族ってことで何かと叩かれがちなんですけど、目上の人に対する礼儀もそうですし、コール切るったってリズム感じゃないですか。自分の身体に合わせるとか、色合いのカスタムってファッションセンスですよね。総長の人間性が大いにあるとしても、見方変えれば尊敬するところたくさんあると思うんです。ハイエースに石投げてる時からずっと大好きです。作田さん宇野くん、今日もたくさん笑いました😃いつもありがとう,"嗚呼～渋いです。
元暴走族ってことで何かと叩かれがちなんですけど、目上の人に対する礼儀もそうですし、コール切るったってリズム感じゃないですか。自分の身体に合わせるとか、色合いのカスタムってファッションセンスですよね。総長の人間性が大いにあるとしても、見方変えれば尊敬するところたくさんあると思うんです。ハイエースに石投げてる時からずっと大好きです。作田さん宇野くん、今日もたくさん笑いました😃いつもありがとう",エリートチンパン,0,2022-10-25T12:30:12Z,2022-10-25T12:30:12Z
昔は単車なんか外に放置してたんで風防の紐はあっちゅうまに切れてましたわ〜😅学校で園芸用の番線拝借してきて付けてたなぁ…,"昔は単車なんか外に放置してたんで風防の紐はあっちゅうまに切れてましたわ〜😅
学校で園芸用の番線拝借してきて付けてたなぁ…",ジュラシック野獣,0,2022-10-25T14:28:31Z,2022-10-25T14:28:31Z
待ってました！,待ってました！,えびまん,0,2022-10-25T09:03:39Z,2022-10-25T09:03:39Z
ナゾロッキー見やすくて良いですよ！風防付けたらナゾロッキー♪♪♪,"ナゾロッキー見やすくて良いですよ！
風防付けたらナゾロッキー♪♪♪",大黒天。,1,2022-10-25T11:45:03Z,2022-10-25T11:45:03Z
総長は紐パンもそうやって、ちぎるんでしょうね,総長は紐パンもそうやって、ちぎるんでしょうね,ふじまー,0,2022-10-25T11:19:25Z,2022-10-25T11:19:25Z
カスタムする動画をずーっと見てたら自分のもしたくなるなー……スクーターのPCXしか持ってないけど😑自分に合ったカスタム、それが最高の楽しみ方❤❌👊アンチは見るな👊❌,"カスタムする動画をずーっと見てたら自分のもしたくなるなー……スクーターのPCXしか持ってないけど😑

自分に合ったカスタム、それが最高の楽しみ方❤

❌👊アンチは見るな👊❌",だいすけ11,0,2022-10-25T23:12:40Z,2022-10-25T23:12:40Z
ほんとバイクが似合うイケオジの作田晴男さんが好きです,ほんとバイクが似合うイケオジの作田晴男さんが好きです,テケテケテケテケ,0,2022-10-25T09:02:38Z,2022-10-25T09:02:38Z
短風防のリーゼントはヤンチャぢゃなくて大人やねぇ,短風防のリーゼントはヤンチャぢゃなくて大人やねぇ,n_n. 絆.n_n,0,2022-10-26T13:08:02Z,2022-10-26T13:08:02Z
渋いっす👍自分ごとですいません。フロントフェンダーのカスタムまってます😊,"渋いっす👍
自分ごとですいません。
フロントフェンダーのカスタムまってます😊",神里克哉,0,2022-10-25T14:24:49Z,2022-10-25T14:24:49Z
しっぶ！！これは渋い！これだとPJちゃんとFXが拗ねるかも(笑)腰ふってあげてください,しっぶ！！これは渋い！これだとPJちゃんとFXが拗ねるかも(笑)腰ふってあげてください,Jay,0,2022-10-25T13:57:33Z,2022-10-25T13:57:33Z
短風防とにかく気合い入ってて渋いです,短風防とにかく気合い入ってて渋いです,MASAYA Z,0,2022-10-25T14:17:03Z,2022-10-25T14:17:03Z
バイクは楽器よ。みんなでツーリングは交響楽団よ,バイクは楽器よ。みんなでツーリングは交響楽団よ,ハル,0,2022-10-25T10:54:16Z,2022-10-25T10:54:16Z
コーストラインさんの在庫車両が見たいですーーー,コーストラインさんの在庫車両が見たいですーーー,koba-jankulovski zrx,0,2022-10-25T12:11:49Z,2022-10-25T12:11:49Z
佐田兄〜スーパーサイヤ人になりすぎてふーぼーの止めるやつの紐を破壊したらあきませんよww,佐田兄〜スーパーサイヤ人になりすぎてふーぼーの止めるやつの紐を破壊したらあきませんよww,西村健太,0,2022-10-25T12:57:05Z,2022-10-25T12:57:05Z
以前ここまで来たらホイール変えるでしょとコメントしたけどバランスいい感じだからかえなさそうだないずれにせよ作田さんの今後のバイクカスタムも楽しみ！！,"以前ここまで来たらホイール変えるでしょとコメントしたけどバランスいい感じだからかえなさそうだな
いずれにせよ作田さんの今後のバイクカスタムも楽しみ！！",わさび大佐,0,2022-10-25T09:23:36Z,2022-10-25T09:23:36Z
カッコよすぎやろ,カッコよすぎやろ,ご飯は大盛りでおかわり,0,2022-10-25T12:56:48Z,2022-10-25T12:56:48Z
渋っ😆👍紐 ブチンッでもうお腹よじれた😂🤣,"渋っ😆👍
紐 ブチンッでもうお腹よじれた😂🤣",m美紀,0,2022-10-25T09:59:05Z,2022-10-25T09:59:05Z
佐田さんNC31も乗ってたんですね！！！,佐田さんNC31も乗ってたんですね！！！,小唄,0,2022-10-26T00:27:08Z,2022-10-26T00:27:08Z
サムネかっこよ^_^,サムネかっこよ^_^,YUKI ROAD,0,2022-10-25T11:55:24Z,2022-10-25T11:55:24Z
めっちゃいいいいい！！！,めっちゃいいいいい！！！,なみちょふ,0,2022-10-25T09:43:56Z,2022-10-25T09:43:56Z
タア〜急上昇おめでとうございますGood👍,"タア〜
急上昇おめでとうございます
Good👍",Chainsaw Man,0,2022-10-26T09:56:22Z,2022-10-26T09:56:22Z
単車のセンスが渋すぎます。。自分もFT乗ってたんですけど、技術と知識とお金があったら佐田さんみたいな仕様にしたかったです😭😭ふと思ったんですが、ブレイキングダウンには出場しないんですか？,"単車のセンスが渋すぎます。。
自分もFT乗ってたんですけど、技術と知識とお金があったら佐田さんみたいな仕様にしたかったです😭😭

ふと思ったんですが、ブレイキングダウンには出場しないんですか？",龍,0,2022-10-26T12:45:30Z,2022-10-26T12:45:30Z
おぉ～♪バリ渋い♪,おぉ～♪バリ渋い♪,ゆいはん48練乳飲みの弟子(前田勇介),0,2022-10-25T11:19:17Z,2022-10-25T11:19:17Z
トテモカッコイイ❗️押忍🏍,トテモカッコイイ❗️押忍🏍,藤井康樹,0,2022-10-25T12:46:43Z,2022-10-25T12:46:43Z
ABEMAの佐田さんとくっきーさん見てから安定の佐田さんトコ😁ワタシヌカリナイ(笑),"ABEMAの佐田さんとくっきーさん見てから安定の佐田さんトコ😁
ワタシヌカリナイ(笑)",no name yama,0,2022-10-27T08:45:32Z,2022-10-27T08:45:32Z
ゲキ渋！！言わせたいやつには言わせとけばイイ,ゲキ渋！！言わせたいやつには言わせとけばイイ,ひらのつかさ,0,2022-10-25T13:59:39Z,2022-10-25T13:59:39Z
自分の旭風防はミドルサイズをほんのちょい前倒しで着けてます😅 自然熟成3年でタレは日焼けして薄くなり、スクリーンは黄ばみ、金具はサビサビになってます😁自分がいいと思う仕様でいいんですよ 自分が乗るんですからね,"自分の旭風防はミドルサイズをほんのちょい前倒しで着けてます😅
 自然熟成3年でタレは日焼けして薄くなり、スクリーンは黄ばみ、金具はサビサビになってます😁
自分がいいと思う仕様でいいんですよ 自分が乗るんですからね",オーシャン,0,2022-10-25T11:11:14Z,2022-10-25T11:11:14Z
風防の垂れ布のヤレ大事ですよね！スクリーンは一緒に入浴わかる😂いっそうキマりましたね👍,"風防の垂れ布のヤレ大事ですよね！
スクリーンは一緒に入浴わかる😂
いっそうキマりましたね👍",doggs0828,0,2022-10-25T11:50:10Z,2022-10-25T11:50:10Z
作田マッハ速人,作田マッハ速人,チャットワラン,0,2022-10-25T13:17:18Z,2022-10-25T13:17:18Z
マッハ渋渋チャンネルやってるわぁ✨,マッハ渋渋チャンネルやってるわぁ✨,天から湯豆腐,0,2022-10-26T00:36:30Z,2022-10-26T00:36:30Z
布たれはハイダーで漂白派でした❕,布たれはハイダーで漂白派でした❕,ken selfmade,0,2022-10-25T12:16:59Z,2022-10-25T12:16:59Z
クッソ渋い‼︎早く風防黄ばんでーっ❤,クッソ渋い‼︎早く風防黄ばんでーっ❤,I.G.F,0,2022-10-25T09:50:58Z,2022-10-25T09:50:58Z
大人チャンネルはここから！ってときに　用事がありそのあと観忘れてました😂あのあと　走りに行ったのかな〜🤔,"大人チャンネルはここから！ってときに　用事がありそのあと観忘れてました😂
あのあと　走りに行ったのかな〜🤔",柳ぶぅ,0,2022-10-27T05:34:24Z,2022-10-27T05:34:24Z
21:23 ～かわいい,"21:23 ～
かわいい",C53 98,1,2022-10-26T09:42:09Z,2022-10-26T09:42:09Z
カッケー🤩,カッケー🤩,薄めのだいきんマン,0,2022-10-25T09:48:48Z,2022-10-25T09:48:48Z
待ってました,待ってました,しゃけ握り,0,2022-10-25T09:02:13Z,2022-10-25T09:02:21Z
風防はないわぁどうしてもヤンチャ仕様になってしまって草,風防はないわぁどうしてもヤンチャ仕様になってしまって草,志 篠原,0,2022-10-27T10:42:17Z,2022-10-27T10:42:17Z
風防絞りのくだりはドルフィンで読んだな…あれも神奈川の話でしたね,風防絞りのくだりはドルフィンで読んだな…あれも神奈川の話でしたね,たかしくん,0,2022-10-25T12:51:32Z,2022-10-25T12:56:25Z
途中からマッコイさんいるのかと思ったw,途中からマッコイさんいるのかと思ったw,ヤッサン・D・トラッカー,1,2022-10-25T10:58:19Z,2022-10-25T10:58:19Z
最近見たカスタムで1番イケてる,最近見たカスタムで1番イケてる,玉木,0,2022-10-25T22:00:28Z,2022-10-25T22:00:28Z
サムネかっちょよ～～👍,サムネかっちょよ～～👍,ta-ku,0,2022-10-25T10:10:56Z,2022-10-25T10:10:56Z
宇野くんのCバブも風防付けましょうよー(笑),宇野くんのCバブも風防付けましょうよー(笑),BOSS,1,2022-10-25T13:25:00Z,2022-10-25T13:25:00Z
マッハめちゃめちゃかっこよくなりましたね✨✨✨✨これを悪く言う奴の頭どーかしてるぜー笑,マッハめちゃめちゃかっこよくなりましたね✨✨✨✨これを悪く言う奴の頭どーかしてるぜー笑,ukamosh9's,0,2022-10-25T12:10:26Z,2022-10-25T12:10:26Z
サムネかっけーー😊,サムネかっけーー😊,魑魅魍魎,0,2022-10-25T09:58:24Z,2022-10-25T09:58:24Z
待ってたチャンネル🎉,待ってたチャンネル🎉,ゆ,0,2022-10-25T13:17:46Z,2022-10-25T13:17:46Z
サムネ‼️まさかの本の内表紙のぽー🎉😊,サムネ‼️まさかの本の内表紙のぽー🎉😊,野中寿義,0,2022-10-25T13:54:08Z,2022-10-25T13:54:08Z
カッコイイです‼️,カッコイイです‼️,naokichi Pont haut,0,2022-10-25T09:18:24Z,2022-10-25T09:18:24Z
赤ちゃ金ぞ！最高！押忍！！！,赤ちゃ金ぞ！最高！押忍！！！,鳥好き店長,0,2022-10-25T09:02:26Z,2022-10-25T09:02:26Z
色々勉強になるカスタムですね！😁サタビルダーズの半袖Tシャツとズボン再販宜しく御願いしますm(_ _)m,"色々勉強になるカスタムですね！😁
サタビルダーズの半袖Tシャツとズボン再販宜しく御願いしますm(_ _)m",AKB48全盛期の卒業生推し,0,2022-10-25T12:13:37Z,2022-10-25T12:13:37Z
シビレマス！！✨️✨️,シビレマス！！✨️✨️,kee -a,0,2022-10-25T11:29:41Z,2022-10-25T11:29:41Z
ナンバープレートって曲げてもいいんですか？,ナンバープレートって曲げてもいいんですか？,やんたか,0,2022-10-26T09:44:15Z,2022-10-26T09:44:15Z
社長のインスタでうっすら映っちゃってたからうわぁかっけえの感情が薄れちゃった,社長のインスタでうっすら映っちゃってたからうわぁかっけえの感情が薄れちゃった,らるりる,0,2022-10-25T10:07:01Z,2022-10-25T10:07:01Z
ぶちカッケー‼️,ぶちカッケー‼️,コインロッカーBaby,0,2022-10-25T09:06:24Z,2022-10-25T09:06:24Z
動画を真剣に見てたら旦那に原付改造すんなよって言われました(笑),動画を真剣に見てたら旦那に原付改造すんなよって言われました(笑),まき,0,2022-10-25T12:49:03Z,2022-10-25T12:49:03Z
道連れにためらいない宇野さん。総長を本気で慕ってるから出来ることなんだろうなぁ。冗談でもいやいやってなりそうなのに。,道連れにためらいない宇野さん。総長を本気で慕ってるから出来ることなんだろうなぁ。冗談でもいやいやってなりそうなのに。,yasu t-,0,2022-10-25T13:19:17Z,2022-10-25T13:19:17Z
渋カッコいい✨くぅ〜たまらんデス🥰🥰🥰,渋カッコいい✨くぅ〜たまらんデス🥰🥰🥰,mohizero,0,2022-10-25T15:18:31Z,2022-10-25T15:18:31Z
ヘッドライトアップして欲しい！！！,ヘッドライトアップして欲しい！！！,ポポぽぽ,0,2022-10-25T09:19:46Z,2022-10-25T09:19:46Z
条件反社が最高,条件反社が最高,ブラッキー&シナモン,0,2022-10-25T12:48:34Z,2022-10-25T12:48:34Z
1人芝居ご苦労様でした☺️マッハちゃんメチャクチャ渋くなったな👍🤣リーゼント風防バッチリやし😁やっぱり赤に金は合うよな‼️黒に金も好きやけど🤣横兄の調整で更に音が良くなるのは流石やな👍ナイッスー🤣押忍〜‼️,"1人芝居ご苦労様でした☺️マッハちゃんメチャクチャ渋くなったな👍🤣リーゼント風防バッチリやし😁
やっぱり赤に金は合うよな‼️
黒に金も好きやけど🤣
横兄の調整で更に音が良くなるのは流石やな👍ナイッスー🤣押忍〜‼️",松ちゃん,0,2022-10-25T12:31:15Z,2022-10-25T12:31:15Z
9:43AE86映ってて草,"9:43
AE86映ってて草",チキリたろう,0,2022-10-25T11:13:02Z,2022-10-25T11:13:02Z
僕は、風防の布をキッチンハイターに浸けて多少色抜きして付けてました。。　　濱連OBより！！！,僕は、風防の布をキッチンハイターに浸けて多少色抜きして付けてました。。　　濱連OBより！！！,syokunin boku,0,2022-10-26T06:47:24Z,2022-10-26T06:47:24Z
サムネ単車の虎かと思いました,サムネ単車の虎かと思いました,DAIJI,0,2022-10-26T10:33:27Z,2022-10-26T10:33:27Z
やった😃✌️、バリバリ、渋い。,やった😃✌️、バリバリ、渋い。,丸山敬二,0,2022-10-25T10:09:09Z,2022-10-25T10:09:09Z
渋か〜👍,渋か〜👍,宿命の勇二,0,2022-10-25T13:27:09Z,2022-10-25T13:27:09Z
作田さん。こんばんわ～🙂いや～🙂カッコイイですよ。昭和感が出ていますね。渋いです。最高～です😗見てるだけでお酒進みそうです。,作田さん。こんばんわ～🙂いや～🙂カッコイイですよ。昭和感が出ていますね。渋いです。最高～です😗見てるだけでお酒進みそうです。,SNE channel,0,2022-10-25T10:33:48Z,2022-10-25T10:33:48Z
カスタムでも、法を破って無ければ良いと思いますよー🤗大人にもなってナンバープレートをシャクリ上げてるよりは余程か良い。渋いと思う、👍,"カスタムでも、法を破って無ければ良いと思いますよー🤗
大人にもなってナンバープレートをシャクリ上げてるよりは余程か良い。
渋いと思う、👍",ドライブサクラ,0,2022-10-25T12:13:33Z,2022-10-25T12:13:33Z
風防はリーゼント派,風防はリーゼント派,捲り屋,0,2022-10-25T10:51:47Z,2022-10-25T10:51:47Z
マッハ　バリ渋‼️,マッハ　バリ渋‼️,カズ,1,2022-10-25T10:01:06Z,2022-10-25T10:01:06Z
総長！押忍です！自分は東京昭島という所でしたが新幹線風防を（ドッカン風防）と言われていました！ご存知ですか？,総長！押忍です！自分は東京昭島という所でしたが新幹線風防を（ドッカン風防）と言われていました！ご存知ですか？,清水誠,0,2022-10-25T12:26:09Z,2022-10-25T12:26:09Z
ワタシミミカタムケナイ。悟りの境地ですね(笑),"ワタシミミカタムケナイ。
悟りの境地ですね(笑)",カストロール10W-40,0,2022-10-25T11:43:08Z,2022-10-25T11:43:08Z
サムネがゲキシブっす,サムネがゲキシブっす,アカシンスカイウォーカー,1,2022-10-26T14:00:29Z,2022-10-26T14:00:29Z
ありがとう総長、仕事から疲れて帰ってきた俺にもバイク乗りに行く理由ができたよ,ありがとう総長、仕事から疲れて帰ってきた俺にもバイク乗りに行く理由ができたよ,ぎじぇるも,0,2022-10-25T09:21:49Z,2022-10-25T09:21:49Z
たまに本気でコールの事とか注意してるやついるけどわかった上でやってるっていい加減気付け。さぶいぞ。,たまに本気でコールの事とか注意してるやついるけどわかった上でやってるっていい加減気付け。さぶいぞ。,Shinya.Fukuda,3,2022-10-25T09:30:43Z,2022-10-25T09:30:43Z
やっぱ２ストいいなあ！痺れる！,やっぱ２ストいいなあ！痺れる！,tai mas,0,2022-10-25T09:09:37Z,2022-10-25T09:09:37Z
ナイっす〜〜〜〜♪徳ちゃんみたい❤️,"ナイっす〜〜〜〜♪


徳ちゃんみたい❤️",静,0,2022-10-25T11:42:35Z,2022-10-25T11:42:35Z
日章旗は日の丸　タンクのカラーは旭日旗むかーし自転車に旗棒つけてたころに戦争行った爺ちゃんからおそわりました(⁠•⁠‿⁠•⁠),"日章旗は日の丸　タンクのカラーは旭日旗
むかーし自転車に旗棒つけてたころに
戦争行った爺ちゃんからおそわりました(⁠•⁠‿⁠•⁠)",睡魔のZ,1,2022-10-25T15:38:34Z,2022-10-25T15:38:34Z
作田合唱団www,作田合唱団www,nightofstar13,0,2022-10-26T03:07:40Z,2022-10-26T03:07:40Z
ナイツーが見たかったー😂,ナイツーが見たかったー😂,fijpnns70,0,2022-10-25T12:26:32Z,2022-10-25T12:26:32Z
横兄さんのエプロンってワークマンのやつですよね？結構動画見てきましたが、初めて気づきました。,"横兄さんのエプロンってワークマンのやつですよね？
結構動画見てきましたが、初めて気づきました。",yusaku okamoto,0,2022-10-25T11:48:46Z,2022-10-25T11:48:46Z
色合いがアレだよなチャンバー黄色にすりゃいいのに！,"色合いがアレだよな

チャンバー黄色にすりゃいいのに！",c c,0,2022-10-27T04:51:40Z,2022-10-27T04:51:40Z
渋っ!?💖,渋っ!?💖,アリス暴走天使,0,2022-10-25T10:04:57Z,2022-10-25T10:04:57Z
総長より横兄の方が儲かってるよな？,総長より横兄の方が儲かってるよな？,Ākāśagarbh,0,2022-10-25T13:19:05Z,2022-10-25T13:19:05Z
自分の地元　武蔵村山はもうちょっとおこしてましたね🤣,自分の地元　武蔵村山はもうちょっとおこしてましたね🤣,佐藤徳郎,0,2022-10-26T06:55:41Z,2022-10-26T06:55:41Z
ぶっちゃけ、総長ゴリラ説,ぶっちゃけ、総長ゴリラ説,Y.Youichino,1,2022-10-25T10:10:03Z,2022-10-25T10:10:03Z
八王子では、短風防おったて　たんふうぼうおったてと言いますけん,八王子では、短風防おったて　たんふうぼうおったてと言いますけん,sg atugi,1,2022-10-26T04:07:44Z,2022-10-26T04:07:44Z
僕は最後までみてますよ😄見終わってからコメントするかしないか考えてます。😄,僕は最後までみてますよ😄見終わってからコメントするかしないか考えてます。😄,厚揚げ隊長,0,2022-10-25T10:01:04Z,2022-10-25T10:01:04Z
40年以上前に通学してた小学生の近くに杖ついてたよぼよぼ爺さんが、くろがね？サイドカーで上下黒に白のバンダナ口に巻いて颯爽と乗ってる姿がカッコイイと評判でした。月光仮面と呼んでました👍バイクってそう言う格好良さありますよね👍👏よぼよぼ爺さん→サイドカー月光仮面→最強ダゼッ👍💯,40年以上前に通学してた小学生の近くに杖ついてたよぼよぼ爺さんが、くろがね？サイドカーで上下黒に白のバンダナ口に巻いて颯爽と乗ってる姿がカッコイイと評判でした。月光仮面と呼んでました👍バイクってそう言う格好良さありますよね👍👏よぼよぼ爺さん→サイドカー月光仮面→最強ダゼッ👍💯,サブロージロー,0,2022-10-26T02:39:44Z,2022-10-26T02:39:44Z
めちゃくちゃ　かっけ〜😆❤️,めちゃくちゃ　かっけ〜😆❤️,あかしろ太郎,0,2022-10-25T09:58:51Z,2022-10-25T09:58:51Z
激渋,激渋,ナナメ氷,0,2022-10-25T09:41:26Z,2022-10-25T09:41:26Z
反社が感謝 押忍です🤣,反社が感謝 押忍です🤣,51ken-feet,0,2022-10-25T14:12:54Z,2022-10-25T14:12:54Z
福岡のＵ❗️🤣福岡で流行るばい！,"福岡のＵ❗️🤣
福岡で流行るばい！",Hand well,0,2022-10-25T10:17:54Z,2022-10-25T10:17:54Z
マッハって短い？,マッハって短い？,リバウンド王,0,2022-10-26T11:29:26Z,2022-10-26T11:29:26Z
佐田兄！ちょいちょい茶目っけ出すの辞めていただけますか？さらに好きになっちゃうので！あんだけいじらんでノーマルで乗る言うてたのに😅,佐田兄！ちょいちょい茶目っけ出すの辞めていただけますか？さらに好きになっちゃうので！あんだけいじらんでノーマルで乗る言うてたのに😅,saiko,0,2022-10-25T13:52:57Z,2022-10-25T13:52:57Z
渋ーーー！,渋ーーー！,t_toshi OK,0,2022-10-25T15:07:21Z,2022-10-25T15:07:21Z
サムネで女性ファンはびしょ濡れですな！！！,サムネで女性ファンはびしょ濡れですな！！！,k t,0,2022-10-25T16:38:21Z,2022-10-25T16:38:21Z
これを待ってまし田チャンネル,これを待ってまし田チャンネル,Needs Next,0,2022-10-25T10:53:43Z,2022-10-25T10:53:43Z
マッハめっちかっこいいFXはいじらないんですか,"マッハめっちかっこいい
FXはいじらないんですか",らい26,0,2022-10-25T09:09:20Z,2022-10-25T09:09:20Z
押忍！,押忍！,K HR,0,2022-10-25T09:15:42Z,2022-10-25T09:15:42Z
