textDisplay,textOriginal,authorDisplayName,likeCount,publishedAt,updatedAt
かっこいいですねマッハ,かっこいいですねマッハ,拓磨チャンネル,0,2022-10-25T11:39:24Z,2022-10-25T11:39:24Z
また一段とカッコよくなった👏,また一段とカッコよくなった👏,yasu110,0,2022-10-25T10:11:54Z,2022-10-25T10:11:54Z
マッハやKHよりも380の方が音が良いのはシリンダーフィンの共鳴音じゃないかと思う。車体のかっこよさは川崎だけど音は380の方がよかったなぁ。,"マッハやKHよりも380の方が音が良いのはシリンダーフィンの共鳴音じゃないかと思う。
車体のかっこよさは川崎だけど音は380の方がよかったなぁ。",F S,0,2022-10-25T11:53:08Z,2022-10-25T11:53:08Z
サムネがバリ渋い！！かっこよ,サムネがバリ渋い！！かっこよ,バイクブンブン,1,2022-10-25T11:20:38Z,2022-10-25T11:20:38Z
めちゃくちゃかっこよかーです🐟！！,めちゃくちゃかっこよかーです🐟！！,かます🐟ふりーBGM🐟,0,2022-10-25T23:26:14Z,2022-10-25T23:26:14Z
サムネ、めっちゃカッコイイ‼️,サムネ、めっちゃカッコイイ‼️,Cafe_637 Lush,0,2022-10-25T09:26:17Z,2022-10-25T09:26:17Z
風ー防は、渋いッ！間違いない☆,風ー防は、渋いッ！間違いない☆,69 shah,0,2022-10-25T13:34:13Z,2022-10-25T13:34:13Z
9:52佐田さんが満足そうで何より😊,9:52佐田さんが満足そうで何より😊,いなぎのシグずき,0,2022-10-25T10:40:55Z,2022-10-25T10:40:55Z
音ってめちゃくちゃ大事ですよね乗り手の馬力が上がる,"音ってめちゃくちゃ大事ですよね
乗り手の馬力が上がる",ぷしじゃん,10,2022-10-25T10:15:21Z,2022-10-25T10:15:21Z
バリ渋リーゼント風防誕生🎉✨大好きな泣い田さんも見れたー🤣✨早く疾走するnewマッハ見たい❤今日もカスタムに励む漢に押〜忍✨,"バリ渋リーゼント風防誕生🎉✨
大好きな泣い田さんも見れたー🤣✨
早く疾走するnewマッハ見たい❤
今日もカスタムに励む漢に押〜忍✨",K5 #nyan,1,2022-10-25T12:19:37Z,2022-10-25T12:19:37Z
マッハ走行動画はよっ！！！絶対かっこいいやん✨まあ眺めるだけで酒飲める単車だもんな〜😊,"マッハ走行動画はよっ！！！
絶対かっこいいやん✨
まあ眺めるだけで酒飲める単車だもんな〜😊",愚麗ZUMA,0,2022-10-25T09:26:03Z,2022-10-25T09:26:03Z
作田総長お疲れ様です😉👍マッハめちゃくちゃかっこいいですね〜😉これからも、素晴らしい動画UP楽しみに待ってま〜す🤗,作田総長お疲れ様です😉👍マッハめちゃくちゃかっこいいですね〜😉これからも、素晴らしい動画UP楽しみに待ってま〜す🤗,剛神会 総裁,0,2022-10-25T09:47:55Z,2022-10-25T09:47:55Z
ここまで来たらホイル金メッキにしたら似合いそう,ここまで来たらホイル金メッキにしたら似合いそう,maria naruse,0,2022-10-26T06:26:13Z,2022-10-26T06:26:13Z
いつも面白いです😊,いつも面白いです😊,勇介 井内,0,2022-10-25T12:39:01Z,2022-10-25T12:39:01Z
イジって楽しい時の心の声がダダ漏れするテンションわっかるぅ😆,イジって楽しい時の心の声がダダ漏れするテンションわっかるぅ😆,鈴木孝之,0,2022-10-25T09:48:53Z,2022-10-25T09:48:53Z
熊ッハ😂からのミヤマクマッハ😂ワードチョイスが秀逸👏いよいよ来週福岡へ!,"熊ッハ😂からのミヤマクマッハ😂
ワードチョイスが秀逸👏
いよいよ来週福岡へ!",元樹,0,2022-10-25T13:57:31Z,2022-10-25T13:57:31Z
総長渋いマッハです❤,総長渋いマッハです❤,わんぱく圭佑,0,2022-10-25T10:11:14Z,2022-10-25T10:11:14Z
紐、切れるんじゃないかなぁ…と思ったら案の定…😅,紐、切れるんじゃないかなぁ…と思ったら案の定…😅,1966 Toughcat,0,2022-10-26T10:00:58Z,2022-10-26T10:00:58Z
ここでこの写真がサムネイルとして活きて来るとは…！,ここでこの写真がサムネイルとして活きて来るとは…！,トゥインクルライダーズちゃんねる,0,2022-10-25T09:32:01Z,2022-10-25T09:32:01Z
サムネが堪らなく大人のぉ〜って感じでかっこいいです,サムネが堪らなく大人のぉ〜って感じでかっこいいです,NA.,2,2022-10-25T18:31:01Z,2022-10-25T18:31:01Z
かっこいい〜✨,かっこいい〜✨,おうらOura,0,2022-10-25T10:35:04Z,2022-10-25T10:35:04Z
族車わからんけど、渋い🎉,族車わからんけど、渋い🎉,米宏,0,2022-10-25T11:23:52Z,2022-10-25T11:23:52Z
こりゃ第2回Ｚ1グランプリあるかな？ねえ～作田総長！楽しみにしています。,こりゃ第2回Ｚ1グランプリあるかな？ねえ～作田総長！楽しみにしています。,雅,0,2022-10-25T11:40:32Z,2022-10-25T11:40:32Z
あー、コラボの時、とくちゃんのマッハに風防付いてたなぁ…wしかし、俺達の旅は終わらない！で常に進化してますねぇ(^^)これであえて3段シートじゃなくて少し大きめのタンデムバーに変わったら…,"あー、コラボの時、とくちゃんのマッハに風防付いてたなぁ…w
しかし、俺達の旅は終わらない！で常に進化してますねぇ(^^)
これであえて3段シートじゃなくて少し大きめのタンデムバーに変わったら…",kuma,0,2022-10-25T15:11:08Z,2022-10-25T15:33:48Z
マッハかっちょえーっすね！　話変わりますが、佐田さんにBreakingDown(ブレイキングダウン)出てもらいたいな～　ウインウインでいいだろうな～,"マッハかっちょえーっすね！　
話変わりますが、佐田さんにBreakingDown(ブレイキングダウン)出てもらいたいな～　
ウインウインでいいだろうな～",Ken,0,2022-10-25T15:08:46Z,2022-10-25T15:20:08Z
作田合唱〜団〜！？コールで今日も作るの〜やるしかないでしょ,"作田合唱〜団〜！？
コールで今日も作るの〜
やるしかないでしょ",ふじまー,0,2022-10-25T11:10:19Z,2022-10-25T11:10:19Z
総長！自分はアンチじゃないです！が、風防の紐を引きちぎった時、流石に声出して笑ってしまいました！反省してます！でもそれを横にいが直してくれて心温まりました！あとスピードガンで合わせてるところは勉強になりました！,"総長！自分はアンチじゃないです！が、
風防の紐を引きちぎった時、流石に声出して笑ってしまいました！反省してます！でもそれを横にいが直してくれて心温まりました！
あとスピードガンで合わせてるところは勉強になりました！",vp20n yamaha,0,2022-10-25T10:09:21Z,2022-10-25T10:09:21Z
"カッコいいです, 日本のバイクは最高です","カッコいいです, 日本のバイクは最高です",Hagenabe,0,2022-10-26T14:03:30Z,2022-10-26T14:03:30Z
今回の動画も面白かったですやっぱり赤に金は合いますねー！かっこいい‼️あとは風防ひとつでマッハの印象がガラリと変わったなーって思いました次も楽しみにまってます、北九州の20歳のファンより,"今回の動画も面白かったです
やっぱり赤に金は合いますねー！かっこいい‼️
あとは風防ひとつでマッハの印象がガラリと変わったなーって思いました
次も楽しみにまってます、

北九州の20歳のファンより",小西駿佑,0,2022-10-25T13:51:38Z,2022-10-25T13:51:38Z
サムネカッコいいです！,サムネカッコいいです！,まり,1,2022-10-25T09:25:08Z,2022-10-25T09:25:08Z
作田総長お疲れ様でーす！押忍！正月はマッハ族車仕様ですかね！押忍！,"作田総長お疲れ様でーす！押忍！
正月はマッハ族車仕様ですかね！押忍！",yousuke taniguchi,0,2022-10-25T09:05:14Z,2022-10-25T09:05:14Z
風防渋くてカッコいいです😆🎵🎵アンチは気にしないで行って下さい！,"風防渋くてカッコいいです😆🎵🎵

アンチは気にしないで行って下さい！",青空最高,0,2022-10-25T11:00:41Z,2022-10-25T11:00:41Z
次回もバリ面白いヤツやん🤣,次回もバリ面白いヤツやん🤣,もりりんDS,0,2022-10-25T15:29:44Z,2022-10-25T15:29:44Z
めちゃくちゃカッコいいです！アンチコメントは気にしないでおきましょう🙆佐田さんの動画私は大好きですよ🎵,めちゃくちゃカッコいいです！アンチコメントは気にしないでおきましょう🙆佐田さんの動画私は大好きですよ🎵,スプラマニアあちゃこ,1,2022-10-25T10:34:39Z,2022-10-25T10:34:39Z
サムネがめちゃくちゃカッコイイ！,サムネがめちゃくちゃカッコイイ！,まるぞう,0,2022-10-25T09:01:04Z,2022-10-25T09:01:04Z
ガタイがいいから中型は小さく見えますね,ガタイがいいから中型は小さく見えますね,x japn,0,2022-10-26T12:36:41Z,2022-10-26T12:36:41Z
作田総長、マッハ、ヤバいぐらい渋くなりましたね。まさかハンドルカスタムだけかと思いきや、リーゼント風防追加してカスタム渋すぎます！風防の紐を怪力で切ってしまい、泣い田に爆笑させていただきました。さすが神奈川代表横兄さんもマッハのポイント調整凄すぎ。良き音になったマッハのツーリング動画楽しみにしてます。押〜忍❗️,作田総長、マッハ、ヤバいぐらい渋くなりましたね。まさかハンドルカスタムだけかと思いきや、リーゼント風防追加してカスタム渋すぎます！風防の紐を怪力で切ってしまい、泣い田に爆笑させていただきました。さすが神奈川代表横兄さんもマッハのポイント調整凄すぎ。良き音になったマッハのツーリング動画楽しみにしてます。押〜忍❗️,ショウ君,0,2022-10-25T14:22:24Z,2022-10-25T14:22:24Z
1週間後くらいに「わざと雨晒しにして熟成させたり、熱湯掛けて風防絞ったりしたなぁ。」とか言ってくるおっちゃん大量発生するんだよなぁ…。,1週間後くらいに「わざと雨晒しにして熟成させたり、熱湯掛けて風防絞ったりしたなぁ。」とか言ってくるおっちゃん大量発生するんだよなぁ…。,ごんぞう,0,2022-10-25T12:57:30Z,2022-10-25T12:57:30Z
やば。さいこーっすね！横兄さんの店でバイク買いたくなる。,"やば。さいこーっすね！
横兄さんの店でバイク買いたくなる。",Y u,0,2022-10-26T04:04:58Z,2022-10-26T04:04:58Z
"釣りよかさんからやってきて、コラボ見るなら色々知ってから見たほうがいいと思って、SATAbuilder'sを始めっから観ました！！結果、、、どハマり！くっそ面白くて全部観ても、ずーっと流しっぱなしで観てます。夜のルーティンです。今は、仲間たちの初登場に特化して観てます。作田さんのネーミングセンスと替え歌が大好きで、""包茎人間""はお腹切れるほど笑いました😇人間味の面白さと、芸人さんとしての面白さ、目が離せません！絶対来年は一人芝居もバットボーイズのも観に行くと決めてます！","釣りよかさんからやってきて、コラボ見るなら色々知ってから見たほうがいいと思って、SATAbuilder'sを始めっから観ました！！
結果、、、どハマり！くっそ面白くて全部観ても、ずーっと流しっぱなしで観てます。夜のルーティンです。今は、仲間たちの初登場に特化して観てます。
作田さんのネーミングセンスと替え歌が大好きで、""包茎人間""はお腹切れるほど笑いました😇
人間味の面白さと、芸人さんとしての面白さ、目が離せません！絶対来年は一人芝居もバットボーイズのも観に行くと決めてます！",平田,2,2022-10-25T09:46:16Z,2022-10-25T09:49:29Z
11:28Siriが出てくるタイミングでマジ笑ったwww,"11:28
Siriが出てくるタイミングでマジ笑ったwww",なおみん,0,2022-10-25T10:24:38Z,2022-10-25T10:25:11Z
総長、三回観ちゃいましたかっこいいなぁ横須賀に来た時にたまたまお会いできたら絶対に一緒に写真とらせてください,"総長、三回観ちゃいました
かっこいいなぁ
横須賀に来た時にたまたまお会いできたら絶対に一緒に写真とらせてください",藤村桂一,0,2022-10-25T09:51:03Z,2022-10-25T09:51:03Z
まじ最高です！,まじ最高です！,ネイマール,0,2022-10-26T10:58:37Z,2022-10-26T10:58:37Z
かっこよすぎ😍,かっこよすぎ😍,みこ,0,2022-10-25T11:06:09Z,2022-10-25T11:06:09Z
ヤバ、カッコイイ👍センスが素晴らしい,"ヤバ、カッコイイ👍
センスが素晴らしい",シュウ,0,2022-10-25T23:25:23Z,2022-10-25T23:25:23Z
いつも楽しく見てます。最近、嫁や4歳の娘も一緒に見てます。嫁は、観葉植物の動画が凄い好きで。最近動画ないので、また観葉植物の動画をアップしてください！4歳の娘は、マーチョンポンが大好きなんで。たまにやってもらえると嬉しいです！,"いつも楽しく見てます。最近、嫁や4歳の娘も一緒に見てます。嫁は、観葉植物の動画が凄い好きで。最近動画ないので、また観葉植物の動画をアップしてください！
4歳の娘は、マーチョンポンが大好きなんで。たまにやってもらえると嬉しいです！",VIP,1,2022-10-26T15:26:46Z,2022-10-26T15:26:46Z
真っ直ぐで純白な心を持ったバカまじめな大人！総長！惚れるよ決めた、俺ももう一回バカ熱く生きよ何歳からでも再出発できるわ,"真っ直ぐで純白な心を持ったバカまじめな大人！
総長！惚れるよ
決めた、俺ももう一回バカ熱く生きよ
何歳からでも再出発できるわ",OKKi,0,2022-10-25T12:21:25Z,2022-10-25T12:21:25Z
やはり風防はリーゼントに限る🕺✨,やはり風防はリーゼントに限る🕺✨,松ヒ,0,2022-10-25T13:17:53Z,2022-10-25T13:18:14Z
待ってました🤩ハンサム‼︎,待ってました🤩ハンサム‼︎,tokita,0,2022-10-25T09:00:37Z,2022-10-25T09:00:37Z
エエ音やねぇ👍ZRX1台🏍で満足してたけど、もう1台中型🏍欲しくなってきた😎,"エエ音やねぇ👍
ZRX1台🏍で満足してたけど、もう1台中型🏍欲しくなってきた😎",zettoness,0,2022-10-25T09:20:53Z,2022-10-25T09:20:53Z
佐田さん横兄さん宇野くん今回もありがとうございます。やっぱいい音ですねぇ☺️めちゃくちゃかっこいいので羨ましいです😁寒くなってるので体調気をつけてくださいね👍いつも楽しい物をありがたき押〜忍🙏,"佐田さん横兄さん宇野くん今回もありがとうございます。やっぱいい音ですねぇ☺️めちゃくちゃかっこいいので羨ましいです😁
寒くなってるので体調気をつけてくださいね👍いつも楽しい物をありがたき押〜忍🙏",Takeshi OOgawara,0,2022-10-26T13:51:47Z,2022-10-26T13:51:47Z
総長　泣い田さん可愛かったです　いただきました！あざっす,"総長　泣い田さん可愛かったです　
いただきました！あざっす",M M,0,2022-10-26T00:01:24Z,2022-10-26T00:01:24Z
マッハかっけぇなクォリティたけぇなおい。,マッハかっけぇなクォリティたけぇなおい。,インプレッサGC8,0,2022-10-25T11:09:04Z,2022-10-25T11:09:04Z
神鳴エンヂニアリングのグリップめっちゃ柔らかくて気持ちいいから一度使ってみてください笑‼️🥹,神鳴エンヂニアリングのグリップめっちゃ柔らかくて気持ちいいから一度使ってみてください笑‼️🥹,TOMOYA5726,0,2022-10-26T07:51:10Z,2022-10-26T07:51:10Z
牧場搾り〜♪みたいな神奈川搾りで笑いました笑,"牧場搾り〜♪
みたいな神奈川搾りで笑いました笑",すけだい,0,2022-10-25T14:46:00Z,2022-10-25T14:46:00Z
飛行艇からはじまるとは🎉最高,飛行艇からはじまるとは🎉最高,とも,0,2022-10-26T04:33:57Z,2022-10-26T04:33:57Z
風防はしもにーが前つけてたやつ貰うのかと思ってましたがまでヤレ加工してたとはw新生マッハのサウンド聞きたいのでツーリング動画お願いします！佐田さん舞台お疲れ様でした！最高でした！！,"風防はしもにーが前つけてたやつ貰うのかと思ってましたがまでヤレ加工してたとはw
新生マッハのサウンド聞きたいのでツーリング動画お願いします！
佐田さん舞台お疲れ様でした！最高でした！！",メゥトモテラホシス,0,2022-10-25T09:50:13Z,2022-10-25T09:50:13Z
そろそろCBＲ400Fもだしてほしいんじゃなかろかー( 💓∀💓),そろそろCBＲ400Fもだしてほしいんじゃなかろかー( 💓∀💓),みーチャンネル,0,2022-10-25T13:12:13Z,2022-10-25T13:12:13Z
ポイント調整懐かしい～、本当に微妙なんですよねえ,ポイント調整懐かしい～、本当に微妙なんですよねえ,Maximillian Jones,0,2022-10-25T13:36:12Z,2022-10-25T13:36:12Z
16:38それぐらいつけるのが楽しいんだね。,16:38それぐらいつけるのが楽しいんだね。,いなぎのシグずき,0,2022-10-25T10:49:35Z,2022-10-25T10:49:35Z
私は風防の棒は曲げるの面倒だからメーターの全ネジカットして使ってますね。,私は風防の棒は曲げるの面倒だからメーターの全ネジカットして使ってますね。,小野里繁,0,2022-10-25T09:40:18Z,2022-10-25T09:40:18Z
カスタム終了したあとに、ちゃんと片付けしてる総長にキュン💕,カスタム終了したあとに、ちゃんと片付けしてる総長にキュン💕,ゆきっぺ,1,2022-10-25T09:49:47Z,2022-10-25T09:49:47Z
早く走りに行きたい❗️って総長は我慢でけん 子供ですもんね😁 たまらん😆,"早く走りに行きたい❗️って
総長は我慢でけん 子供ですもんね😁 
たまらん😆",吉田よしだ,1,2022-10-26T08:27:42Z,2022-10-26T08:27:42Z
ちぎれ田😂😂 パワフル過ぎっとたい笑,ちぎれ田😂😂 パワフル過ぎっとたい笑,駅子,0,2022-10-25T10:01:01Z,2022-10-25T10:01:01Z
総長‼️激渋🎉,総長‼️激渋🎉,宮武敬二,0,2022-10-25T12:17:40Z,2022-10-25T12:17:40Z
僕も佐田さんみたいなおじさんになりたいです。,僕も佐田さんみたいなおじさんになりたいです。,RYUu !,0,2022-10-25T12:05:00Z,2022-10-25T12:05:00Z
イケてますね❤️次はフロント足回りにゴールド入れたいですね👍✨,イケてますね❤️次はフロント足回りにゴールド入れたいですね👍✨,こぢこぢ。,0,2022-10-25T23:30:08Z,2022-10-25T23:30:08Z
今日（10/26）の朝9時半ごろ3号渋谷線で渋滞をすり抜けていく宇野君を目撃しました。バイクとヘルメットと体型ですぐ分かりますね(笑),"今日（10/26）の朝9時半ごろ3号渋谷線で渋滞をすり抜けていく宇野君を目撃しました。
バイクとヘルメットと体型ですぐ分かりますね(笑)",1984 Hase nao,0,2022-10-26T13:39:15Z,2022-10-26T13:39:15Z
かっこいい！！,かっこいい！！,石川カツオ,0,2022-10-25T13:02:40Z,2022-10-25T13:02:40Z
このマッハは、まさしくイナズマンカラー!!茶色いシートはサナギマン!青黄赤で、イナズマン!!　剛力招来!超力招来!カッコイイカラーデザイン!!　押忍〜!,"このマッハは、まさしくイナズマンカラー!!茶色いシートはサナギマン!青黄赤で、イナズマン!!　
剛力招来!超力招来!カッコイイカラーデザイン!!　押忍〜!",瞬火,0,2022-10-25T10:49:36Z,2022-10-25T10:49:36Z
新品の風防と一緒にお風呂入って曲げてました笑,新品の風防と一緒にお風呂入って曲げてました笑,おサモライ,0,2022-10-25T13:48:59Z,2022-10-25T13:48:59Z
もうこうなったら旗棒も付けましょう！😝,もうこうなったら旗棒も付けましょう！😝,とーも だだだ,0,2022-10-25T11:05:33Z,2022-10-25T11:05:33Z
おはようございます😃風防もカッコいいね、惚れてまうわ～👍️,"おはようございます😃
風防もカッコいいね、惚れてまうわ～👍️",林宏勲,0,2022-10-25T23:08:52Z,2022-10-25T23:08:52Z
総長待ってました😊マッハ、カッコ良すぎます☺️,"総長待ってました😊

マッハ、カッコ良すぎます☺️",けん,0,2022-10-25T09:12:56Z,2022-10-25T09:12:56Z
マッハ激渋になりましたね🎉総長最高にカッコいいっす😊『神奈川〜』の言い方めちゃくちゃ好きっす😂,"マッハ激渋になりましたね🎉
総長最高にカッコいいっす😊

『神奈川〜』の言い方めちゃくちゃ好きっす😂",ともちゃん,0,2022-10-25T09:32:38Z,2022-10-25T09:32:38Z
総長バリシブです！！押忍！！,総長バリシブです！！押忍！！,恥娘☆恥男,0,2022-10-25T10:15:36Z,2022-10-25T10:15:36Z
風防で風貌カッコイイ✨✨✨✨,風防で風貌カッコイイ✨✨✨✨,D-suke,1,2022-10-25T09:49:05Z,2022-10-25T09:49:05Z
「奏でた事無い人、見ないでください!!」　そんなこと言わないでくださいよぉ〜(^o^;)　見させてくださいよぉ〜！聴かせてくださいよぉ〜！！聴きたいんですよぉー！！！w,「奏でた事無い人、見ないでください!!」　そんなこと言わないでくださいよぉ〜(^o^;)　見させてくださいよぉ〜！聴かせてくださいよぉ〜！！聴きたいんですよぉー！！！w,いっちぃーnumber52,0,2022-10-26T00:06:30Z,2022-10-26T00:06:30Z
芸人としても唯一無二ですよ,芸人としても唯一無二ですよ,AZS,0,2022-10-25T12:54:43Z,2022-10-25T12:54:43Z
サムネもバリ渋っ！,サムネもバリ渋っ！,H I,0,2022-10-25T12:51:34Z,2022-10-25T12:51:34Z
あー素晴らしい風呂と風防一緒に入ってユックリまったり🤩あー走りに行きたいですね➰,"あー素晴らしい
風呂と風防一緒に入ってユックリ
まったり🤩
あー走りに行きたいですね➰",おいちゃん,0,2022-10-25T10:52:08Z,2022-10-25T10:52:08Z
乗りやすそー。,乗りやすそー。,kazuhiko 木,0,2022-10-25T09:37:46Z,2022-10-25T09:37:46Z
カラーリング効果なのかレーレプよりもスポーティーに見えてるの自分だけでしょうか(笑),カラーリング効果なのかレーレプよりもスポーティーに見えてるの自分だけでしょうか(笑),jacpotmachine1127,0,2022-10-25T13:54:50Z,2022-10-25T13:54:50Z
禁煙、大型二輪免許取得、年内にザッパー納車予定✨これからゆっくり時間をかけて自分なりのカスタム計画中です！佐田さん、アンチとかマジで気にぜずに突き進んで下さい！良い影響しか受けてません！！！,"禁煙、大型二輪免許取得、年内にザッパー納車予定✨
これからゆっくり時間をかけて自分なりのカスタム計画中です！佐田さん、アンチとかマジで気にぜずに突き進んで下さい！
良い影響しか受けてません！！！",柳田康太郎,1,2022-10-25T09:57:42Z,2022-10-25T09:57:42Z
短風方バリ渋い。　全体的にめっちゃ格好良くなりましたね。,短風方バリ渋い。　全体的にめっちゃ格好良くなりましたね。,T健太,1,2022-10-25T16:01:16Z,2022-10-25T16:01:16Z
やりたいことやってるからアンチがいるんですよー！もっとカッコよくして下さい！いつも楽しみにしてます！,"やりたいことやってるからアンチがいるんですよー！
もっとカッコよくして下さい！
いつも楽しみにしてます！",Tamura Syotaro,0,2022-10-25T11:45:39Z,2022-10-25T11:45:39Z
「お母さ～ん」っていうと、篠栗のお母さんを思い出しちゃう。,「お母さ～ん」っていうと、篠栗のお母さんを思い出しちゃう。,withcarman,0,2022-10-26T10:11:53Z,2022-10-26T10:11:53Z
初めてコメントします短風防メチャクチャシブいっす！👍,"初めてコメントします
短風防メチャクチャシブいっす！👍",石川哲也,0,2022-10-25T10:58:58Z,2022-10-25T10:58:58Z
かっこええわ～マジで。今二回目の視聴。サムネなんか６回はヌける走りの動画が楽しみ,"かっこええわ～マジで。今二回目の視聴。
サムネなんか６回はヌける
走りの動画が楽しみ",rm h,0,2022-10-26T03:26:58Z,2022-10-26T03:26:58Z
夜勤明けで14時間ほど寝てました(笑)今から見ます❗,"夜勤明けで14時間ほど寝てました(笑)
今から見ます❗",くりすけ,0,2022-10-25T22:19:47Z,2022-10-25T22:19:47Z
激渋や！！！,激渋や！！！,孝昌 荒木,0,2022-10-25T12:09:27Z,2022-10-25T12:09:27Z
短風防キター！あっしも短風防リーゼントです！,"短風防キター！
あっしも短風防リーゼントです！",masalaboちゃんねる,0,2022-10-26T12:32:28Z,2022-10-26T12:32:28Z
