textDisplay,textOriginal,authorDisplayName,likeCount,publishedAt,updatedAt
一人一人動きが観れるのは嬉しい😆21人の揃い方が美しい！,"一人一人動きが観れるのは嬉しい😆
21人の揃い方が美しい！",Yユーヤ,0,2022-10-26T11:52:56Z,2022-10-26T11:52:56Z
前から上手だったけど、ひなのちゃん更にダンス成長してる✨✨,前から上手だったけど、ひなのちゃん更にダンス成長してる✨✨,レモネードちゃん,2,2022-10-26T11:11:08Z,2022-10-26T11:11:08Z
定点だから推しを追えて最高,定点だから推しを追えて最高,744KAKA,3,2022-10-26T11:03:55Z,2022-10-26T11:03:55Z
めっちゃ綺麗に揃っててすげーなと改めて思った,めっちゃ綺麗に揃っててすげーなと改めて思った,イピス。,2,2022-10-26T09:18:12Z,2022-10-26T09:18:12Z
みくにちゃん全部全力でめちゃめちゃかっこよかったです😭🤍🤍かっこいいよ…本当に……！！,みくにちゃん全部全力でめちゃめちゃかっこよかったです😭🤍🤍かっこいいよ…本当に……！！,ぉ,12,2022-10-26T09:30:01Z,2022-10-26T09:30:01Z
もはや舞台芸術の域に達している全員すごいけど、やっぱり小坂さんを目で追ってしまう何をやっても美しく完璧,"もはや舞台芸術の域に達している
全員すごいけど、やっぱり小坂さんを目で追ってしまう
何をやっても美しく完璧",ハムハム,1,2022-10-27T06:18:03Z,2022-10-27T06:18:03Z
統率のとれた動き、決めるところはきちんと決め、笑うときは笑う。俯瞰で観ることもできるし、特定のメンバーに注目して観ることもできる。「月と星が踊るMidnight」最高だし、「ひなリハ」普通に最高！！,"統率のとれた動き、決めるところはきちんと決め、笑うときは笑う。俯瞰で観ることもできるし、特定のメンバーに注目して観ることもできる。
「月と星が踊るMidnight」最高だし、「ひなリハ」普通に最高！！",そらいろ,1,2022-10-27T02:36:00Z,2022-10-27T02:36:00Z
一体感すごい。全員に前に出る瞬間がある体系移動もすごくいい。,一体感すごい。全員に前に出る瞬間がある体系移動もすごくいい。,アポロ,0,2022-10-26T14:12:04Z,2022-10-26T14:12:04Z
3:43〜 気持ちいいほど揃ってて何回もみちゃう,3:43〜 気持ちいいほど揃ってて何回もみちゃう,ししくみ,13,2022-10-26T09:22:00Z,2022-10-26T09:27:14Z
なっちょのパワフルなダンスに磨きがかかってる😊,なっちょのパワフルなダンスに磨きがかかってる😊,サマー,7,2022-10-26T12:55:32Z,2022-10-26T12:55:32Z
明里ちゃんが踊ってる🥺💖2サビで真ん中にいる明里ちゃんもそのあと後ろまでダッシュするのもぜんぶぜんぶ大好き〜！！！かわいい！！！,明里ちゃんが踊ってる🥺💖2サビで真ん中にいる明里ちゃんもそのあと後ろまでダッシュするのもぜんぶぜんぶ大好き〜！！！かわいい！！！,lico,15,2022-10-26T09:23:15Z,2022-10-26T09:23:15Z
みんなキレキレで揃っててかっこいい😭影ちゃん笑顔と真顔のギャップにやられる😭,みんなキレキレで揃っててかっこいい😭影ちゃん笑顔と真顔のギャップにやられる😭,どんぐり,0,2022-10-26T13:09:46Z,2022-10-26T13:09:46Z
久しぶりに踊っているのにブランクを感じさせない、さりちゃん凄いよ…,久しぶりに踊っているのにブランクを感じさせない、さりちゃん凄いよ…,ヤス,3,2022-10-26T16:28:44Z,2022-10-26T16:28:44Z
所々綺麗だよね、振り付け。好き。,所々綺麗だよね、振り付け。好き。,リョーマ46おひさま,1,2022-10-26T09:10:13Z,2022-10-26T09:10:13Z
リハでしかわからない、足踏みが心地よく感じる曲,リハでしかわからない、足踏みが心地よく感じる曲,まさし,4,2022-10-26T09:39:20Z,2022-10-26T09:39:20Z
ひなリハ待ってました！👏このダンスかっこよくてすごい好き！！,"ひなリハ待ってました！👏
このダンスかっこよくてすごい好き！！",-10 kg,0,2022-10-26T12:01:58Z,2022-10-26T12:01:58Z
あぁ～…色々、感慨深い(T_T)公式として完全版をアップしてくださるのも有り難いですm(_ _)m,あぁ～…色々、感慨深い(T_T)公式として完全版をアップしてくださるのも有り難いですm(_ _)m,坂道坂 46,7,2022-10-26T09:04:55Z,2022-10-26T09:06:43Z
にぶちゃんの腰を気遣ったフォーメーションと踊りになってて素晴らしい。,にぶちゃんの腰を気遣ったフォーメーションと踊りになってて素晴らしい。,こだっく,8,2022-10-26T11:27:41Z,2022-10-26T11:27:41Z
ひなリハの、足音や靴が擦れる音がとても好き。ライブでは聞こえないから、また違った臨場感がある。,ひなリハの、足音や靴が擦れる音がとても好き。ライブでは聞こえないから、また違った臨場感がある。,隅田川ドコナン,2,2022-10-26T13:50:56Z,2022-10-26T13:50:56Z
やっぱひなリハ最高！！みんな揃っててかっこいい！,"やっぱひなリハ最高！！
みんな揃っててかっこいい！",skYo 🌸,1,2022-10-26T11:59:55Z,2022-10-26T11:59:55Z
普段のライブや音楽番組では聴くことのできない足音が聞こえるのも、ひなリハの良いところ😊,普段のライブや音楽番組では聴くことのできない足音が聞こえるのも、ひなリハの良いところ😊,ユウユウ,9,2022-10-26T09:23:02Z,2022-10-26T09:23:02Z
ひなリハを観てると全体がキチンと揃っている姿がとても綺麗なので、音楽番組やライブではなかなか見ることの出来ない衣装を着た状態での鳥瞰動画も観てみたいと思いました！,ひなリハを観てると全体がキチンと揃っている姿がとても綺麗なので、音楽番組やライブではなかなか見ることの出来ない衣装を着た状態での鳥瞰動画も観てみたいと思いました！,ジュンジュン,2,2022-10-26T09:21:36Z,2022-10-26T09:21:36Z
從一專的ひなリハ徹底入坑，到現在8單舞步還是這麼整齊，藍藍的盛世一定還可以維持下去!!,從一專的ひなリハ徹底入坑，到現在8單舞步還是這麼整齊，藍藍的盛世一定還可以維持下去!!,阿官官,4,2022-10-26T17:48:15Z,2022-10-26T17:48:15Z
未来虹ちゃんのダンスが滅茶苦茶評価されてて自分の事の様に嬉しい確かにポジションは後列端だけど、日向でもトップクラスに美しいダンスするんだよ,"未来虹ちゃんのダンスが滅茶苦茶評価されてて自分の事の様に嬉しい
確かにポジションは後列端だけど、日向でもトップクラスに美しいダンスするんだよ",ちくわぶ春巻き,7,2022-10-26T16:46:34Z,2022-10-26T16:46:34Z
キレキレのダンスでしっかり揃っててカッコいいです,キレキレのダンスでしっかり揃っててカッコいいです,坂道大好き,6,2022-10-26T09:23:51Z,2022-10-26T09:23:51Z
丹生ちゃんのダンスがダイナミックでキレッキレすぎて逆に腰心配なっちゃう。😂横一列は誰よりもノリノリで好き〜🥰2:16 からのソロ振り付けが特にカッコ良すぎた。😌,"丹生ちゃんのダンスがダイナミックでキレッキレすぎて逆に腰心配なっちゃう。😂
横一列は誰よりもノリノリで好き〜🥰
2:16 からのソロ振り付けが特にカッコ良すぎた。😌",panickansntsu_1300,2,2022-10-27T06:33:12Z,2022-10-27T06:33:12Z
久々にひなリハ見たやっぱ楽しそう好き,久々にひなリハ見たやっぱ楽しそう好き,やーまんえっくす,1,2022-10-26T15:17:07Z,2022-10-26T15:17:07Z
ひなリハ待ってました！これから全部やって欲しい！！,ひなリハ待ってました！これから全部やって欲しい！！,にいまる,7,2022-10-26T09:07:07Z,2022-10-26T09:07:07Z
キレッキレでクールなところと日向坂らしい笑顔で砕けてるところがパフォーマンスに出てて唯一無二のアイドルだと思いました！！！！！,キレッキレでクールなところと日向坂らしい笑顔で砕けてるところがパフォーマンスに出てて唯一無二のアイドルだと思いました！！！！！,NYU RU,0,2022-10-27T06:39:40Z,2022-10-27T06:39:40Z
リアタイ出来なかったのでアーカイブありがとうございます！噛み締めれば噛み締めるほどに味が出てくる良い曲ですね。全体にそろってるところが練習の成果出ていてすごいです。個人的にはどんなに隅っこにいてもめっちゃ気合入った表情と動きを見せる影ちゃんがめっちゃ好きです。,リアタイ出来なかったのでアーカイブありがとうございます！噛み締めれば噛み締めるほどに味が出てくる良い曲ですね。全体にそろってるところが練習の成果出ていてすごいです。個人的にはどんなに隅っこにいてもめっちゃ気合入った表情と動きを見せる影ちゃんがめっちゃ好きです。,MARINE,0,2022-10-26T12:33:38Z,2022-10-26T12:33:38Z
足音がバラバラじゃなく揃っているのが凄いクオリティを細部まで求めているんだと実感,"足音がバラバラじゃなく揃っているのが凄い
クオリティを細部まで求めているんだと実感",U-saku,0,2022-10-26T10:26:01Z,2022-10-26T10:26:01Z
みくにん手足すらっとしてて、ダンスかっこいい、、！！,みくにん手足すらっとしてて、ダンスかっこいい、、！！,ブルー,18,2022-10-26T12:01:58Z,2022-10-26T12:01:58Z
シューズの音が揃っててみんなが、楽しんでしてるのが見れて嬉しい😆,シューズの音が揃っててみんなが、楽しんでしてるのが見れて嬉しい😆,HONDAほんだ,4,2022-10-26T09:19:57Z,2022-10-26T09:19:57Z
1:43〜のきくとしが背中を合わせて踊ってるのが好きすぎる！！,1:43〜のきくとしが背中を合わせて踊ってるのが好きすぎる！！,ゆきまる,14,2022-10-26T09:07:16Z,2022-10-26T09:07:16Z
転調ラスサビのぐるぐる回るとこ凄い綺麗で鳥肌立つ,転調ラスサビのぐるぐる回るとこ凄い綺麗で鳥肌立つ,ギネスビール,4,2022-10-26T09:51:58Z,2022-10-26T09:51:58Z
こうやって上げてくれるのは嬉しい運営分かってますなぁ,"こうやって上げてくれるのは嬉しい
運営分かってますなぁ",しょうたofficial YouTube channel,4,2022-10-26T09:01:30Z,2022-10-26T09:01:30Z
足音が聞いてて気持ちいいな,足音が聞いてて気持ちいいな,ふぁまに,7,2022-10-26T09:01:57Z,2022-10-26T09:01:57Z
4期加入をきっかけに日向坂を知りました。可愛いイメージでしたがこんなに迫力があるダンスもできるとは…！,4期加入をきっかけに日向坂を知りました。可愛いイメージでしたがこんなに迫力があるダンスもできるとは…！,アイ,7,2022-10-26T10:03:58Z,2022-10-26T10:03:58Z
未来虹ちゃんの長い手足を活かしたキレのあるダンスが大好きなんだ、、、,未来虹ちゃんの長い手足を活かしたキレのあるダンスが大好きなんだ、、、,ジーン,11,2022-10-27T04:07:40Z,2022-10-27T04:07:40Z
大所帯グループでしか実現できない複雑なフォーメーションがすごく綺麗！そしてそれがなくなって一列になった時だけのわちゃわちゃがまたカワイイ！！,"大所帯グループでしか実現できない複雑なフォーメーションがすごく綺麗！
そしてそれがなくなって一列になった時だけのわちゃわちゃがまたカワイイ！！",hiro31,6,2022-10-26T10:01:50Z,2022-10-26T10:01:50Z
ひなリハは1回目全体見てから、ひとりずつフォーカスして見るのがすき😌,ひなリハは1回目全体見てから、ひとりずつフォーカスして見るのがすき😌,ここ,1,2022-10-26T12:24:15Z,2022-10-26T12:24:15Z
影の躍動感凄い👏,影の躍動感凄い👏,あやか,5,2022-10-26T09:17:38Z,2022-10-26T09:17:38Z
定点だからみんなの動きとかフォーメーションとか見れるのいいよね歌番組は寄りとかあるのも嬉しいけどこういう引きで全体見れるのいいね,"定点だからみんなの動きとかフォーメーションとか見れるのいいよね
歌番組は寄りとかあるのも嬉しいけどこういう引きで全体見れるのいいね",ぼく野球ボールマン,5,2022-10-26T09:37:12Z,2022-10-26T09:37:12Z
丹生ちゃんの動きおっきいって言うかなんて言うか分かんないけどほんとに大好き🥲いつもにこにこで大好き（ ;  ; ）,"丹生ちゃんの動きおっきいって言うかなんて言うか分かんないけどほんとに大好き🥲
いつもにこにこで大好き（ ;  ; ）",あ.,20,2022-10-26T09:01:15Z,2022-10-26T09:01:15Z
今回のダンスもめちゃくちゃかっこいい,今回のダンスもめちゃくちゃかっこいい,キリマンジャロ,1,2022-10-26T10:36:46Z,2022-10-26T10:36:46Z
久々に見られて本当に嬉しい未来虹が自分の身長使って大きく動いていてすごく目立ってて嬉しい,"久々に見られて本当に嬉しい

未来虹が自分の身長使って大きく動いていてすごく目立ってて嬉しい",7maru,3,2022-10-27T05:29:46Z,2022-10-27T05:29:46Z
ダンスの精度がすごい！！みんな揃ってる！ツアー千秋楽が楽しみ😊,"ダンスの精度がすごい！！
みんな揃ってる！ツアー千秋楽が楽しみ😊",おーたか◢͟￨⁴⁶,0,2022-10-26T11:20:04Z,2022-10-26T11:20:04Z
ダンスすげぇーな！！！めいちゃんの余裕のパーカーが素敵♪,"ダンスすげぇーな！！！
めいちゃんの余裕のパーカーが素敵♪",いなばいおり,4,2022-10-26T14:55:42Z,2022-10-26T14:55:42Z
世界で1番かわいい！！みんな上品！！そしてひなのちゃんが見える幸せ。本当この世界に生まれてよかった！！,"世界で1番かわいい！！みんな上品！！
そしてひなのちゃんが見える幸せ。本当この世界に生まれてよかった！！",乙女から心を込めて,3,2022-10-26T12:15:26Z,2022-10-26T12:15:26Z
ひなリハ大好き〜！1人ずつ見るのがたまらないね〜,"ひなリハ大好き〜！
1人ずつ見るのがたまらないね〜",4 4,0,2022-10-26T12:02:15Z,2022-10-26T12:02:15Z
丹生ちゃんのダンスめっちゃ好き,丹生ちゃんのダンスめっちゃ好き,ゆーちん,23,2022-10-26T09:07:17Z,2022-10-26T09:07:17Z
ただただ一言→このグループはずば抜けて凄い,ただただ一言→このグループはずば抜けて凄い,S T,0,2022-10-26T12:08:00Z,2022-10-26T12:08:00Z
まなもと美穂がいないけど、３期生がすっかり逞しく成長していて、安心してパフォーマンスを見られるようになった！これで4期生が加わって、また変化が生まれるのがほんとに楽しみ！,"まなもと美穂がいないけど、３期生がすっかり逞しく成長していて、安心してパフォーマンスを見られるようになった！
これで4期生が加わって、また変化が生まれるのがほんとに楽しみ！",ゴンされす,4,2022-10-26T09:50:07Z,2022-10-26T09:50:07Z
2:31足音が揃ってるところ好き！,"2:31
足音が揃ってるところ好き！",わたゆー,7,2022-10-26T09:29:22Z,2022-10-26T09:29:22Z
みくにん🌈のダンス、ダイナミックでカッコいい!!✨,みくにん🌈のダンス、ダイナミックでカッコいい!!✨,ぐるぐるしゃんぷー,14,2022-10-26T09:15:49Z,2022-10-26T09:15:49Z
やっぱ ひなリハは素晴らしいです 足音のリズムも大好き( ´_ゝ`)かっこいい,やっぱ ひなリハは素晴らしいです 足音のリズムも大好き( ´_ゝ`)かっこいい,猫憑き,0,2022-10-26T18:56:33Z,2022-10-26T18:56:33Z
茉莉ちゃんの丁寧に踊ってるダンスすき,茉莉ちゃんの丁寧に踊ってるダンスすき,りりか,4,2022-10-26T14:25:45Z,2022-10-26T14:25:45Z
3:30辺りの円になって走るところが美しくて、良きです。MVでは味わえない醍醐味ですね。そして、なっちよが元気そうでなにより。,"3:30辺りの円になって走るところが美しくて、良きです。MVでは味わえない醍醐味ですね。
そして、なっちよが元気そうでなにより。",インディ5005,14,2022-10-26T09:17:47Z,2022-10-26T09:17:47Z
昨日のひなリハまで表題曲を敢えて聴いてなかったのですが、曲の壮大さとメンバーの皆さんのダンスに圧倒された約5分間だった！,昨日のひなリハまで表題曲を敢えて聴いてなかったのですが、曲の壮大さとメンバーの皆さんのダンスに圧倒された約5分間だった！,えふびー,5,2022-10-26T09:11:40Z,2022-10-27T07:45:49Z
相変わらず素晴らしい。ほかの曲もひなリハ出してほしい,相変わらず素晴らしい。ほかの曲もひなリハ出してほしい,山田,1,2022-10-26T09:22:00Z,2022-10-26T09:22:00Z
音楽系番組では中々フルでのダンスシーンを観られないので、こういう配信には本当に感謝します🈺🙇🏻‍♂️,音楽系番組では中々フルでのダンスシーンを観られないので、こういう配信には本当に感謝します🈺🙇🏻‍♂️,日乃櫻47,6,2022-10-26T09:26:08Z,2022-10-26T09:26:08Z
ひなリハのカメラ位置が1番フォーメーション見やすいよな。こんなフォーメーションしてたんだって新しい発見もあるくらい。「ひなリハ」はこれからも続けてほしい,"ひなリハのカメラ位置が1番フォーメーション見やすいよな。
こんなフォーメーションしてたんだって新しい発見もあるくらい。
「ひなリハ」はこれからも続けてほしい",ボンボン,2,2022-10-26T09:15:18Z,2022-10-26T09:15:18Z
ひなリハで足音が聞こえるのが好きなんだよなぁ,ひなリハで足音が聞こえるのが好きなんだよなぁ,オリゴ糖,8,2022-10-26T09:25:32Z,2022-10-26T09:25:32Z
『ひなリハは日向坂が産んだ最強の発明である』これからも、これまでのもよろしくお願いします！,"『ひなリハは日向坂が産んだ最強の発明である』
これからも、これまでのもよろしくお願いします！",まなふぃーばー,5,2022-10-26T09:23:48Z,2022-10-26T09:23:48Z
"きたー！最低２０回は観るやつだ。日向の曲は、青春の馬やこの曲など、ターニングポイントで必ずすごく背中を押す曲が来るなって思う。みんな、お疲れ様。残り公演も頑張って！！","きたー！
最低２０回は観るやつだ。
日向の曲は、青春の馬やこの曲など、ターニングポイントで必ずすごく背中を押す曲が来るなって思う。
みんな、お疲れ様。
残り公演も頑張って！！",よーいち,13,2022-10-26T09:02:12Z,2022-10-26T09:07:11Z
やっぱ全員揃ってる日向坂が大好き‼︎☺︎,やっぱ全員揃ってる日向坂が大好き‼︎☺︎,ぴっつぴっつ,6,2022-10-26T09:32:24Z,2022-10-26T09:32:24Z
月星発売おめでとう〜👏横並びで わちゃわちゃするとこ好きや☺️,月星発売おめでとう〜👏横並びで わちゃわちゃするとこ好きや☺️,カズキ 兵庫のふじさん,2,2022-10-26T10:02:14Z,2022-10-26T10:02:14Z
シングル出す事にひなリハしてほしい😭💖としぱんの目合わせるとこ何回みてもすきーーーーってなる！！！,"シングル出す事にひなリハしてほしい😭💖
としぱんの目合わせるとこ何回みてもすきーーーーってなる！！！",sayaka,10,2022-10-26T09:06:42Z,2022-10-26T09:06:42Z
推しが派手で分かりやすくて助かる,推しが派手で分かりやすくて助かる,まつしか,1,2022-10-26T17:19:33Z,2022-10-26T17:19:33Z
日向坂ならではの大人数でも乱れない完璧なフォーメーションダンスに加えて推しをずっと見て追えるまさに神コンテンツです！運営さんありがとうございます😭,"日向坂ならではの大人数でも乱れない完璧なフォーメーションダンスに加えて
推しをずっと見て追える
まさに神コンテンツです！
運営さんありがとうございます😭",クロムギ,10,2022-10-26T09:43:20Z,2022-10-26T09:43:20Z
みーぱん、手足長いからダンスが映えるし無駄な動きないよね本当、好き,"みーぱん、手足長いからダンスが映えるし
無駄な動きないよね本当、好き",IDOL,1,2022-10-27T07:52:08Z,2022-10-27T07:52:08Z
いつの間にこのフォーメーションになったんだ!?って思うくらい移動が素早くて凄い！生配信見れなかったので有難いです！,"いつの間にこのフォーメーションになったんだ!?って思うくらい移動が素早くて凄い！
生配信見れなかったので有難いです！",キティハロー,5,2022-10-26T09:39:46Z,2022-10-26T09:39:46Z
新曲月星のひなリハを発売日に見れるの嬉しいです！踊りかっちょええです！！,新曲月星のひなリハを発売日に見れるの嬉しいです！踊りかっちょええです！！,どっぐわんだふる,1,2022-10-27T04:47:15Z,2022-10-27T04:47:15Z
このちゃんのダンスが大好きです！ほかのメンバーのダンスも観たいけどこのちゃんから目が離せません！美しいぃぃぃぃ！,"このちゃんのダンスが大好きです！
ほかのメンバーのダンスも観たいけど
このちゃんから目が離せません！美しいぃぃぃぃ！",花好き,1,2022-10-27T10:03:29Z,2022-10-27T10:03:29Z
本当に大好きです🥺何回も聴いてたい、、、(何回も聴くよ)きょんにぶやばいわ、、、♡最高日向坂しか勝たん,"本当に大好きです🥺
何回も聴いてたい、、、(何回も聴くよ)きょんにぶやばいわ、、、♡
最高日向坂しか勝たん",るんるん🌈,8,2022-10-26T09:07:28Z,2022-10-26T09:07:28Z
全員可愛いすぎる,全員可愛いすぎる,花社长的狮身人面像,2,2022-10-26T09:51:46Z,2022-10-26T09:51:46Z
この動画で日向坂の良さ伝わります,この動画で日向坂の良さ伝わります,黒ひげ🃏  1世,4,2022-10-26T09:02:48Z,2022-10-26T09:02:48Z
日向坂のフォーメーション芸大好き、ひなリハはそれをめいっぱい生かせる神企画だね。,日向坂のフォーメーション芸大好き、ひなリハはそれをめいっぱい生かせる神企画だね。,๑ᵒᯅᵒ๑,2,2022-10-26T16:42:43Z,2022-10-26T16:42:43Z
「誰に何言われても」で前に出てくるなっちょとキャプテンの力強さカッコよすぎんか,「誰に何言われても」で前に出てくるなっちょとキャプテンの力強さカッコよすぎんか,たまつ,2,2022-10-26T12:51:31Z,2022-10-26T12:51:31Z
きずなーずの3人が1列目になって踊る所みてやっぱ最強だなって思いました。なんか目頭熱くなった。,きずなーずの3人が1列目になって踊る所みてやっぱ最強だなって思いました。なんか目頭熱くなった。,!フェルミエ,4,2022-10-26T12:20:05Z,2022-10-26T12:20:05Z
丹生ちゃんの裏センターの存在感が凄いねやっぱり、ひなリハはいいね全部の表題曲のひなリハをして欲しいですね,"丹生ちゃんの裏センターの存在感が凄いね

やっぱり、ひなリハはいいね
全部の表題曲のひなリハをして欲しいですね",Pattayaマン,9,2022-10-26T12:06:41Z,2022-10-26T12:06:41Z
結構身長差あるの横一列になるとよくわかるのに、ダンス中はみんなダイナミックに踊ってて全くそれを感じさせないのすごくて好き,結構身長差あるの横一列になるとよくわかるのに、ダンス中はみんなダイナミックに踊ってて全くそれを感じさせないのすごくて好き,8,2,2022-10-26T20:55:18Z,2022-10-26T20:55:18Z
3:32 ここのキャプテンの跳躍、バレエ経験者ということもあってすごく綺麗,3:32 ここのキャプテンの跳躍、バレエ経験者ということもあってすごく綺麗,Sei,3,2022-10-27T02:23:54Z,2022-10-27T02:23:54Z
美しい…♪どのグループもそうだけど、ライブ円盤にはこうした定点カメラ映像をマルチアングルに入れて欲しいと思っている。,"美しい…♪
どのグループもそうだけど、ライブ円盤にはこうした定点カメラ映像をマルチアングルに入れて欲しいと思っている。",LeoMidori,2,2022-10-26T10:39:05Z,2022-10-26T10:39:05Z
何度でも日向坂を好きになってよかったと思わせてくれてありがとうございます,何度でも日向坂を好きになってよかったと思わせてくれてありがとうございます,ピカピカちゃん,1,2022-10-26T14:28:33Z,2022-10-26T14:28:33Z
