textDisplay,textOriginal,authorDisplayName,likeCount,publishedAt,updatedAt
たくさんドッキリの楽しみポイントあって面白かった！！笑笑 闇カンタ好き,たくさんドッキリの楽しみポイントあって面白かった！！笑笑 闇カンタ好き,魔法少女めたもル,1,2022-10-27T08:45:10Z,2022-10-27T08:45:10Z
カンタ、自分だけリアルYouTubeドリーム掴んどいて高みの見物,カンタ、自分だけリアルYouTubeドリーム掴んどいて高みの見物,McPots,14,2022-10-26T11:16:53Z,2022-10-26T11:16:53Z
おもしろかったけど可哀想すぎるので、次は会わせるドッキリが見たいな…！,おもしろかったけど可哀想すぎるので、次は会わせるドッキリが見たいな…！,うめうめ,2,2022-10-26T15:06:44Z,2022-10-26T15:06:44Z
カンタさんとトミーさんの共同ドッキリは珍しいけどすごい楽しかったです。,カンタさんとトミーさんの共同ドッキリは珍しいけどすごい楽しかったです。,ヨッチ よしあき,1,2022-10-26T14:57:42Z,2022-10-26T14:57:42Z
このドッキリ伊吹くん1番楽しそう😂w,このドッキリ伊吹くん1番楽しそう😂w,413さゆさゆ,4,2022-10-26T11:46:34Z,2022-10-26T11:46:34Z
25:37 カンタくん「お疲れぃ！飯食おうぜぇーい！みんなで」可愛いし、面白い笑笑,25:37 カンタくん「お疲れぃ！飯食おうぜぇーい！みんなで」可愛いし、面白い笑笑,ほろほろ,2,2022-10-27T05:43:43Z,2022-10-27T05:44:11Z
カンタくんの告知から楽しみに待ってました！！！！ドッキリ嬉しい！,カンタくんの告知から楽しみに待ってました！！！！ドッキリ嬉しい！,はろるど,7,2022-10-26T11:12:34Z,2022-10-26T11:12:34Z
17:50 ここのトミーさんの｢間｣すご……ほんとに焦った人の｢間｣だよプロだろ………,17:50 ここのトミーさんの｢間｣すご……ほんとに焦った人の｢間｣だよプロだろ………,さやか,9,2022-10-26T16:06:33Z,2022-10-26T16:06:33Z
ほんとにまた違う企画で合わせてあげてほしい😂😂😂,ほんとにまた違う企画で合わせてあげてほしい😂😂😂,m i,0,2022-10-27T09:30:53Z,2022-10-27T09:30:53Z
にこちゃんになりきってLINE出来るのかな？大丈夫か？って思ったけど、本人全面協力の上のDMからの流れでLINE繋がれたってなったら嬉しすぎて気付かないか😆,にこちゃんになりきってLINE出来るのかな？大丈夫か？って思ったけど、本人全面協力の上のDMからの流れでLINE繋がれたってなったら嬉しすぎて気付かないか😆,ちぱ。,10,2022-10-26T11:14:53Z,2022-10-26T11:14:53Z
最高に楽しかったです！終始ニヤニヤしながら見ちゃいました笑笑,最高に楽しかったです！終始ニヤニヤしながら見ちゃいました笑笑,Yoga Namaste,0,2022-10-26T13:43:25Z,2022-10-26T13:43:25Z
やばいめっちゃ面白い,やばいめっちゃ面白い,きりとりせん,4,2022-10-27T00:11:48Z,2022-10-27T00:11:48Z
にこちゃん❤絶対会ってあげて欲しい🙏🏻🙏🏻🙏🏻最高だった😂😂😂,"にこちゃん❤絶対会ってあげて欲しい🙏🏻🙏🏻🙏🏻

最高だった😂😂😂",みわっち0508,12,2022-10-26T12:21:46Z,2022-10-26T12:21:46Z
次は本当にNICOちゃんに会えるドッキリをやって欲しいな！,次は本当にNICOちゃんに会えるドッキリをやって欲しいな！,ke,17,2022-10-26T11:46:50Z,2022-10-26T11:46:50Z
めちゃくちゃ笑った😂😂けど、にこちゃんと会わしてあげて〜😂😂,"めちゃくちゃ笑った😂😂
けど、にこちゃんと会わしてあげて〜😂😂",yu u,5,2022-10-27T03:07:36Z,2022-10-27T03:07:36Z
カンタはこれをリアルにしてたって羨ましすぎるなー。,カンタはこれをリアルにしてたって羨ましすぎるなー。,Shoumiy,2,2022-10-26T13:00:31Z,2022-10-26T13:00:31Z
やってることえぐいけど面白すぎる特に闇カンタ,やってることえぐいけど面白すぎる特に闇カンタ,あの子,5,2022-10-26T11:56:02Z,2022-10-26T11:56:02Z
水溜りボンドが待ってると思ったらNICOちゃん待ってるドッキリしてほしい🥺💕,水溜りボンドが待ってると思ったらNICOちゃん待ってるドッキリしてほしい🥺💕,華子 井出,8,2022-10-26T16:53:01Z,2022-10-26T16:53:01Z
25:17 とみーと伊吹に挟まれて笑ってるカンタくん可愛すぎる,25:17 とみーと伊吹に挟まれて笑ってるカンタくん可愛すぎる,ほろほろ,3,2022-10-27T05:44:47Z,2022-10-27T05:44:47Z
ロンハーのあの感じがまさか水溜りボンドの動画で観られるとは思わなかった🤣💕久しぶりのこのハラハラ感が楽し過ぎた🤣✨,ロンハーのあの感じがまさか水溜りボンドの動画で観られるとは思わなかった🤣💕久しぶりのこのハラハラ感が楽し過ぎた🤣✨,れな,4,2022-10-26T12:11:26Z,2022-10-26T12:11:26Z
最近の動画で1番笑ったよ😆カンタくんのマジックメール😈それっぽい👍そして謎のカエルの絵文字～😂,"最近の動画で1番笑ったよ😆カンタくんのマジックメール😈それっぽい👍
そして謎のカエルの絵文字～😂",pochama1103,8,2022-10-26T15:11:25Z,2022-10-26T15:11:25Z
最高におもしろかったよー！！🤣,最高におもしろかったよー！！🤣,mofu mina,3,2022-10-26T12:06:10Z,2022-10-26T12:06:10Z
ニコちゃんほんとにデートしてあげてほしい😂,ニコちゃんほんとにデートしてあげてほしい😂,R,12,2022-10-26T12:19:46Z,2022-10-26T12:19:46Z
久々にYouTubeで声出して笑った😹😹,久々にYouTubeで声出して笑った😹😹,るあん,4,2022-10-26T14:19:57Z,2022-10-26T14:19:57Z
ニコちゃんはケロケロだし🐸ドッキリってわかった瞬間叫ぶのグッと堪えてえらい🤣🤣🤣,"ニコちゃんはケロケロだし🐸
ドッキリってわかった瞬間叫ぶのグッと堪えてえらい🤣🤣🤣",M,4,2022-10-26T17:15:57Z,2022-10-26T17:15:57Z
カンタさんとトミーさんがタッグ組んでドッキリされたらみんな気付かないと思うし信じちゃいます…!!凄過ぎました…!!✨😂✨💕,"カンタさんとトミーさんがタッグ組んでドッキリされたらみんな気付かないと思うし信じちゃいます…!!
凄過ぎました…!!
✨😂✨💕",satellite blue,3,2022-10-26T17:33:31Z,2022-10-26T17:33:31Z
細かい流れまで完璧でした✨これは騙されますって(笑),細かい流れまで完璧でした✨これは騙されますって(笑),もんもん,3,2022-10-26T16:14:42Z,2022-10-26T16:14:42Z
無人島の告白から日が経ってるからリアリティあるよねwこの手のドッキリ新鮮でめっちゃ面白かった😂,"無人島の告白から日が経ってるからリアリティあるよねw
この手のドッキリ新鮮でめっちゃ面白かった😂",ーその土地のスター,1,2022-10-26T13:24:22Z,2022-10-26T13:24:22Z
NICO氏なんか沼要素あるよね,NICO氏なんか沼要素あるよね,ちゃんちゃん,8,2022-10-26T17:08:52Z,2022-10-26T17:08:52Z
やってること美人局でワロタ,やってること美人局でワロタ,ニコニコ動画,172,2022-10-26T11:14:35Z,2022-10-26T11:14:35Z
今日も素晴らしい動画ありがとう！なんか謎に感動しました笑,"今日も素晴らしい動画ありがとう！
なんか謎に感動しました笑",森のくまさん,2,2022-10-27T00:30:04Z,2022-10-27T00:30:04Z
オープニングトミー「いいね！」ってめちゃくちゃ言ってて本気で楽しそう！,オープニングトミー「いいね！」ってめちゃくちゃ言ってて本気で楽しそう！,純平,1,2022-10-26T13:59:59Z,2022-10-26T13:59:59Z
久しぶりに動画で爆笑した,久しぶりに動画で爆笑した,nano,4,2022-10-27T00:47:05Z,2022-10-27T00:47:05Z
めっちゃおもしろかった笑,めっちゃおもしろかった笑,カフェオレ星,1,2022-10-26T16:51:02Z,2022-10-26T16:51:02Z
🐸も笑ったけど絵文字の後の「、」がおじすぎる😂,🐸も笑ったけど絵文字の後の「、」がおじすぎる😂,ニコちゃん,7,2022-10-26T12:03:59Z,2022-10-26T12:03:59Z
久しぶりに見たらトミー痩せ過ぎ,久しぶりに見たらトミー痩せ過ぎ,めんとす,6,2022-10-26T11:15:08Z,2022-10-26T11:15:08Z
カンタくんのニコちゃんなりすましLINEの文章が完全におじLINEでわらける(笑)(笑)絵文字のセンスといい数といい、典型的なおじさんのやつなんよ😂,カンタくんのニコちゃんなりすましLINEの文章が完全におじLINEでわらける(笑)(笑)絵文字のセンスといい数といい、典型的なおじさんのやつなんよ😂,とと,20,2022-10-26T11:40:39Z,2022-10-26T11:40:39Z
過去1面白かった😂🔥🔥🔥,過去1面白かった😂🔥🔥🔥,Drole S,7,2022-10-26T12:23:00Z,2022-10-26T12:23:00Z
いつかやってくれるんじゃないかって無人島の時のやつからずっと楽しみにしてた！！😂,いつかやってくれるんじゃないかって無人島の時のやつからずっと楽しみにしてた！！😂,ありな,1,2022-10-26T15:58:13Z,2022-10-26T15:58:13Z
しょっぱなからニヤニヤしながら見てた（笑）,しょっぱなからニヤニヤしながら見てた（笑）,きょろ,3,2022-10-26T15:52:56Z,2022-10-26T15:52:56Z
にこちゃん居るドッキリをどうにかしてあげて欲しいw,にこちゃん居るドッキリをどうにかしてあげて欲しいw,m m,8,2022-10-26T13:21:40Z,2022-10-26T13:21:40Z
好きな人と、NICOちゃんとご飯行けるってなったらそりゃあ、必死に阻止するしずっと幸せそうな顔しちゃうよね😂,"好きな人と、NICOちゃんと
ご飯行けるってなったら
そりゃあ、必死に阻止するし
ずっと幸せそうな顔しちゃうよね😂",mo chi,3,2022-10-26T14:25:03Z,2022-10-26T14:25:03Z
本当ににこちゃんとあってほしい〜,本当ににこちゃんとあってほしい〜,あい,6,2022-10-27T01:12:19Z,2022-10-27T01:12:19Z
可哀想だがおもろすぎる😂😂😂,可哀想だがおもろすぎる😂😂😂,せつなぎ,0,2022-10-26T14:02:06Z,2022-10-26T14:02:06Z
まじで今まで見たドッキリの中で1番すごい,まじで今まで見たドッキリの中で1番すごい,マヨラー星人46号機,2,2022-10-26T13:17:55Z,2022-10-26T13:17:55Z
過去一おもろい😂😂😂,過去一おもろい😂😂😂,はなちゃん,3,2022-10-26T13:35:09Z,2022-10-26T13:35:09Z
可哀想すぎるから、にこちゃんご飯行ってあげてほしい😂😂😂,可哀想すぎるから、にこちゃんご飯行ってあげてほしい😂😂😂,ドゥリ,7,2022-10-26T12:14:37Z,2022-10-26T12:14:37Z
このドッキリ最高でした！！そしてニコちゃんとしてLINEしてたカンタくんwこのドッキリの次は会えるサプライズだといいですねw,"このドッキリ最高でした！！
そしてニコちゃんとしてLINEしてた
カンタくんw
このドッキリの次は会える
サプライズだといいですねw",Y-RS A-S,12,2022-10-26T11:54:10Z,2022-10-26T11:54:10Z
むちゃくちゃ面白くて始めてYouTubeでコメントしたくなった,むちゃくちゃ面白くて始めてYouTubeでコメントしたくなった,ぽぽ,9,2022-10-26T13:14:44Z,2022-10-26T13:14:44Z
この動画めっちゃ面白い笑笑,この動画めっちゃ面白い笑笑,ぽんて,6,2022-10-26T11:28:01Z,2022-10-26T11:28:01Z
待ってました！ドッキリ楽しみ！,待ってました！ドッキリ楽しみ！,のは きり,4,2022-10-26T11:14:26Z,2022-10-26T11:14:26Z
今年一笑ったかもしれんww,今年一笑ったかもしれんww,ケツ,4,2022-10-27T06:51:18Z,2022-10-27T06:51:18Z
終始笑えるドッキリ笑笑,終始笑えるドッキリ笑笑,doragon jam,3,2022-10-26T13:28:22Z,2022-10-26T13:28:22Z
伊吹がフォローされてないのはなんでwってなるしカンタの文見られないはほんとそうww,伊吹がフォローされてないのはなんでwってなるしカンタの文見られないはほんとそうww,ことんオハナ,7,2022-10-26T11:30:30Z,2022-10-26T11:30:30Z
にこちゃんになりきれてないカンタくん面白すぎる🤣‪𐤔‪𐤔,にこちゃんになりきれてないカンタくん面白すぎる🤣‪𐤔‪𐤔,∞むい,4,2022-10-26T13:14:58Z,2022-10-26T13:14:58Z
今日おもしろかった,今日おもしろかった,スシ牛タン,4,2022-10-26T23:48:05Z,2022-10-26T23:48:05Z
伊吹くんインスタの写真毎回くらいのレベルでいじられてるの面白い😂😂😂,伊吹くんインスタの写真毎回くらいのレベルでいじられてるの面白い😂😂😂,Momoka,3,2022-10-26T11:16:25Z,2022-10-26T11:16:25Z
迎える時笑いすぎてホエザルみたいな鳴き声聞こえる笑,迎える時笑いすぎてホエザルみたいな鳴き声聞こえる笑,いちなま,3,2022-10-26T17:41:17Z,2022-10-26T17:41:17Z
神動画すぎる🤣🤣,神動画すぎる🤣🤣,mmk *,7,2022-10-26T15:31:42Z,2022-10-26T15:31:42Z
30分があっという間だった。パート2が楽しみ！,30分があっという間だった。パート2が楽しみ！,だパンダ,4,2022-10-26T12:24:10Z,2022-10-26T12:24:10Z
最高すぎるドッキリ動画で面白かったです！！😊,最高すぎるドッキリ動画で面白かったです！！😊,ネギなっとう社長,2,2022-10-26T12:42:51Z,2022-10-26T12:42:51Z
今日のドッキリワクワクドキドキしてめちゃくちゃ面白かった🤣今度はちゃんと会わせてあげてー(笑),"今日のドッキリワクワクドキドキしてめちゃくちゃ面白かった🤣
今度はちゃんと会わせてあげてー(笑)",mayumi,0,2022-10-26T12:19:51Z,2022-10-26T12:19:51Z
最高すぎる無理。最高やけども、ニコちゃんとご飯行かせてあげてくれ後日頼むから,"最高すぎる無理。
最高やけども、ニコちゃんとご飯行かせてあげてくれ後日頼むから",リナ,3,2022-10-26T13:38:45Z,2022-10-26T13:41:54Z
めっちゃ面白かったです😂いつかにこちゃんに会わせてあげてほしい〜笑,"めっちゃ面白かったです😂
いつかにこちゃんに会わせてあげてほしい〜笑",ay m,4,2022-10-26T12:28:53Z,2022-10-26T12:28:53Z
この4人だいすき。,この4人だいすき。,M N,2,2022-10-26T13:06:57Z,2022-10-26T13:06:57Z
3年振りくらいに水溜りボンド見たけど、トミー痩せすぎでは！？！？！？,3年振りくらいに水溜りボンド見たけど、トミー痩せすぎでは！？！？！？,まりも,0,2022-10-27T09:45:10Z,2022-10-27T09:45:10Z
ヒリヒリ面白かった！！ちょっと間を空けて、今度は実際に会わせてあげるのをドッキリにして欲しいなぁ！,"ヒリヒリ面白かった！！
ちょっと間を空けて、今度は実際に会わせてあげるのをドッキリにして欲しいなぁ！",みー,5,2022-10-26T11:46:03Z,2022-10-26T11:46:03Z
これ最後に本当にNICOちゃん来てくれたら見応え凄かった😂,これ最後に本当にNICOちゃん来てくれたら見応え凄かった😂,chiro _,6,2022-10-26T14:54:29Z,2022-10-26T14:54:29Z
いや、いいよー！！こういうドッキリも大好きよ！！淳さんには全然なりきれてない（メール下手すぎて😂）カンティーおもろ！！,"いや、いいよー！！
こういうドッキリも大好きよ！！
淳さんには全然なりきれてない（メール下手すぎて😂）カンティーおもろ！！",ak ao,7,2022-10-26T11:56:16Z,2022-10-26T11:56:16Z
エグすぎて笑った😂でも一番のヤバさはカンタくんのLINE😂😂😂,"エグすぎて笑った😂
でも一番のヤバさはカンタくんのLINE😂😂😂",snow cat,4,2022-10-26T12:02:24Z,2022-10-26T12:02:24Z
めちゃめちゃ面白そう🤣,めちゃめちゃ面白そう🤣,もんもん,3,2022-10-26T11:11:37Z,2022-10-26T11:11:37Z
めちゃくちゃいいドッキリだったー！😂😂,めちゃくちゃいいドッキリだったー！😂😂,みく,0,2022-10-26T15:05:19Z,2022-10-26T15:05:19Z
本当にサイコなんだよなぁw,本当にサイコなんだよなぁw,* 20161696,6,2022-10-26T22:03:13Z,2022-10-26T22:03:13Z
面白すぎた🤣🤣🤣,面白すぎた🤣🤣🤣,神崎あんじゅ,3,2022-10-26T12:44:32Z,2022-10-26T12:44:32Z
過去一笑ったかも笑笑笑笑,過去一笑ったかも笑笑笑笑,わたげ,5,2022-10-26T11:49:37Z,2022-10-26T11:49:37Z
サイコーに面白かった！！,サイコーに面白かった！！,Secchan San,5,2022-10-26T15:29:08Z,2022-10-26T15:29:08Z
神企画だろこれw,神企画だろこれw,湯豆腐,3,2022-10-26T12:16:14Z,2022-10-26T12:16:14Z
にやにやがとまらんすぎる,にやにやがとまらんすぎる,きりとりせん,5,2022-10-27T00:00:19Z,2022-10-27T00:00:19Z
めっちゃ面白かった,めっちゃ面白かった,水トミー,3,2022-10-27T06:29:26Z,2022-10-27T06:29:26Z
29:26のLINE偽物か確認してからの「あっでも送ったら俺返すよ?」は笑ったw,"29:26のLINE偽物か確認してからの
「あっでも送ったら俺返すよ?」は笑ったw",Y-RS A-S,9,2022-10-26T11:52:20Z,2022-10-26T11:52:20Z
カンタくんのドッキリの、企画は面白いんだけどふわっとした優しいドッキリすぎるんだよなトミーのドッキリの、仕掛けはいいけど編集が冗長だな独りよがりだなって部分がお互い補い合ってパワーアップしたドッキリって感じでいい！,"カンタくんのドッキリの、企画は面白いんだけどふわっとした優しいドッキリすぎるんだよな
トミーのドッキリの、仕掛けはいいけど編集が冗長だな独りよがりだなって部分が
お互い補い合ってパワーアップしたドッキリって感じでいい！",バロン,1,2022-10-26T21:36:51Z,2022-10-26T21:44:37Z
いつか本当にニコちゃんにお会い出来ると良いですね☺️,いつか本当にニコちゃんにお会い出来ると良いですね☺️,ゆゆぽん,6,2022-10-27T00:26:06Z,2022-10-27T00:26:06Z
笑い堪えるの大変だった🤣,笑い堪えるの大変だった🤣,miyuki,2,2022-10-26T11:48:41Z,2022-10-26T11:48:41Z
めっちゃ面白かったですー！！！,めっちゃ面白かったですー！！！,みおん,5,2022-10-26T23:44:14Z,2022-10-26T23:44:14Z
水溜りと食事だと思ってたら、にこさんドッキリ待ってます,水溜りと食事だと思ってたら、にこさんドッキリ待ってます,ra,7,2022-10-26T14:53:54Z,2022-10-26T14:53:54Z
マジックメール世代すぎてニタニタしてる,マジックメール世代すぎてニタニタしてる,Natsuki🍃⭐️,6,2022-10-26T14:03:46Z,2022-10-26T14:03:46Z
企画の雰囲気が新鮮！,企画の雰囲気が新鮮！,* r e i *,1,2022-10-26T11:42:54Z,2022-10-26T11:42:54Z
こういうドッキリ珍しいていうか初めてでは！？,こういうドッキリ珍しいていうか初めてでは！？,kayu sasa,0,2022-10-27T00:37:02Z,2022-10-27T00:37:02Z
個人的にカンタさんのLINEが変じゃなかったら可哀想が勝ってた気がするから心からカンタが変な人で良かったと思ってる。🐸,個人的にカンタさんのLINEが変じゃなかったら可哀想が勝ってた気がするから心からカンタが変な人で良かったと思ってる。🐸,suZu,6,2022-10-27T01:49:09Z,2022-10-27T01:49:09Z
企画説明を聞き進めるにつれて、この企画のエグさが伝わった😱でも動画の随所で安心できる一言があって楽しめた！相方が女の子のフリしてLINEしてるの見れないトミーは、相方の女装が見れないカンタと一緒かな？水溜りボンドといえばドッキリっていう感じだから、これからなんでもかんでも疑われそう笑,"企画説明を聞き進めるにつれて、この企画のエグさが伝わった😱
でも動画の随所で安心できる一言があって楽しめた！

相方が女の子のフリしてLINEしてるの見れないトミーは、相方の女装が見れないカンタと一緒かな？

水溜りボンドといえばドッキリっていう感じだから、これからなんでもかんでも疑われそう笑",penpenMC,3,2022-10-26T14:28:38Z,2022-10-26T14:28:38Z
いつか本当にお食事出来ることを祈ってます（笑）,いつか本当にお食事出来ることを祈ってます（笑）,K,2,2022-10-26T12:16:29Z,2022-10-26T12:16:29Z
私もワクワクが止まらんかった〜！！！！！！！！,私もワクワクが止まらんかった〜！！！！！！！！,中島きこ,0,2022-10-26T14:50:12Z,2022-10-26T14:50:12Z
にこちがケロケロ言うの知ってて「ありがとう🐸」って打ったってこと…？！だいぶ研究してるねキャンタ,にこちがケロケロ言うの知ってて「ありがとう🐸」って打ったってこと…？！だいぶ研究してるねキャンタ,シャンポー,1,2022-10-27T08:38:49Z,2022-10-27T08:38:49Z
過去一おもろいし昔の水たまりが戻ってきたかんじ,"過去一おもろいし
昔の水たまりが戻ってきたかんじ",かなしん,0,2022-10-26T13:40:37Z,2022-10-26T13:40:37Z
面白すぎる！！！😂,面白すぎる！！！😂,あみ,1,2022-10-26T14:27:56Z,2022-10-26T14:27:56Z
3人とも悪い顔してんなぁ〜😏このドッキリ好きだわ〜😆,"3人とも悪い顔してんなぁ〜😏
このドッキリ好きだわ〜😆",のんのん,3,2022-10-26T11:46:40Z,2022-10-26T11:46:40Z
約束はすぐに果たすかんてぃ好きよ🤣🤣,約束はすぐに果たすかんてぃ好きよ🤣🤣,Ask H,1,2022-10-26T11:46:14Z,2022-10-26T11:46:14Z
面白すぎた、、、,面白すぎた、、、,か.,7,2022-10-26T14:18:42Z,2022-10-26T14:18:42Z
面白かった😆,面白かった😆,モモ,5,2022-10-26T22:22:40Z,2022-10-26T22:22:40Z
最高の一言に尽きる。,最高の一言に尽きる。,P-Rockチャンネル,5,2022-10-26T12:53:29Z,2022-10-26T12:53:29Z
デートのために、美容室行ったり服買ったりしてたかもしれないのに地獄すぎるww,デートのために、美容室行ったり服買ったりしてたかもしれないのに地獄すぎるww,もね,1,2022-10-26T14:49:46Z,2022-10-26T14:49:46Z
にこちゃんのおすすめで見にきたけど、伊吹くんと水たまりボンドのカンタくん似てる😂,にこちゃんのおすすめで見にきたけど、伊吹くんと水たまりボンドのカンタくん似てる😂,はるな,3,2022-10-26T13:26:23Z,2022-10-26T13:26:23Z
今、見てみたけど伊吹フォローされててよかったね😂,今、見てみたけど伊吹フォローされててよかったね😂,ra,6,2022-10-26T11:53:25Z,2022-10-26T11:53:25Z
めっちゃ面白い企画ww,めっちゃ面白い企画ww,翼のない天使,1,2022-10-26T13:56:45Z,2022-10-26T13:56:45Z
カンタくんのお疲れいが腹たつw,カンタくんのお疲れいが腹たつw,rrr,3,2022-10-26T11:42:28Z,2022-10-26T11:42:28Z
別腹という表現素敵よ🤣🤣,別腹という表現素敵よ🤣🤣,Ask H,3,2022-10-26T11:52:30Z,2022-10-26T11:52:30Z
「うれしい？？🤗」って自分から聞く子サイコパスやぞww,「うれしい？？🤗」って自分から聞く子サイコパスやぞww,みの(ゴミのミノ),9,2022-10-27T01:55:04Z,2022-10-27T01:55:04Z
無人島の時の動画が出たときから、ニコちゃんとのコラボでこういう動画来ると思ってたし待ってた！！！ありがとうございます！！😆,無人島の時の動画が出たときから、ニコちゃんとのコラボでこういう動画来ると思ってたし待ってた！！！ありがとうございます！！😆,ジャスミンたまき,0,2022-10-26T14:00:52Z,2022-10-26T14:02:47Z
最高すぎました笑,最高すぎました笑,ミセス青リンゴ,4,2022-10-26T11:23:52Z,2022-10-26T11:23:52Z
おもしろすぎ笑笑,おもしろすぎ笑笑,はらぺこ姉妹,0,2022-10-26T12:28:01Z,2022-10-26T12:28:01Z
こうなったらNICOちゃんにはもう容易く会わないで欲しい。それで数年後に念願叶って会って大泣きして欲しいな🤣,"こうなったらNICOちゃんにはもう容易く会わないで欲しい。
それで数年後に念願叶って会って大泣きして欲しいな🤣",BlackWidowになれない_,6,2022-10-26T13:53:44Z,2022-10-26T13:53:44Z
まさか水溜りがロンハーみたいなドッキリするとは😂,まさか水溜りがロンハーみたいなドッキリするとは😂,ayana,2,2022-10-26T13:03:58Z,2022-10-26T13:03:58Z
次はガチで会わせましょうww,次はガチで会わせましょうww,マヤ,5,2022-10-26T23:28:29Z,2022-10-26T23:28:29Z
水溜りボンドの動画でのとしみつさんとTAKUYA∞さん的な流れを期待してしまってます←,水溜りボンドの動画でのとしみつさんとTAKUYA∞さん的な流れを期待してしまってます←,Ask H,6,2022-10-26T11:49:56Z,2022-10-26T11:49:56Z
いつか会える日が来ますように🙌,いつか会える日が来ますように🙌,こなこ,7,2022-10-27T01:04:06Z,2022-10-27T01:04:06Z
