textDisplay,textOriginal,authorDisplayName,likeCount,publishedAt,updatedAt
何回も見直してるんですけどオープニングの3人もめっちゃ浮かれててめっちゃおもろいですꉂ🤣𐤔,何回も見直してるんですけどオープニングの3人もめっちゃ浮かれててめっちゃおもろいですꉂ🤣𐤔,美奈,7,2022-10-26T22:27:50Z,2022-10-26T22:27:50Z
めちゃくちゃ笑いました🤣🤣この2組のコラボ最高！！トミーがめっちゃYouTuberしてるなぁって言ってたのもなんか嬉しかったなぁ😊NICOちゃんに会えるといいね！最高でした😊😊,"めちゃくちゃ笑いました🤣🤣
この2組のコラボ最高！！
トミーがめっちゃYouTuberしてるなぁって言ってたのもなんか嬉しかったなぁ😊
NICOちゃんに会えるといいね！
最高でした😊😊",さとし,7,2022-10-26T12:32:34Z,2022-10-26T12:32:34Z
最高のコラボ！新世代とのコラボもっと増やして欲しいなー今日も動画お疲れ様です！！,"最高のコラボ！
新世代とのコラボもっと増やして欲しいなー
今日も動画お疲れ様です！！",よねよね,25,2022-10-26T11:23:02Z,2022-10-26T11:23:02Z
可哀想かと思ったけどま、絶対いつか会わせてくれる先輩達が１回落としとくか！ドッキリだろうと思って爆笑した😂,"可哀想かと思ったけど
ま、絶対いつか会わせてくれる先輩達が
１回落としとくか！ドッキリだろうと思って爆笑した😂",_ konoha,12,2022-10-26T11:52:00Z,2022-10-26T11:52:00Z
めっちゃおもろかった笑いつか幸せなドッキリで平フラの2人に会えますように笑,"めっちゃおもろかった笑
いつか幸せなドッキリで平フラの2人に会えますように笑",のん,11,2022-10-26T11:45:33Z,2022-10-26T11:45:33Z
久しぶりに見たけどやっぱ水溜りボンドにはPさんキイチ枠が必要だよな,久しぶりに見たけどやっぱ水溜りボンドにはPさんキイチ枠が必要だよな,たか,2,2022-10-27T09:48:12Z,2022-10-27T09:48:12Z
実際の「福岡行き」は、状況的にはおいしいから多分普段なら素直に行ってるだろうに、目バキバキで加勢するのほんま面白いw,実際の「福岡行き」は、状況的にはおいしいから多分普段なら素直に行ってるだろうに、目バキバキで加勢するのほんま面白いw,借田猫太郎,9,2022-10-26T11:59:00Z,2022-10-26T11:59:00Z
ただ単に本当に面白い😂😂😂,ただ単に本当に面白い😂😂😂,PAN,11,2022-10-26T11:59:29Z,2022-10-26T11:59:29Z
ぜんぜん30分あったように感じなかった、ずっと面白かった笑笑,ぜんぜん30分あったように感じなかった、ずっと面白かった笑笑,のぞみ,8,2022-10-26T12:54:18Z,2022-10-26T12:54:18Z
彼女に会うために友達グループから上手く抜け出そうとする感じが出てて恋する男子可愛いなカンタくんのサイコみが光る企画にトミーが終始楽しそうでよかった笑ぜひ後日、対面編も！！,"彼女に会うために友達グループから上手く抜け出そうとする感じが出てて恋する男子可愛いな
カンタくんのサイコみが光る企画にトミーが終始楽しそうでよかった笑
ぜひ後日、対面編も！！",ももし,10,2022-10-26T12:06:50Z,2022-10-26T12:06:50Z
誠実すぎる！！！そしてたくさん配慮されてるところがみずぼんらしくて大好きだなぁと😢めちゃめちゃお気に入りな動画になったよー✨✨,誠実すぎる！！！そしてたくさん配慮されてるところがみずぼんらしくて大好きだなぁと😢めちゃめちゃお気に入りな動画になったよー✨✨,ズンズン山,4,2022-10-26T14:17:42Z,2022-10-26T14:17:42Z
水溜りと美人局のドッキリは中々イメージなかったけど、最高な仕上がり,水溜りと美人局のドッキリは中々イメージなかったけど、最高な仕上がり,ななめくすりゆび,4,2022-10-27T00:44:59Z,2022-10-27T00:44:59Z
今回の企画は手口が秀逸！！素晴らしいワロタ(⁠≧⁠▽⁠≦⁠),"今回の企画は手口が秀逸！！
素晴らしい
ワロタ(⁠≧⁠▽⁠≦⁠)",chihi,6,2022-10-26T14:00:55Z,2022-10-26T14:00:55Z
ありがとう🐸こんなに面白いドッキリ動画観せてくれて🤣,"ありがとう🐸
こんなに面白いドッキリ動画観せてくれて🤣",m f,11,2022-10-26T11:39:38Z,2022-10-26T11:39:38Z
面白かったぁ。水溜りボンド二人が力を合わせるとPさんの時もそうだけど、めっちゃ一緒にワクワクする。ヒリヒリドッキリだね！,"面白かったぁ。
水溜りボンド二人が力を合わせるとPさんの時もそうだけど、めっちゃ一緒にワクワクする。ヒリヒリドッキリだね！",ぷりぷり,1,2022-10-26T14:49:08Z,2022-10-26T14:49:08Z
ここの三人の連携は怖いな、ほんとw,ここの三人の連携は怖いな、ほんとw,桃原ゆずき,11,2022-10-26T11:25:01Z,2022-10-26T11:25:01Z
10:57 私もなぜ「ありがとう」の後に🐸なんだろうと思ってたので､伊吹と同じツッコミで笑った,10:57 私もなぜ「ありがとう」の後に🐸なんだろうと思ってたので､伊吹と同じツッコミで笑った,na,16,2022-10-26T11:58:26Z,2022-10-26T11:58:26Z
本人完全協力は強い笑,本人完全協力は強い笑,ハッピー,18,2022-10-26T11:12:14Z,2022-10-26T11:12:14Z
久しぶりに動画見てあとの2人知らなかったけど、初見でもリアクションが良すぎて面白い反面ほんとに楽しみにしてたのが伝わるから可哀想だった笑笑,久しぶりに動画見てあとの2人知らなかったけど、初見でもリアクションが良すぎて面白い反面ほんとに楽しみにしてたのが伝わるから可哀想だった笑笑,り,1,2022-10-26T14:44:40Z,2022-10-26T14:44:40Z
無人島の時といい、この4人がジャンケンすると何でこんなにオモロいのw,無人島の時といい、この4人がジャンケンすると何でこんなにオモロいのw,y y,2,2022-10-27T04:37:18Z,2022-10-27T04:37:18Z
面白すぎて一瞬でした！！！✨みんな楽しそうすぎて見ているこちらも楽しかったです最高でした🤟,面白すぎて一瞬でした！！！✨みんな楽しそうすぎて見ているこちらも楽しかったです最高でした🤟,スイミー,4,2022-10-27T00:23:02Z,2022-10-27T00:23:02Z
水溜りボンドのドッキリは期待しかない！！,水溜りボンドのドッキリは期待しかない！！,ちょこだらけ,12,2022-10-26T11:15:20Z,2022-10-26T11:15:20Z
久しぶりに笑いすぎてお腹痛い🤣🤣,久しぶりに笑いすぎてお腹痛い🤣🤣,えーちゃん,5,2022-10-26T12:07:50Z,2022-10-26T12:07:50Z
30分ちょっと長いかなって思ってたけど面白すぎて気づいたら終わってた😂表情筋痛い😂,"30分ちょっと長いかなって思ってたけど面白すぎて気づいたら終わってた😂
表情筋痛い😂",ぺーすけ,6,2022-10-26T17:03:24Z,2022-10-26T17:03:24Z
めちゃくちゃ笑わせてもらった笑笑,めちゃくちゃ笑わせてもらった笑笑,はな,4,2022-10-26T12:39:34Z,2022-10-26T12:39:34Z
すっごい笑ったｗおもしろいなあｗ,"すっごい笑ったｗ
おもしろいなあｗ",☺︎ひろ,5,2022-10-26T11:42:49Z,2022-10-26T11:42:49Z
忘れた頃に別の人ターゲットで同じドッキリかけて欲しいな〜（笑）,忘れた頃に別の人ターゲットで同じドッキリかけて欲しいな〜（笑）,kiki,12,2022-10-26T11:16:44Z,2022-10-26T11:16:44Z
この協力ドッキリはまじでやばそうだなw,この協力ドッキリはまじでやばそうだなw,さき,11,2022-10-26T11:15:37Z,2022-10-26T11:17:46Z
こんなにワクワクする感情久しぶりで楽しすぎ！めっちゃしっかり計画されたドッキリなのにカンタくんのLINEだけガチでキショいの笑う🐸w,"こんなにワクワクする感情久しぶりで楽しすぎ！
めっちゃしっかり計画されたドッキリなのにカンタくんのLINEだけガチでキショいの笑う🐸w",aoi,21,2022-10-26T11:34:07Z,2022-10-26T11:34:07Z
相方に掛け合うドッキリも楽しいけど、競合して親しい友達にかけるドッキリ最高に楽しい😊✨,相方に掛け合うドッキリも楽しいけど、競合して親しい友達にかけるドッキリ最高に楽しい😊✨,413さゆさゆ,7,2022-10-26T11:38:34Z,2022-10-26T11:38:34Z
新しいパターンのドッキリだったけどこれは、続編期待しちゃいます😂,新しいパターンのドッキリだったけどこれは、続編期待しちゃいます😂,Music S,5,2022-10-26T23:11:26Z,2022-10-26T23:11:26Z
いつか本当に会える企画してあげるんだろうなあ,いつか本当に会える企画してあげるんだろうなあ,ぴぴ,5,2022-10-27T03:48:43Z,2022-10-27T03:48:43Z
もうほんと面白い最高😂😂,もうほんと面白い最高😂😂,りく,3,2022-10-26T12:09:53Z,2022-10-26T12:09:53Z
いやもう最高に面白い企画😂😂,いやもう最高に面白い企画😂😂,すうさん,5,2022-10-26T11:37:38Z,2022-10-26T11:37:38Z
伊吹ときゃんた、初めの姿勢が一緒で笑う,伊吹ときゃんた、初めの姿勢が一緒で笑う,izu Sui,2,2022-10-26T23:31:13Z,2022-10-26T23:31:13Z
もはや息できなくなっちゃってて可愛すぎる。,もはや息できなくなっちゃってて可愛すぎる。,happy15,3,2022-10-27T04:14:50Z,2022-10-27T04:14:50Z
このコラボ大好きすぎる！！！第2弾も期待してるね✨次は伊吹で😂笑,"このコラボ大好きすぎる！！！
第2弾も期待してるね✨
次は伊吹で😂笑",かおちゃん🐰,5,2022-10-26T11:56:40Z,2022-10-26T11:56:40Z
これはマジでおもろい。もちろん別の機会にご褒美企画あるんでしょ？？,"これはマジでおもろい。
もちろん別の機会にご褒美企画あるんでしょ？？",りょー,5,2022-10-26T12:15:19Z,2022-10-26T12:15:19Z
こんな純粋な子にこちゃん会ってあげてほしいわ笑😂,こんな純粋な子にこちゃん会ってあげてほしいわ笑😂,EN_ atsu728🦩,9,2022-10-26T12:26:45Z,2022-10-26T12:26:45Z
会社で見てて笑い堪えてたら喉おかしくなった,会社で見てて笑い堪えてたら喉おかしくなった,チョッピー🧸,2,2022-10-27T04:09:29Z,2022-10-27T04:09:29Z
仲良しだからできるドッキリだね😆🌟✨,仲良しだからできるドッキリだね😆🌟✨,ゆふちゅん💙🦁,12,2022-10-26T11:17:02Z,2022-10-26T11:17:02Z
30分があっという間で、見終わった後、もう一度じっくり見たいって思いました。ドッキソかと思ったらがっつりドッキリでめちゃくちゃ思しろかった！,30分があっという間で、見終わった後、もう一度じっくり見たいって思いました。ドッキソかと思ったらがっつりドッキリでめちゃくちゃ思しろかった！,ミーミー,2,2022-10-26T12:35:09Z,2022-10-26T12:35:09Z
平フラと自転車のコラボ動画面白かったから未だに何回も見てます🤣💓💓💓,平フラと自転車のコラボ動画面白かったから未だに何回も見てます🤣💓💓💓,∞むい,8,2022-10-26T13:11:30Z,2022-10-26T13:11:30Z
こういうドッキリすきすぎる、、！！！,こういうドッキリすきすぎる、、！！！,むむ,6,2022-10-26T15:24:59Z,2022-10-26T15:24:59Z
面白すぎてめちゃくちゃ笑った😂😂,面白すぎてめちゃくちゃ笑った😂😂,みお,2,2022-10-26T13:12:36Z,2022-10-26T13:12:36Z
この動画好きすぎて連日リピート🤦🏻‍♀️,この動画好きすぎて連日リピート🤦🏻‍♀️,か.,3,2022-10-27T03:44:57Z,2022-10-27T03:44:57Z
ほんとに面白かった(笑)今日もありがとう！お疲れ様です🤍,"ほんとに面白かった(笑)
今日もありがとう！お疲れ様です🤍",なな,1,2022-10-26T14:54:41Z,2022-10-26T14:54:41Z
伊吹くん笑い方おもろwつられるw,"伊吹くん笑い方おもろw
つられるw",桃原ゆずき,8,2022-10-26T11:37:15Z,2022-10-26T11:37:15Z
仕事で毎日疲れてたけど久しぶりにめっちゃ笑いました😆😆😆😆😆,仕事で毎日疲れてたけど久しぶりにめっちゃ笑いました😆😆😆😆😆,ち なつ,0,2022-10-26T13:30:12Z,2022-10-26T13:30:12Z
カンタくんのLINEで腹筋崩壊😂水溜りボンドによってニコちゃんに会える可能性が近づいてきてる？？？3人で肩寄せ合って爆笑してるのいいな〜面白かった！,"カンタくんのLINEで腹筋崩壊😂
水溜りボンドによってニコちゃんに会える可能性が近づいてきてる？？？
3人で肩寄せ合って爆笑してるのいいな〜面白かった！",みらゆき,12,2022-10-26T12:33:39Z,2022-10-26T12:33:39Z
ヒリヒリするーーーーめっちゃ面白い企画😂😂😂,"ヒリヒリするーーーー
めっちゃ面白い企画😂😂😂",あい,7,2022-10-26T11:28:45Z,2022-10-26T11:28:45Z
マッジで面白かったです笑こういうドッキリYouTubeではあまりなかったから、すごくドキドキしました😂,"マッジで面白かったです笑
こういうドッキリYouTubeではあまりなかったから、すごくドキドキしました😂",まりな,3,2022-10-26T23:37:53Z,2022-10-26T23:37:53Z
この4人、大好きすぎる😂😂😂✨,この4人、大好きすぎる😂😂😂✨,神崎あんじゅ,3,2022-10-26T12:45:24Z,2022-10-26T12:45:24Z
トミーとカンタが協力するドッキリが1番面白い,トミーとカンタが協力するドッキリが1番面白い,ゆうき,5,2022-10-26T14:34:02Z,2022-10-26T14:34:02Z
カンタが水ダウ並みにサイコパスで笑う,カンタが水ダウ並みにサイコパスで笑う,翔MAX TV,2,2022-10-27T05:28:17Z,2022-10-27T05:28:17Z
ドッキリ始まる前からあまりにもおもろすぎる,ドッキリ始まる前からあまりにもおもろすぎる,m i,3,2022-10-26T12:26:51Z,2022-10-26T12:26:51Z
伊吹がカメラを構えてくっついてるの可愛い☺♥,伊吹がカメラを構えてくっついてるの可愛い☺♥,だいすきたからもの,11,2022-10-26T22:24:44Z,2022-10-26T22:24:44Z
誠実×誠実 の心地良く見られるドッキリ。,誠実×誠実 の心地良く見られるドッキリ。,as aor,4,2022-10-27T02:49:43Z,2022-10-27T02:49:43Z
これは流石にいつかご本人に合わせてあげて下さい笑笑,"これは流石にいつかご本人に
合わせてあげて下さい笑笑",のあ,7,2022-10-26T12:58:00Z,2022-10-26T12:58:00Z
カンタくんのラインの文章と絵文字のチョイス、本当に変だよ笑,カンタくんのラインの文章と絵文字のチョイス、本当に変だよ笑,ぴょん.,23,2022-10-26T11:31:20Z,2022-10-26T11:43:32Z
最っ高にわくわくするドッキリさすが水ぼん,"最っ高にわくわくするドッキリ
さすが水ぼん",あー。,3,2022-10-26T12:58:21Z,2022-10-26T12:58:21Z
ロンハーのを楽しくオマージュしてるからめちゃくちゃ面白い,ロンハーのを楽しくオマージュしてるからめちゃくちゃ面白い,山田司,3,2022-10-26T14:31:11Z,2022-10-26T14:31:11Z
もうずっと笑える😂,もうずっと笑える😂,MI KU,2,2022-10-26T14:14:35Z,2022-10-26T14:14:35Z
おもろ企画すぎる天才,おもろ企画すぎる天才,もえち,10,2022-10-26T11:24:29Z,2022-10-26T11:24:29Z
コラボドッキリたくさんして欲しい😂,コラボドッキリたくさんして欲しい😂,さーさん,1,2022-10-26T15:33:19Z,2022-10-26T15:33:19Z
ここまでエグめのドッキリは水ボンのチャンネルでしか見れないと思ったw今日も最高の動画でした！編集お疲れ様です,"ここまでエグめのドッキリは水ボンのチャンネルでしか見れないと思ったw
今日も最高の動画でした！
編集お疲れ様です",さき,2,2022-10-26T11:43:04Z,2022-10-26T11:43:04Z
めちゃくちゃ笑った🤣これ何回も見る！,めちゃくちゃ笑った🤣これ何回も見る！,snowy2451,0,2022-10-26T14:51:31Z,2022-10-26T14:51:31Z
にこちのビジュ良き…そしてカンタの悪いことしてるニマニマ笑顔好き,"にこちのビジュ良き…
そしてカンタの悪いことしてるニマニマ笑顔好き",シャンポー,2,2022-10-27T08:23:09Z,2022-10-27T08:23:09Z
不機嫌にもならず、いい子やん。。焼肉たんまりたべてくれ,不機嫌にもならず、いい子やん。。焼肉たんまりたべてくれ,じゃじゃいもさん,17,2022-10-26T14:50:26Z,2022-10-26T14:50:26Z
内容的にはめちゃくちゃヒリヒリで、かけられたらヘコむ展開なのに、なぜか安心して見られるところが水溜りクオリティだな。,内容的にはめちゃくちゃヒリヒリで、かけられたらヘコむ展開なのに、なぜか安心して見られるところが水溜りクオリティだな。,パパリナ,1,2022-10-27T10:17:19Z,2022-10-27T10:17:19Z
ずっとずーっと水溜りボンド大好き😢何があってもやっぱりカンタさんとトミーさん最高だよ😭色んなことあったけど、気にしないで前の2人でいて欲しい😭,"ずっとずーっと水溜りボンド大好き😢

何があってもやっぱりカンタさんとトミーさん最高だよ😭

色んなことあったけど、気にしないで前の2人でいて欲しい😭",堀脇陸,4,2022-10-26T19:13:08Z,2022-10-26T19:13:08Z
なんだろ、この男子のノリが最高😂,なんだろ、この男子のノリが最高😂,うさうさ🐰,5,2022-10-26T15:03:35Z,2022-10-26T15:03:35Z
この企画ひたすらに最高すぎる笑笑,この企画ひたすらに最高すぎる笑笑,すかいとーん,2,2022-10-26T12:03:25Z,2022-10-26T12:03:25Z
25:37 「カンタのお疲れい 飯くおうぜい」が好きすぎる笑笑,25:37 「カンタのお疲れい 飯くおうぜい」が好きすぎる笑笑,ぽんて,7,2022-10-26T15:45:30Z,2022-10-26T15:45:39Z
次はほんとに会えるドッキリ見たいな🤣,次はほんとに会えるドッキリ見たいな🤣,めい,5,2022-10-26T15:36:44Z,2022-10-26T15:36:44Z
あーーーーーーーおもしろい😢😢😢😢おもしろすぎて久々にすげー素直な普通の感想でた🥲🥲💞,"あーーーーーーーおもしろい😢😢😢😢
おもしろすぎて久々にすげー素直な普通の感想でた🥲🥲💞",ちゃんしー,22,2022-10-26T11:24:04Z,2022-10-26T11:24:18Z
ここ数ヶ月で1番笑った,ここ数ヶ月で1番笑った,焼売の皮,4,2022-10-26T14:10:25Z,2022-10-26T14:10:25Z
勝手に仕掛けてる側になりきってニヤついて観てた🤣,勝手に仕掛けてる側になりきってニヤついて観てた🤣,豆大福,6,2022-10-26T11:54:04Z,2022-10-26T11:54:04Z
なんかもうヒリヒリする😂💓最っ高に面白い😂💓,"なんかもうヒリヒリする😂💓
最っ高に面白い😂💓",きゅん,8,2022-10-26T11:30:26Z,2022-10-26T11:30:26Z
もう面白すぎる🤣🤣🤣4人の動画大好き🤣🤣🤣,"もう面白すぎる🤣🤣🤣
4人の動画大好き🤣🤣🤣",moririn,1,2022-10-26T15:12:41Z,2022-10-26T15:12:41Z
逆に、にこちゃんに会わせるサプライズしてあげてほしい😂😂😂,逆に、にこちゃんに会わせるサプライズしてあげてほしい😂😂😂,ふらみんご🦩,12,2022-10-26T13:08:38Z,2022-10-26T13:08:38Z
くっっっっそおもろい！！！！！！ハッピーメール世代には嬉しすぎるドッキリ😂,"くっっっっそおもろい！！！！！！
ハッピーメール世代には嬉しすぎるドッキリ😂",ma su,11,2022-10-26T12:51:53Z,2022-10-26T12:51:53Z
これはワクワクして笑って肩が揺れた(笑)(笑),これはワクワクして笑って肩が揺れた(笑)(笑),n.r,2,2022-10-26T12:13:55Z,2022-10-26T12:13:55Z
続編！！それは期待しちゃう✨😂,続編！！それは期待しちゃう✨😂,たんさん,6,2022-10-26T23:11:15Z,2022-10-26T23:11:15Z
めちゃくちゃ笑った🤣,めちゃくちゃ笑った🤣,m ii,3,2022-10-26T12:06:30Z,2022-10-26T12:06:30Z
ほんっとに超笑った😂😂😂😂,ほんっとに超笑った😂😂😂😂,はな,5,2022-10-26T11:56:42Z,2022-10-26T11:56:42Z
10:55 「ありがとう🐸」泣くほど笑った,"10:55 「ありがとう🐸」
泣くほど笑った",寝子,8,2022-10-26T23:26:20Z,2022-10-26T23:26:20Z
概要欄見ました〜！！ぜひぜひ、幸せなPart２お待ちしております！！！！！！！！(ビックリマーク８倍),"概要欄見ました〜！！
ぜひぜひ、幸せなPart２お待ちしております！！！！！！！！(ビックリマーク８倍)",こさじ,6,2022-10-27T00:15:09Z,2022-10-27T00:15:09Z
ジャンケンのくだり、まじで天才すぎた😂,ジャンケンのくだり、まじで天才すぎた😂,シロサギ,5,2022-10-26T11:43:27Z,2022-10-26T11:43:27Z
カンタに結婚ドッキリがっつりかけてたトミーの血が騒いでる感じが面白かった。,カンタに結婚ドッキリがっつりかけてたトミーの血が騒いでる感じが面白かった。,すま01,6,2022-10-26T12:42:42Z,2022-10-26T12:42:42Z
私もロンハーを見て育ちました😆😆最高の企画でした🤣おもろ🤣🤣🤣にこちゃんご協力ありがとうございます🙇‍♀️🙇‍♀️また水溜りボンドと動画待ってます🫣🫣,"私もロンハーを見て育ちました😆😆
最高の企画でした🤣
おもろ🤣🤣🤣

にこちゃんご協力ありがとうございます🙇‍♀️🙇‍♀️
また水溜りボンドと動画待ってます🫣🫣",Ask H,13,2022-10-26T11:30:20Z,2022-10-26T11:30:20Z
トミー結婚ドッキリと同じくらい面白い笑,トミー結婚ドッキリと同じくらい面白い笑,ぽんて,7,2022-10-26T11:58:36Z,2022-10-26T11:58:36Z
終始ニヤニヤ止まらんかった(笑)面白ドッキリやったなぁ！,"終始ニヤニヤ止まらんかった(笑)
面白ドッキリやったなぁ！",涼。,1,2022-10-26T12:13:17Z,2022-10-26T12:13:17Z
オープニングの時点でワクワクしすぎてニヤけが止まらん😂,オープニングの時点でワクワクしすぎてニヤけが止まらん😂,しぃの実,1,2022-10-26T13:18:19Z,2022-10-26T13:18:19Z
25:06 伊吹の笑い声がもう犬すぎて🥹誰よりも楽しんでるのが伝わる　おもろい,25:06 伊吹の笑い声がもう犬すぎて🥹誰よりも楽しんでるのが伝わる　おもろい,ふたば,1,2022-10-27T08:31:44Z,2022-10-27T08:32:29Z
くっついて待ち構える3人の顔よ😂,くっついて待ち構える3人の顔よ😂,popeyee,4,2022-10-26T12:12:53Z,2022-10-26T12:12:53Z
めっちゃくちゃ笑った😂,めっちゃくちゃ笑った😂,chacchi mon,1,2022-10-27T05:50:12Z,2022-10-27T05:50:12Z
めっちゃ笑った😂😂最高！！！,めっちゃ笑った😂😂最高！！！,たーろ,7,2022-10-26T15:29:17Z,2022-10-26T15:29:17Z
これ自分がNICOちゃんならすごい嬉しいだろうな😂笑,"これ自分がNICOちゃんなら
すごい嬉しいだろうな😂笑",りーぬ,17,2022-10-26T11:33:10Z,2022-10-26T11:33:10Z
いつかにこちゃんとドッキリで会わせてほしいなぁ(独り言),いつかにこちゃんとドッキリで会わせてほしいなぁ(独り言),MIYAMOSH BABY 💛,5,2022-10-26T12:06:22Z,2022-10-26T12:06:22Z
この4人本当に好き！,この4人本当に好き！,めいこ,2,2022-10-26T12:16:26Z,2022-10-26T12:16:26Z
カンタ、ドッキリレベルあがりすぎててすごい、ドッキソとかドッキリ何連発、猿になったドッキ🐵🐵みたいなキイチと意味不明なことして、トミーに「ならべ」って言われたカンタドッキリも好きなんだよなぁ～笑,"カンタ、ドッキリレベルあがりすぎててすごい、
ドッキソとかドッキリ何連発、猿になったドッキ🐵🐵みたいなキイチと意味不明なことして、トミーに「ならべ」って言われたカンタドッキリも好きなんだよなぁ～笑",のりまき,1,2022-10-27T10:38:17Z,2022-10-27T10:38:17Z
有言実行集団!!!笑ったｰ！,有言実行集団!!!笑ったｰ！,そふぃあ,5,2022-10-26T11:45:02Z,2022-10-26T11:45:02Z
面白すぎ！水溜りボンドのドッキリは最高だ👍✨💕,面白すぎ！水溜りボンドのドッキリは最高だ👍✨💕,ゆふちゅん💙🦁,7,2022-10-26T11:57:04Z,2022-10-26T11:57:04Z
平成フラミンゴニコちゃん推しなのでサムネ見て飛んできました！ただ、できたら実際に二人でご飯食べることになった所をモニタリングするとこまでやって欲しかった笑,平成フラミンゴニコちゃん推しなのでサムネ見て飛んできました！ただ、できたら実際に二人でご飯食べることになった所をモニタリングするとこまでやって欲しかった笑,☆RINO☆,8,2022-10-26T12:26:40Z,2022-10-26T12:26:40Z
