textDisplay,textOriginal,authorDisplayName,likeCount,publishedAt,updatedAt
申し訳ないけど、がちわくわくしたし面白かった！！！🤣にこちゃん、ほんとに行ってあげてください！笑　いぶきもフォローしてあげてください！笑,"申し訳ないけど、がちわくわくしたし面白かった！！！🤣
にこちゃん、ほんとに行ってあげてください！笑　いぶきもフォローしてあげてください！笑",くうみい,2,2022-10-27T08:35:35Z,2022-10-27T08:35:35Z
オープニングで真ん中にカンタのCGが出てるのかと思った。髪型似すぎ。笑,"オープニングで真ん中に
カンタのCGが出てるのかと思った。髪型似すぎ。笑",ひなちゃん,7,2022-10-26T22:16:59Z,2022-10-26T22:16:59Z
もう、仕掛け人3人組の嬉しそうな顔🤣🤣🤣🤣🤣,もう、仕掛け人3人組の嬉しそうな顔🤣🤣🤣🤣🤣,まおまお,5,2022-10-26T13:31:50Z,2022-10-26T13:31:50Z
トミーめっちゃ痩せてる,トミーめっちゃ痩せてる,s k,1,2022-10-26T13:28:01Z,2022-10-26T13:28:01Z
めっっちゃ面白かった！！！！！！,めっっちゃ面白かった！！！！！！,a,3,2022-10-26T12:23:39Z,2022-10-26T12:23:39Z
18:18 水ボンのシンクロ率高すぎw,18:18 水ボンのシンクロ率高すぎw,Ruke,1,2022-10-27T10:52:23Z,2022-10-27T10:52:23Z
マジックメールヤバい😂スマホ見せてきた瞬間ニヤニヤ止まらん,マジックメールヤバい😂スマホ見せてきた瞬間ニヤニヤ止まらん,てんてこまい,5,2022-10-26T11:19:49Z,2022-10-26T11:19:49Z
伊吹ばか楽しそう笑笑,伊吹ばか楽しそう笑笑,カフェオレ星,6,2022-10-26T16:56:57Z,2022-10-26T16:56:57Z
平成フラミンゴさんと3組でのドッキリ動画待ってます！,平成フラミンゴさんと3組でのドッキリ動画待ってます！,SLI CPU,5,2022-10-26T11:52:53Z,2022-10-26T11:52:53Z
高感度がかなり高い、会わせてあげてほしい😂,高感度がかなり高い、会わせてあげてほしい😂,森田太,3,2022-10-26T12:31:53Z,2022-10-26T12:31:53Z
本当に会わせてあげたい！！もちろんドッキリで✨,"本当に会わせてあげたい！！
もちろんドッキリで✨",みわ,2,2022-10-26T11:43:29Z,2022-10-26T11:43:29Z
何が面白いかって相方の伊吹くんが1番悪い顔して笑ってるんだよなぁ笑笑笑笑,何が面白いかって相方の伊吹くんが1番悪い顔して笑ってるんだよなぁ笑笑笑笑,はく,3,2022-10-26T12:10:58Z,2022-10-26T12:10:58Z
見る前から面白い😆😆😆😆,見る前から面白い😆😆😆😆,ゆふちゅん💙🦁,3,2022-10-26T11:13:28Z,2022-10-26T11:13:28Z
カンタとトミー２人で考えるドッキリは強すぎっwだんだん上乗せされてくしw,カンタとトミー２人で考えるドッキリは強すぎっwだんだん上乗せされてくしw,ボンの人,1,2022-10-27T10:06:09Z,2022-10-27T10:06:09Z
としみつとたくやさんのドッキリ思い出したｗ,としみつとたくやさんのドッキリ思い出したｗ,まる,4,2022-10-27T01:21:34Z,2022-10-27T01:21:34Z
高校生男子みたいなウキウキだ愛しすぎる爆笑,高校生男子みたいなウキウキだ愛しすぎる爆笑,るあん,2,2022-10-26T14:19:38Z,2022-10-26T14:19:38Z
会わせるドッキリも見てみたい。ふふふ,会わせるドッキリも見てみたい。ふふふ,sasimin,4,2022-10-26T17:41:09Z,2022-10-26T17:41:09Z
最高の一言に尽きる。😂,最高の一言に尽きる。😂,き。,2,2022-10-26T11:51:43Z,2022-10-26T11:51:43Z
にこちゃん協力ありがとう❤,にこちゃん協力ありがとう❤,Haruhi 🦩,5,2022-10-26T16:28:15Z,2022-10-26T16:28:15Z
いやもう、それはエグイってぇ🤣,いやもう、それはエグイってぇ🤣,izu izu,3,2022-10-26T11:43:50Z,2022-10-26T11:43:50Z
トミーさんが痩せて伊吹くんが昔のカンタくんくらいのサイズ感だからおもろい,トミーさんが痩せて伊吹くんが昔のカンタくんくらいのサイズ感だからおもろい,pool of bond,0,2022-10-26T14:56:05Z,2022-10-26T14:56:05Z
可愛そうやし逆ドッキリもやったげて😂NICOちゃんいるドッキリ🎉,"可愛そうやし逆ドッキリもやったげて😂
NICOちゃんいるドッキリ🎉",あかりん,5,2022-10-26T14:10:58Z,2022-10-26T14:10:58Z
最近の色々な動画の中で一番かも😂😂😂,最近の色々な動画の中で一番かも😂😂😂,みーさん,4,2022-10-27T04:21:56Z,2022-10-27T04:21:56Z
10:54 12:08カンタおじみ溢れるのやばい🤗🤗🤗,"10:54 12:08
カンタおじみ溢れるのやばい🤗🤗🤗",M.M.【まなみ】,3,2022-10-26T11:45:57Z,2022-10-26T11:45:57Z
これは神回,これは神回,まっつぼっくり,3,2022-10-26T12:14:15Z,2022-10-26T12:14:15Z
とみーの前髪なし…！かっこいいです！推せる！,とみーの前髪なし…！かっこいいです！推せる！,めろんぽっぷ,3,2022-10-26T13:11:36Z,2022-10-26T13:11:36Z
カンタと伊吹似すぎw,カンタと伊吹似すぎw,koko-neko,3,2022-10-27T02:36:17Z,2022-10-27T02:36:17Z
可哀想だから今度平フラと三組でコラボしてあげてぇ🤣,可哀想だから今度平フラと三組でコラボしてあげてぇ🤣,みひょ吉,3,2022-10-26T12:10:15Z,2022-10-26T12:10:15Z
待って水溜りボンド福岡好き過ぎん？,待って水溜りボンド福岡好き過ぎん？,涼,3,2022-10-26T12:43:14Z,2022-10-26T12:43:14Z
プライベートでこれやられたら仲良くてもブチギレ案件w,プライベートでこれやられたら仲良くてもブチギレ案件w,マヤ,0,2022-10-26T23:27:35Z,2022-10-26T23:27:35Z
おもろ😂,おもろ😂,🥠岡本だいあな妃🪅,4,2022-10-27T01:22:36Z,2022-10-27T01:22:36Z
次は突然逢えるってドッキリにしてあげて〜,次は突然逢えるってドッキリにしてあげて〜,J max,7,2022-10-27T00:20:10Z,2022-10-27T00:20:10Z
めちゃおもろいやん🤣,めちゃおもろいやん🤣,yu i,0,2022-10-26T11:36:23Z,2022-10-26T11:36:23Z
ガチだから誰にも言わなかったに1票,ガチだから誰にも言わなかったに1票,みぴ2,6,2022-10-26T12:53:03Z,2022-10-26T12:53:03Z
この後にこちゃん電話掛けてほしかったなぁ笑,この後にこちゃん電話掛けてほしかったなぁ笑,るあん,3,2022-10-26T14:23:20Z,2022-10-26T14:23:20Z
この為に無人島があったのかと思うぐらいよかった,この為に無人島があったのかと思うぐらいよかった,ことんオハナ,2,2022-10-26T11:50:46Z,2022-10-26T11:50:46Z
一回負けた時の表情も見ておくかーってのが悪😂,一回負けた時の表情も見ておくかーってのが悪😂,**星,2,2022-10-26T16:21:51Z,2022-10-26T16:21:51Z
LINEのやりとり、一時停止しないと見えないよと思って一時停止したら、ご丁寧に※一時停止推奨って注釈あった！カンタくんさすがです。,"LINEのやりとり、一時停止しないと見えないよと思って一時停止したら、ご丁寧に※一時停止推奨って注釈あった！
カンタくんさすがです。",パッポフ🐥,5,2022-10-26T13:14:20Z,2022-10-26T13:14:20Z
LINE成りすまされてるのは恥ずかしすぎる〜😂😂,LINE成りすまされてるのは恥ずかしすぎる〜😂😂,ま。,2,2022-10-27T06:33:18Z,2022-10-27T06:33:18Z
悪ガキ三人組!やってんな😂,"悪ガキ三人組!
やってんな😂",hidamari312,5,2022-10-26T11:25:10Z,2022-10-26T11:25:10Z
色んな人に見て欲しい！コレはマジでヤバい！！,色んな人に見て欲しい！コレはマジでヤバい！！,٩(ü)วまー٩(ü)ว,2,2022-10-26T12:36:31Z,2022-10-26T12:36:31Z
トミーめためた痩せてる…！！,トミーめためた痩せてる…！！,ぎょうざ,0,2022-10-26T13:55:56Z,2022-10-26T13:55:56Z
カンタくんのLINEのセンス🐸🤣🤣🤣,カンタくんのLINEのセンス🐸🤣🤣🤣,たんさん,6,2022-10-26T23:08:59Z,2022-10-26T23:08:59Z
マジでいつか会わせてあげて😂,マジでいつか会わせてあげて😂,みずき,6,2022-10-26T11:44:13Z,2022-10-26T11:44:13Z
見る前に予想してるのも楽しかった〜。やっぱり無人島から繋がってた🤩伊吹くんのモナ王好きなんだけど嫌がられたからちょっとまた画像出てきてドキッとした😅さ〜続きみよ🎵,"見る前に予想してるのも楽しかった〜。
やっぱり無人島から繋がってた🤩
伊吹くんのモナ王好きなんだけど嫌がられたから
ちょっとまた画像出てきてドキッとした😅
さ〜続きみよ🎵",えーちゃん,2,2022-10-26T11:48:04Z,2022-10-26T11:48:04Z
マジックメール好きやったわ🤣,マジックメール好きやったわ🤣,ゆふちゅん💙🦁,8,2022-10-26T11:18:53Z,2022-10-26T11:18:53Z
にこちゃんとのご飯なのに短パンで行くんだ😂,にこちゃんとのご飯なのに短パンで行くんだ😂,ひな,1,2022-10-27T06:12:25Z,2022-10-27T06:12:25Z
ここまできたら会わしてあげて欲しい‼︎,ここまできたら会わしてあげて欲しい‼︎,はるえのん,7,2022-10-26T11:40:38Z,2022-10-26T11:40:38Z
最近で一番ガチウケしたかも😂ちなみに最近EDが短縮されてるのは意図的ですか？一回フル尺に戻ってた気もするけど。。。,"最近で一番ガチウケしたかも😂
ちなみに最近EDが短縮されてるのは意図的ですか？
一回フル尺に戻ってた気もするけど。。。",- diedieorange -,3,2022-10-26T13:27:18Z,2022-10-26T13:27:18Z
ありがとう🐸には、笑った。,"ありがとう🐸
には、笑った。",ぷりぷり,3,2022-10-26T14:49:52Z,2022-10-26T14:49:52Z
可愛すぎるやん😂笑,可愛すぎるやん😂笑,。ぴえろーにゃ,0,2022-10-27T09:50:33Z,2022-10-27T09:50:33Z
めちゃくちゃ良かった！！,めちゃくちゃ良かった！！,わたなべ,1,2022-10-26T16:26:31Z,2022-10-26T16:26:31Z
久しぶりに観に来たらトミーが痩せてた,久しぶりに観に来たらトミーが痩せてた,いか,0,2022-10-26T13:45:49Z,2022-10-26T13:45:49Z
攻めた企画最高です😂🎉,攻めた企画最高です😂🎉,ARISA,0,2022-10-27T10:30:48Z,2022-10-27T10:30:48Z
懐かしのロンハー感が最高🤣,懐かしのロンハー感が最高🤣,たかそじゅん,1,2022-10-26T12:12:49Z,2022-10-26T12:12:49Z
おもしろすぎ,おもしろすぎ,ぺい,1,2022-10-26T13:43:49Z,2022-10-26T13:43:49Z
ひさしぶりに、コレだよ！って動画を見た気がします。チャンネル再登録に値するものを見させていただきました。今までわざわざ検索して見に来てたんだからね！これからも頑張ってください。応援しています。,"ひさしぶりに、コレだよ！って動画を見た気がします。チャンネル再登録に値するものを見させていただきました。

今までわざわざ検索して見に来てたんだからね！
これからも頑張ってください。
応援しています。",ねお,16,2022-10-26T13:07:28Z,2022-10-26T13:07:28Z
これは水ボンいるドッキリというより、水ボンいるガチだよww,これは水ボンいるドッキリというより、水ボンいるガチだよww,理系学生Tom,1,2022-10-27T08:55:54Z,2022-10-27T08:55:54Z
NICOちゃん人気者だーさすが！！,NICOちゃん人気者だーさすが！！,A___,6,2022-10-26T16:51:54Z,2022-10-26T16:51:54Z
にこちゃん、いつかご飯に行ってあげてーw,にこちゃん、いつかご飯に行ってあげてーw,こと葉,7,2022-10-26T12:23:34Z,2022-10-26T12:23:34Z
ねえ待って少し見ない間にトミーが痩せすぎている………,ねえ待って少し見ない間にトミーが痩せすぎている………,虚無虚無プリン,0,2022-10-26T16:46:03Z,2022-10-26T16:46:03Z
絵文字が溢れるオジ感で…,絵文字が溢れるオジ感で…,みんてぃす,7,2022-10-26T23:07:20Z,2022-10-26T23:07:20Z
おもろい笑,おもろい笑,MILK,2,2022-10-27T02:40:14Z,2022-10-27T02:40:14Z
動画投稿、動画編集、頑張ってください!,動画投稿、動画編集、頑張ってください!,田畑雄二,1,2022-10-26T11:56:07Z,2022-10-26T11:56:07Z
学生時代、女の子からのフリして男子同士がバレンタインにチョコ仕込んだり、ラブレター仕込んだりするやつの最強バージョンだ笑,学生時代、女の子からのフリして男子同士がバレンタインにチョコ仕込んだり、ラブレター仕込んだりするやつの最強バージョンだ笑,きなこ,0,2022-10-26T12:26:36Z,2022-10-26T12:26:36Z
次あたり本当に会わせてみたドッキリとかやりそう,次あたり本当に会わせてみたドッキリとかやりそう,13 norimo,1,2022-10-27T08:35:13Z,2022-10-27T08:35:13Z
LINEについては普段のカンタのLINEを少し丁寧にした、くらいが一番女の子っぽくなるかも今後のドッキリの参考までに,"LINEについては普段のカンタのLINEを少し丁寧にした、くらいが一番女の子っぽくなるかも
今後のドッキリの参考までに",バロン,4,2022-10-26T21:50:46Z,2022-10-26T21:50:46Z
今度は本当にデート出来ましたとか見てみたいなにこちゃんと,今度は本当にデート出来ましたとか見てみたいなにこちゃんと,SAKV,3,2022-10-26T13:27:43Z,2022-10-26T13:27:43Z
こりゃーいい動画だ🤣🤣🤣,こりゃーいい動画だ🤣🤣🤣,あお,2,2022-10-26T21:36:07Z,2022-10-26T21:36:07Z
カンタのLINEおもろ🐸笑,カンタのLINEおもろ🐸笑,のんたん,3,2022-10-27T04:19:53Z,2022-10-27T04:19:53Z
めちゃめちゃロンドンハーツでおもろ😂ブラックメール😂,めちゃめちゃロンドンハーツでおもろ😂ブラックメール😂,kaori,2,2022-10-26T13:38:17Z,2022-10-26T13:38:17Z
めっちゃ可愛い💓💓,めっちゃ可愛い💓💓,だるまちん,1,2022-10-26T12:15:51Z,2022-10-26T12:15:51Z
おもろいシーンいっぱいあったけど「ありがとう」のあとのカエルが1番おもろくて怖かった、、笑,おもろいシーンいっぱいあったけど「ありがとう」のあとのカエルが1番おもろくて怖かった、、笑,なみっコchannel,0,2022-10-27T08:43:52Z,2022-10-27T08:43:52Z
トミーやせた？！？！久しぶりに見たらかっこいい✨✨,トミーやせた？！？！久しぶりに見たらかっこいい✨✨,くん,1,2022-10-26T13:53:08Z,2022-10-26T13:53:08Z
やってることえぐ w😂,やってることえぐ w😂,SAM,4,2022-10-26T11:35:17Z,2022-10-26T11:35:17Z
トミーの前髪あげてる髪型好き！かっこいい,トミーの前髪あげてる髪型好き！かっこいい,okura大好き,0,2022-10-27T10:26:33Z,2022-10-27T10:26:33Z
さすが❗水ボン👍👍👍👍👍👍👍👍👍👍👍👍👍👍,さすが❗水ボン👍👍👍👍👍👍👍👍👍👍👍👍👍👍,スマイルちゃー,3,2022-10-26T11:22:18Z,2022-10-26T11:22:18Z
YouTuber界の田村淳“カンタ”,YouTuber界の田村淳“カンタ”,さるそだ,2,2022-10-26T23:34:24Z,2022-10-26T23:34:24Z
nicoちゃんも嬉しいと思います。win-win☺️,nicoちゃんも嬉しいと思います。win-win☺️,千春,4,2022-10-26T13:04:18Z,2022-10-26T13:04:18Z
やっぱり！😂なんかそうかとおもぅたのよ😂😂ゆっくり見よ！,やっぱり！😂なんかそうかとおもぅたのよ😂😂ゆっくり見よ！,yoh,3,2022-10-26T11:11:51Z,2022-10-26T11:11:51Z
トミーがYouTube始めて一番いいってゆっててめっちゃわろた🙋‍♀️😂,"トミーがYouTube始めて一番いいってゆってて
めっちゃわろた🙋‍♀️😂",たぬきぽこ,2,2022-10-26T13:47:08Z,2022-10-26T13:47:08Z
俺が陰キャすぎるだけだけど、ドッキリ仕掛けられた側に感情移入しちゃって辛くなっちゃうな...もし自分だったら、純粋な恋心抱いてたらちょっと落ち込んじゃいそう...,"俺が陰キャすぎるだけだけど、ドッキリ仕掛けられた側に感情移入しちゃって辛くなっちゃうな...
もし自分だったら、純粋な恋心抱いてたらちょっと落ち込んじゃいそう...",にゃんこ先生,7,2022-10-27T00:52:02Z,2022-10-27T00:52:02Z
カンタくんのLINEがおじさん構文みたいな感じでわろてるww,カンタくんのLINEがおじさん構文みたいな感じでわろてるww,a m,5,2022-10-26T14:24:49Z,2022-10-26T14:25:20Z
めちゃくちゃ口調とかは女子っぽくて逆にびっくりしたあとは絵文字種類そんな多様しなければ成りすませそう,"めちゃくちゃ口調とかは女子っぽくて逆にびっくりした
あとは絵文字種類そんな多様しなければ成りすませそう",バロン,1,2022-10-26T21:56:15Z,2022-10-26T21:56:59Z
カンタかっこいいなぁ,カンタかっこいいなぁ,たろいも,9,2022-10-26T11:29:30Z,2022-10-26T11:29:30Z
人はこうしてハニートラップに引っかかるのだなーって思いました笑,人はこうしてハニートラップに引っかかるのだなーって思いました笑,YUMICO,1,2022-10-26T13:41:49Z,2022-10-26T13:41:49Z
YouTube界のNHKがYouTube界のテレ朝に進化,YouTube界のNHKがYouTube界のテレ朝に進化,れっち,5,2022-10-26T12:51:53Z,2022-10-26T12:51:53Z
にこちゃんが動画みて思いが届きますよーに😊✨,"にこちゃんが動画みて
思いが届きますよーに😊✨",Kotone_Rion,3,2022-10-26T12:54:06Z,2022-10-26T12:54:06Z
インフルエンサー同士だからがちで騙されちゃいますよね！！！これはキツい面白いけど😂,"インフルエンサー同士だから
がちで騙されちゃいますよね！！！

これはキツい面白いけど😂",チーシー,0,2022-10-26T13:37:03Z,2022-10-26T13:37:48Z
むりばかわらった（笑）（笑）（笑）（笑）（笑）,むりばかわらった（笑）（笑）（笑）（笑）（笑）,もにもに,1,2022-10-26T12:54:38Z,2022-10-26T12:54:38Z
いつかほんとにハッピーもやってあげて😭,いつかほんとにハッピーもやってあげて😭,いっチャン,3,2022-10-26T12:49:34Z,2022-10-26T12:49:34Z
概要欄も読んで欲しい!次があるかも😂,"概要欄も読んで欲しい!
次があるかも😂",hidamari312,4,2022-10-26T14:36:44Z,2022-10-26T14:36:44Z
これは500万回超えるでしょ,これは500万回超えるでしょ,Drole S,3,2022-10-26T12:36:51Z,2022-10-26T12:36:51Z
ホントにカンタくんのドッキリなの？😆すごい👏👏👏,ホントにカンタくんのドッキリなの？😆すごい👏👏👏,まおまお,1,2022-10-26T13:29:34Z,2022-10-26T13:29:34Z
トミビジュ良,トミビジュ良,くまさん,4,2022-10-27T03:03:46Z,2022-10-27T03:03:46Z
19:03 「もう1回やろう」白目,19:03 「もう1回やろう」白目,a h,2,2022-10-26T16:24:54Z,2022-10-26T16:25:34Z
トミーそのパーカーの色似合ってる！良い,トミーそのパーカーの色似合ってる！良い,baby bless,2,2022-10-26T11:46:11Z,2022-10-26T11:46:11Z
最高すぎた！,最高すぎた！,27 sakkin,0,2022-10-26T15:47:52Z,2022-10-26T15:47:52Z
最初のニコニコしてる3人の並びが平和でなんか安心したにしてもやっぱりトミーちっちゃい,"最初のニコニコしてる3人の並びが平和でなんか安心した
にしてもやっぱりトミーちっちゃい",はむ,2,2022-10-26T13:12:59Z,2022-10-26T13:12:59Z
いつか会えるわきっと,いつか会えるわきっと,かおり,6,2022-10-26T14:18:18Z,2022-10-26T14:18:36Z
厳選動画にこの動画も入れてほしい😁,厳選動画にこの動画も入れてほしい😁,٩(ü)วまー٩(ü)ว,0,2022-10-26T12:37:18Z,2022-10-26T12:37:18Z
最高最高！！！！,最高最高！！！！,まっくろくろすけ,3,2022-10-26T11:20:28Z,2022-10-26T11:20:28Z
🐸で笑ったw,🐸で笑ったw,ふみたま,4,2022-10-26T16:10:10Z,2022-10-26T16:10:10Z
こら！福岡を罰ゲーム的な存在にするなよ🤣🤣🤣,"こら！
福岡を罰ゲーム的な存在にするなよ🤣🤣🤣",N o n,0,2022-10-26T12:19:40Z,2022-10-26T12:19:40Z
ひさびさメインみた。おもろい,ひさびさメインみた。おもろい,みずき,11,2022-10-26T11:28:38Z,2022-10-26T11:28:38Z
全然関係ないけどトミーパープル系の服にあうな～あんまり着てるイメージない！,全然関係ないけどトミーパープル系の服にあうな～あんまり着てるイメージない！,おさかな温度,2,2022-10-26T12:22:13Z,2022-10-26T12:22:13Z
ニコちゃんご飯いったげてーー😂,ニコちゃんご飯いったげてーー😂,ka ta,3,2022-10-27T03:28:59Z,2022-10-27T03:28:59Z
カンタさんと伊吹さん、、、似てるって思うのはうちだけ？？,カンタさんと伊吹さん、、、似てるって思うのはうちだけ？？,Jap Sis,2,2022-10-26T17:59:08Z,2022-10-26T17:59:08Z
水溜りボンド、福岡何回行くつもりですか😂,"水溜りボンド、福岡
何回行くつもりですか😂",hidamari312,3,2022-10-26T11:20:20Z,2022-10-26T11:20:20Z
カンタのLINEの文面におじさんが垣間見える…笑笑,カンタのLINEの文面におじさんが垣間見える…笑笑,シャンポー,1,2022-10-27T08:37:14Z,2022-10-27T08:37:14Z
女からみたら女が打つLINEじゃないなーって思ってしまう🤣,女からみたら女が打つLINEじゃないなーって思ってしまう🤣,白いねこ,12,2022-10-26T11:31:53Z,2022-10-26T11:31:53Z
ばか笑ったww,ばか笑ったww,とんちゃん,1,2022-10-26T12:07:08Z,2022-10-26T12:07:08Z
顔がガンギマってて草である,顔がガンギマってて草である,ゆっくりお茶々,3,2022-10-26T23:05:37Z,2022-10-26T23:05:37Z
ニコさんすごいね！,ニコさんすごいね！,水ボン,1,2022-10-27T06:42:13Z,2022-10-27T06:42:13Z
ニコちゃん使われてて草,ニコちゃん使われてて草,知香 木山,1,2022-10-26T13:46:16Z,2022-10-26T13:46:16Z
ご飯屋でのとみかん距離近ないありがとう🙇‍♀️,"ご飯屋でのとみかん距離近ない
ありがとう🙇‍♀️",Ask H,2,2022-10-26T11:47:22Z,2022-10-26T11:47:22Z
待ってました！,待ってました！,桃原ゆずき,1,2022-10-26T11:11:16Z,2022-10-26T11:11:16Z
にこちゃんのフリしてLINEするの下手すぎる爆笑,にこちゃんのフリしてLINEするの下手すぎる爆笑,ゆうちゃん,10,2022-10-26T12:57:28Z,2022-10-26T12:57:28Z
9:56～、相方が女の子のフリしてLINEしてるのを見れないトミーよw女装は見せたのにそれはだめなん？w,"9:56～、相方が女の子のフリして
LINEしてるのを見れないトミーよw
女装は見せたのにそれはだめなん？w",Y-RS A-S,10,2022-10-26T11:46:40Z,2022-10-26T11:46:40Z
おもしろいね🐸,おもしろいね🐸,ちゃーはん,0,2022-10-26T11:59:01Z,2022-10-26T11:59:01Z
刮目する度にズームする人物変わるよ👀😊続編も待っています。,"刮目する度にズームする人物変わるよ👀😊
続編も待っています。",千春,0,2022-10-27T10:09:58Z,2022-10-27T10:09:58Z
サムネにこちゃんいてびっくりした💓,サムネにこちゃんいてびっくりした💓,∞むい,3,2022-10-26T13:01:06Z,2022-10-26T13:01:06Z
鬼リピ決定動画🐸,鬼リピ決定動画🐸,yuka *,1,2022-10-26T14:10:03Z,2022-10-26T14:10:03Z
部屋間違え…ではありません！！！残念！！！😭,部屋間違え…ではありません！！！残念！！！😭,ずぅさ,1,2022-10-26T12:36:20Z,2022-10-26T12:36:20Z
悪い先輩たちだな〜（笑）,悪い先輩たちだな〜（笑）,純/ボカロP【オリジナル曲投稿】,2,2022-10-26T13:03:29Z,2022-10-26T13:03:29Z
いや、LINE完全におばさんのLINE文面やん,いや、LINE完全におばさんのLINE文面やん,Titan_mz,2,2022-10-27T01:47:46Z,2022-10-27T01:47:46Z
友達のキャピキャピってなんであんな見ててキツイんだろうな笑,友達のキャピキャピってなんであんな見ててキツイんだろうな笑,めんず,2,2022-10-26T12:17:48Z,2022-10-26T12:17:48Z
10:19〜※一時停止推奨のところ、一時停止してLINE読んだけど、文面がいろいろおかしなことになってる😂💦、　とか笑🤗　とか空いたりしますかー？の後のびっくり顔　とか🤣🤣,"10:19〜※一時停止推奨
のところ、一時停止してLINE読んだけど、文面がいろいろおかしなことになってる😂
💦、　とか
笑🤗　とか
空いたりしますかー？の後のびっくり顔　とか🤣🤣",m f,2,2022-10-26T12:10:10Z,2022-10-26T12:10:10Z
LINEがおじさん構文過ぎて笑った,LINEがおじさん構文過ぎて笑った,舘ひろし,2,2022-10-26T12:26:19Z,2022-10-26T12:26:19Z
人間不信になりそ(￣▽￣;)でも、後後ちゃんと会わせてあげそう！,"人間不信になりそ(￣▽￣;)
でも、後後ちゃんと会わせてあげそう！",うまな,0,2022-10-26T13:57:38Z,2022-10-26T14:02:50Z
平成フラミンゴってグループは見た事ないです！知れて良かったです,"平成フラミンゴってグループは見た事ないです！
知れて良かったです",Fuu,0,2022-10-27T09:02:57Z,2022-10-27T09:02:57Z
