textDisplay,textOriginal,authorDisplayName,likeCount,publishedAt,updatedAt
仲村さん、ほんとユーモアあって好きw,仲村さん、ほんとユーモアあって好きw,グレイシア,2,2022-10-25T12:14:13Z,2022-10-25T12:14:13Z
モハンに言葉かけるの優しすぎる！,モハンに言葉かけるの優しすぎる！,ポンパドール,9,2022-10-25T11:28:00Z,2022-10-25T11:28:00Z
飯田さんのオーディション外ではめちゃめちゃ優しい紳士な性格まじでかっこいいwこんな人が暴走族の総長や審判突き飛ばしてライセンス消されたとは到底思えんw,"飯田さんのオーディション外ではめちゃめちゃ優しい紳士な性格まじでかっこいいw
こんな人が暴走族の総長や審判突き飛ばしてライセンス消されたとは到底思えんw",菅田将暉,4,2022-10-25T14:53:08Z,2022-10-25T14:53:08Z
空くん頑張ってください！海くんの舞台裏インタビューをいつも楽しみにしています😁,"空くん頑張ってください！
海くんの舞台裏インタビューをいつも楽しみにしています😁",さーちん,2,2022-10-26T08:04:46Z,2022-10-26T08:04:46Z
一番彼が成長してると思います！！でいいね！！楽しみすぎてゾクっとしました！！,"一番彼が成長してると思います！！でいいね！！
楽しみすぎてゾクっとしました！！",うまじょうおかず,1,2022-10-25T14:56:55Z,2022-10-25T14:56:55Z
樋口さんと話す時だけかい君腕組みしてて（警戒、距離を置きたい心理）弟子への愛感じる😂,樋口さんと話す時だけかい君腕組みしてて（警戒、距離を置きたい心理）弟子への愛感じる😂,シャクシナ,6,2022-10-25T14:13:08Z,2022-10-25T14:13:08Z
空さんはオーディションではイケイケでしたが対戦相手の樋口さんにしっかり挨拶し格闘家としての雰囲気も出てきましたね。,空さんはオーディションではイケイケでしたが対戦相手の樋口さんにしっかり挨拶し格闘家としての雰囲気も出てきましたね。,0,2,2022-10-25T16:16:19Z,2022-10-25T16:16:19Z
アウトサイダーのお兄さん達も海君の前だと、皆んな笑顔で素が出てホッコリするネ😊,アウトサイダーのお兄さん達も海君の前だと、皆んな笑顔で素が出てホッコリするネ😊,チャコ,4,2022-10-25T15:59:47Z,2022-10-25T15:59:47Z
負けた後のモハン見たら悲しくなってきたわ,負けた後のモハン見たら悲しくなってきたわ,げんき,7,2022-10-25T10:57:22Z,2022-10-25T10:57:22Z
アウトサイダー組雰囲気あってカッコイイし、出てくれて盛り上がりますね！飯田さんもYouTubeで素敵だし、強いから楽しみ😆空くんも日々トレーニングしててパワーマックスの強さに驚いたし、成長見れるの楽しみです✨,"アウトサイダー組雰囲気あってカッコイイし、出てくれて盛り上がりますね！飯田さんもYouTubeで素敵だし、強いから楽しみ😆
空くんも日々トレーニングしててパワーマックスの強さに驚いたし、成長見れるの楽しみです✨",* Rily,1,2022-10-25T13:40:36Z,2022-10-25T13:40:36Z
うわ～～楽しみだ！！！！早く本選がみたいな！！！！,うわ～～楽しみだ！！！！早く本選がみたいな！！！！,メジャー年金,1,2022-10-25T18:18:54Z,2022-10-25T18:18:54Z
朝倉海の立ち位置が1番楽しそう,朝倉海の立ち位置が1番楽しそう,scar lxrd,3,2022-10-25T13:33:44Z,2022-10-25T13:33:44Z
アウトサイダーの方達は知らなかったのですが皆さん大人でかっこいい✨(飯田さんも大人対応)大人でかっこいい方達を応援したくなりました📣,"アウトサイダーの方達は知らなかったのですが
皆さん大人でかっこいい✨(飯田さんも大人対応)
大人でかっこいい方達を応援したくなりました📣",mii UT,3,2022-10-25T10:36:56Z,2022-10-25T10:36:56Z
海くんは選手のオーラをいい意味でかき消す能力もってるね,海くんは選手のオーラをいい意味でかき消す能力もってるね,美しい魔闘家鈴木,4,2022-10-25T12:09:14Z,2022-10-25T12:09:14Z
改めまして海君は素晴らしい人柄ですね！,改めまして海君は素晴らしい人柄ですね！,粉落とし,5,2022-10-25T11:00:13Z,2022-10-25T11:00:13Z
勾配ニキと飯田さんマジで楽しみすぎる,勾配ニキと飯田さんマジで楽しみすぎる,みそしる,3,2022-10-25T14:13:31Z,2022-10-25T14:13:31Z
とにかく空君応援してます今まで格闘技がこんなに素晴らしいものだと知りませんでした！,"とにかく空君応援してます
今まで格闘技がこんなに素晴らしいものだと知りませんでした！",岡本薫,7,2022-10-25T11:08:36Z,2022-10-25T11:08:36Z
回を重ねる毎に「厚み」が出てきましたね😌出場選手みんなカリスマ性があり、同じ男として憧れは正直あります。来年には更なるステージに行きそうで国民誰もが知るくらいメジャーなイベントになりそうな気もしてます。自分も二十代の頃にボクシングを少しだけかじりましたが、続けていたらどうなったのかな？と今になって思います。ブレイキングダウンから益々目が離せませんよね🤭,"回を重ねる毎に「厚み」が出てきましたね😌
出場選手みんなカリスマ性があり、同じ男として憧れは正直あります。
来年には更なるステージに行きそうで国民誰もが知るくらいメジャーなイベントになりそうな気もしてます。
自分も二十代の頃にボクシングを少しだけかじりましたが、続けていたらどうなったのかな？
と今になって思います。
ブレイキングダウンから益々目が離せませんよね🤭",俺はセーラームーンで育った世代,0,2022-10-25T16:37:01Z,2022-10-25T16:37:01Z
バンさんの安定感すげーな,バンさんの安定感すげーな,wwwhayatonjp,1,2022-10-26T01:58:00Z,2022-10-26T01:58:00Z
勾配ニキにとって、樋口さんのように関節技のうまい選手とプロデビュー前に出来るのはめっちゃすごい経験値になるんじゃないかな？,勾配ニキにとって、樋口さんのように関節技のうまい選手とプロデビュー前に出来るのはめっちゃすごい経験値になるんじゃないかな？,UHA UHA,2,2022-10-26T04:58:00Z,2022-10-26T04:58:00Z
海ってめっちゃ強いのに1番優しくていいよなー,海ってめっちゃ強いのに1番優しくていいよなー,りっきーまる,2,2022-10-25T14:55:03Z,2022-10-25T14:55:03Z
海ありがとう☺️めちゃめちゃ楽しみにしてた,海ありがとう☺️めちゃめちゃ楽しみにしてた,あっくんさん,4,2022-10-25T12:09:11Z,2022-10-25T12:09:11Z
海くん、勾配ニキを本気で鍛えて世界に通用する戦士に育てて下さい,海くん、勾配ニキを本気で鍛えて世界に通用する戦士に育てて下さい,夏目浩,6,2022-10-25T10:48:37Z,2022-10-25T10:48:37Z
海さんやさしいし、かっこよすぎ。,海さんやさしいし、かっこよすぎ。,c,3,2022-10-25T12:40:58Z,2022-10-25T12:40:58Z
05:45こんな優しい声で名前呼ばれたら泣きそうになる😂,05:45こんな優しい声で名前呼ばれたら泣きそうになる😂,ありき,6,2022-10-25T12:34:08Z,2022-10-25T12:34:08Z
勾配ニキ絶対勝ってほしい！海さんのためにも😊そして近々恩返しのためにライジンにも出て欲しい海くんの代わりに😊海くんのスポンサー宣伝優し,"勾配ニキ絶対勝ってほしい！
海さんのためにも😊
そして
近々
恩返しのためにライジンにも出て欲しい
海くんの代わりに😊
海くんのスポンサー宣伝優し",みーちゃん♡,2,2022-10-26T05:47:17Z,2022-10-26T05:48:47Z
ブレイキングダウン7がどーなっちゃうのってぐらい今回すげぇ人たくさんでる。,ブレイキングダウン7がどーなっちゃうのってぐらい今回すげぇ人たくさんでる。,RN,5,2022-10-25T10:38:45Z,2022-10-25T10:38:45Z
海くん優しい,海くん優しい,gtw,4,2022-10-25T16:09:57Z,2022-10-25T16:09:57Z
ヒロヤが地元の尊敬してる先輩ぐらい海くんを慕ってるのが目に見えてわかる。,ヒロヤが地元の尊敬してる先輩ぐらい海くんを慕ってるのが目に見えてわかる。,パリピジャパン,3,2022-10-25T14:54:50Z,2022-10-25T14:54:50Z
最後の飯田さん、海さん、優しくて強いコンビカッコいい,最後の飯田さん、海さん、優しくて強いコンビカッコいい,Mamo-chan,3,2022-10-25T12:02:25Z,2022-10-25T12:02:25Z
海くんが誰とも話せるからいいね,海くんが誰とも話せるからいいね,我慢 汁男,9,2022-10-25T13:08:40Z,2022-10-25T13:08:40Z
海くん、優しいんだよなーリングに上がると豹変するけど,"海くん、優しいんだよなー
リングに上がると豹変するけど",エース,6,2022-10-25T13:22:03Z,2022-10-25T13:22:03Z
まじで楽しみ！！,まじで楽しみ！！,oza !!,1,2022-10-25T15:10:55Z,2022-10-25T15:10:55Z
なんかこれ見てるだけでもドキドキ‼,なんかこれ見てるだけでもドキドキ‼,Ar. C,3,2022-10-25T11:45:06Z,2022-10-25T11:45:06Z
勾配ニキ格闘技だけじゃなく中身も強くしっかりしていて好感度爆上がり💯,"勾配ニキ
格闘技だけじゃなく中身も強くしっかりしていて好感度爆上がり💯",テンガ太郎,5,2022-10-25T11:12:45Z,2022-10-25T11:12:45Z
海さんがモハンに声かけてるところで涙出ました,海さんがモハンに声かけてるところで涙出ました,ソーラン節太郎,5,2022-10-26T00:00:30Z,2022-10-26T00:00:30Z
海インタビュー能力高いなw,海インタビュー能力高いなw,ox tour lli3,3,2022-10-26T07:26:06Z,2022-10-26T07:26:06Z
11:03 そらくんのこと愛弟子って書いてて好きすぎる,11:03 そらくんのこと愛弟子って書いてて好きすぎる,しゃけ,1,2022-10-26T13:18:29Z,2022-10-26T13:18:50Z
海さんモハンに優しくて見てて泣きそうになった😭,海さんモハンに優しくて見てて泣きそうになった😭,kimono yumemite,8,2022-10-25T11:21:42Z,2022-10-25T11:21:42Z
ブレィキングダゥン6‼圧倒的メンバー揃ってわくわく止まらんわ。余りにも豪華過ぎてセブンどうなっちゃうのって余計な心配しちゃうで！,ブレィキングダゥン6‼圧倒的メンバー揃ってわくわく止まらんわ。余りにも豪華過ぎてセブンどうなっちゃうのって余計な心配しちゃうで！,白神のツカイ,1,2022-10-25T12:55:36Z,2022-10-25T12:55:36Z
海君、空君負けないようによろしくお願いします、60歳のおっさんだけど朝倉兄弟の大ファンです、だから今空君激アツです。,海君、空君負けないようによろしくお願いします、60歳のおっさんだけど朝倉兄弟の大ファンです、だから今空君激アツです。,143龍,9,2022-10-25T10:38:08Z,2022-10-25T10:38:08Z
アウトサイダーVSブレイキングダウンは漫画の四天王戦みたいな雰囲気あるからすごく楽しみにしてます,アウトサイダーVSブレイキングダウンは漫画の四天王戦みたいな雰囲気あるからすごく楽しみにしてます,kyuty26,3,2022-10-25T11:21:45Z,2022-10-25T11:21:45Z
何回見ても飯田さんカッケー黙る勇気,"何回見ても飯田さんカッケー

黙る勇気",出身はearth,1,2022-10-25T18:06:56Z,2022-10-25T18:06:56Z
モハン選手に対して海君が優しくて感動した🥹,モハン選手に対して海君が優しくて感動した🥹,佐藤慧,1,2022-10-25T14:58:02Z,2022-10-25T14:58:02Z
個人的には前回のオーディションのがおもろかった,個人的には前回のオーディションのがおもろかった,hamilton32,0,2022-10-26T07:35:42Z,2022-10-26T07:35:42Z
ここにもBreaking Timeあるのか！ありがとうございます。,ここにもBreaking Timeあるのか！ありがとうございます。,広瀬邦彦,3,2022-10-25T12:46:48Z,2022-10-25T12:46:48Z
やばい…モハンもらい泣きしそう…歳重ねても若い奴と肩並べて戦う姿カッコいいやんな,"やばい…モハンもらい泣きしそう…
歳重ねても若い奴と肩並べて戦う姿カッコいいやんな",久ま,10,2022-10-25T12:46:25Z,2022-10-25T12:46:25Z
海さんと選手の絡みが好きなので嬉しい,海さんと選手の絡みが好きなので嬉しい,お笑い大好き,115,2022-10-25T10:19:15Z,2022-10-25T10:19:15Z
海くんは空気もよめてしっかりしてるね👍,海くんは空気もよめてしっかりしてるね👍,Shige,2,2022-10-25T23:37:33Z,2022-10-25T23:37:33Z
モハンさんと接しているときの海さん素敵すぎない？,モハンさんと接しているときの海さん素敵すぎない？,かおぴん,8,2022-10-25T11:21:26Z,2022-10-25T11:21:26Z
アウトサイダーの選手とか全然知らなかったから、この動画見て「そんなスゴイ選手達だったんだ」ってなった,アウトサイダーの選手とか全然知らなかったから、この動画見て「そんなスゴイ選手達だったんだ」ってなった,旅する青汁王子,3,2022-10-25T10:39:50Z,2022-10-25T10:39:50Z
飯田さんもけいのすけさんも勾配ニキもめっちゃすき,飯田さんもけいのすけさんも勾配ニキもめっちゃすき,cat black,2,2022-10-25T12:32:34Z,2022-10-25T12:32:34Z
モハンさんに対する海くんの声掛けが優しくてグッときた🥺,モハンさんに対する海くんの声掛けが優しくてグッときた🥺,小見,3,2022-10-26T07:15:12Z,2022-10-26T07:15:12Z
海くんのこの雰囲気でRIZINトップ選手っていうのがかっこいい,海くんのこの雰囲気でRIZINトップ選手っていうのがかっこいい,Dちゃん,13,2022-10-25T12:29:51Z,2022-10-25T12:29:51Z
モハン、泣いちゃってるやん。でも前々から明らかに実力が無くなってきてるから、年齢的な部分もあるだろうが頑張ってほしいな。,"モハン、泣いちゃってるやん。
でも前々から明らかに実力が無くなってきてるから、年齢的な部分もあるだろうが頑張ってほしいな。",san nao,7,2022-10-25T10:29:26Z,2022-10-25T10:29:26Z
勾配ニキは素直で原石みたいで、これからどこまで化けるか楽しみしかない,勾配ニキは素直で原石みたいで、これからどこまで化けるか楽しみしかない,くの,5,2022-10-25T13:00:03Z,2022-10-25T13:00:03Z
かいコミュ力ある,かいコミュ力ある,bbb aaa,2,2022-10-25T14:22:47Z,2022-10-25T14:22:47Z
バン仲村の頭の回転、ワードセンス、話の聞き取りやすさ、アウトローじゃない道に進んでる世界線なら政治家でも名を上げられそうな才能。,バン仲村の頭の回転、ワードセンス、話の聞き取りやすさ、アウトローじゃない道に進んでる世界線なら政治家でも名を上げられそうな才能。,ATS 、,1,2022-10-26T21:33:54Z,2022-10-26T21:33:54Z
急上昇1位おめでとうございます🎉,急上昇1位おめでとうございます🎉,ツベトレ,4,2022-10-26T01:16:04Z,2022-10-26T01:16:04Z
モハンに心配してるあたりほんとにいいひとなんだね,モハンに心配してるあたりほんとにいいひとなんだね,しらすの軟骨,11,2022-10-25T10:37:12Z,2022-10-25T10:37:12Z
ヒロヤくん、応援してます。バラバラにしてください。笑そらくんも勝利を祈ってます！,"ヒロヤくん、応援してます。バラバラにしてください。笑
そらくんも勝利を祈ってます！",Ren Ren,2,2022-10-26T00:06:50Z,2022-10-26T00:06:50Z
モハンを慰める海くん優しすぎて泣けました😢💖,モハンを慰める海くん優しすぎて泣けました😢💖,Yumi Buddha,6,2022-10-25T13:35:15Z,2022-10-25T13:42:01Z
まさかここで負ける模範、でも人間味があって好きだわ,まさかここで負ける模範、でも人間味があって好きだわ,僕達,8,2022-10-25T11:26:22Z,2022-10-25T11:26:22Z
モハンのスパー終わったあとの顔見ると泣けてくる,モハンのスパー終わったあとの顔見ると泣けてくる,サトル,7,2022-10-25T12:08:03Z,2022-10-25T12:08:03Z
飯田さんカッコよすぎて鳥肌立つ笑笑,飯田さんカッコよすぎて鳥肌立つ笑笑,Fagel Walküre,1,2022-10-25T16:19:56Z,2022-10-25T16:19:56Z
海は次男だからアウサイのレジェンドと話す時に末っ子感があって好きなんよな,海は次男だからアウサイのレジェンドと話す時に末っ子感があって好きなんよな,しゅらいむ,11,2022-10-25T10:58:18Z,2022-10-25T10:58:18Z
バン仲村トーク力も凄い！,バン仲村トーク力も凄い！,はる こだ,2,2022-10-25T16:11:51Z,2022-10-25T16:11:51Z
8:12からのエイリアンニキの笑顔めっちゃ好き。啓之輔さんと握手できて嬉しそう😊,8:12からのエイリアンニキの笑顔めっちゃ好き。啓之輔さんと握手できて嬉しそう😊,暇人,12,2022-10-25T10:31:04Z,2022-10-25T10:31:04Z
飯田さんが負けるところが想像できない笑笑,飯田さんが負けるところが想像できない笑笑,とーも,0,2022-10-25T16:39:45Z,2022-10-25T16:39:45Z
飯田も未来も啓之輔も昔不良やった人は大人になったら落ち着いてて雰囲気がかっこいい。,飯田も未来も啓之輔も昔不良やった人は大人になったら落ち着いてて雰囲気がかっこいい。,アマゾン,3,2022-10-25T12:09:35Z,2022-10-25T12:09:35Z
マジ空くんの本気試合楽しみ✨,マジ空くんの本気試合楽しみ✨,フェアリーテイル,7,2022-10-25T10:51:13Z,2022-10-25T10:51:13Z
海君本当に好青年,海君本当に好青年,フクロウ,3,2022-10-25T11:24:14Z,2022-10-25T11:24:14Z
なかむらさんおもろすぎる笑笑,なかむらさんおもろすぎる笑笑,H大地,0,2022-10-26T03:09:01Z,2022-10-26T03:09:01Z
飯田さんがサムネだけで嬉しい,飯田さんがサムネだけで嬉しい,アイエムケー,4,2022-10-25T10:44:14Z,2022-10-25T10:44:14Z
バン中村最高だな😂マジで話し方とかワードセンスが最高,"バン中村最高だな😂
マジで話し方とかワードセンスが最高",円堂守,2,2022-10-25T11:47:18Z,2022-10-25T11:47:18Z
兄貴より兄貴肌な海くん,兄貴より兄貴肌な海くん,牛乳,4,2022-10-25T11:17:28Z,2022-10-25T11:17:28Z
海くん自然にインタビューしてて聞きやすかった。海くん勾配ニキ　サイトウくん2人には絶対勝ってもらいたいですね🔥,海くん自然にインタビューしてて聞きやすかった。海くん勾配ニキ　サイトウくん2人には絶対勝ってもらいたいですね🔥,サナ,34,2022-10-25T10:25:27Z,2022-10-25T10:25:27Z
海くん癒される❤かっこいい優しい❤大好きです❤,海くん癒される❤かっこいい優しい❤大好きです❤,MF.10,3,2022-10-25T12:19:51Z,2022-10-25T12:19:51Z
バンさんのいい質問するねえが、張りがなくてとっさに出た感がおもろい,バンさんのいい質問するねえが、張りがなくてとっさに出た感がおもろい,シンチャンネル,5,2022-10-25T12:03:39Z,2022-10-25T12:03:39Z
バンさん一人称が「仲村」なの可愛すぎる,バンさん一人称が「仲村」なの可愛すぎる,ばっどなっつ,8,2022-10-25T13:32:43Z,2022-10-25T13:32:43Z
いい質問するね〜便利すぎる笑笑,いい質問するね〜便利すぎる笑笑,ワニ山さん🐊,1,2022-10-25T20:05:04Z,2022-10-25T20:05:04Z
勾配ニキって無駄に煽ったりするの少なくて好感持てる本当に格闘技好きそうな感じがあっていいなー！,"勾配ニキって無駄に煽ったりするの少なくて好感持てる
本当に格闘技好きそうな感じがあっていいなー！",・ぽんぽんポンポコ,2,2022-10-26T00:24:20Z,2022-10-26T00:24:20Z
醤油回収おもろすぎ😂,醤油回収おもろすぎ😂,mona,4,2022-10-25T10:54:35Z,2022-10-25T10:54:35Z
飯田さん心強すぎる笑,飯田さん心強すぎる笑,ルーシー,2,2022-10-25T11:36:05Z,2022-10-25T11:36:05Z
ブレイキングダウン観てる側もワクワクしてしまうからいいわ〜,ブレイキングダウン観てる側もワクワクしてしまうからいいわ〜,未来の彼方,0,2022-10-25T11:59:36Z,2022-10-25T12:00:17Z
賑やかな裏側普通に見せちゃうw,賑やかな裏側普通に見せちゃうw,akimあっきー,1,2022-10-25T12:14:45Z,2022-10-25T12:14:45Z
この中の誰よりも一番リングに上がると狂気になる男、朝倉海！,この中の誰よりも一番リングに上がると狂気になる男、朝倉海！,太郎山,2,2022-10-25T23:41:03Z,2022-10-25T23:41:03Z
空くん頑張れー！！,空くん頑張れー！！,山田さん,6,2022-10-25T12:52:36Z,2022-10-25T12:52:36Z
勾配ニキ、みんな黙ってるなか果敢に挑む男気マジでかっこいいから応援します！,勾配ニキ、みんな黙ってるなか果敢に挑む男気マジでかっこいいから応援します！,天翔,1,2022-10-26T13:14:56Z,2022-10-26T13:14:56Z
楽しみすぎる♪,楽しみすぎる♪,九城伸明,0,2022-10-26T09:55:44Z,2022-10-26T09:55:44Z
けいのすけと飯田の試合は1分じゃもったいない！3分3ラウンドでやって欲しい❗,けいのすけと飯田の試合は1分じゃもったいない！3分3ラウンドでやって欲しい❗,H HH,6,2022-10-25T10:36:10Z,2022-10-25T10:36:10Z
海君お弟子さんの試合決まりましたね勝って欲しいですね！,"海君お弟子さんの試合決まりましたね
勝って欲しいですね！",あまー,7,2022-10-25T10:37:55Z,2022-10-25T10:37:55Z
2:30 西谷くんに通訳させるの笑った,2:30 西谷くんに通訳させるの笑った,ゆな,3,2022-10-25T15:19:32Z,2022-10-25T15:19:32Z
勾配にき、良かったねぇ海くんのもとで頑張って！,"勾配にき、良かったねぇ
海くんのもとで頑張って！",もーもー,5,2022-10-25T13:16:20Z,2022-10-25T13:16:20Z
イイ対戦ばかりで楽しみですね‼️海君サイドの裏側の方が、おもしろい,"イイ対戦ばかりで楽しみですね‼️
海君サイドの裏側の方が、おもしろい",武寛金井,1,2022-10-25T13:51:54Z,2022-10-25T13:51:54Z
モハン泣いてるの見て自分も泣きそうなった😭😭次のチャンスで頑張ってね！！,モハン泣いてるの見て自分も泣きそうなった😭😭次のチャンスで頑張ってね！！,あ,0,2022-10-26T15:02:36Z,2022-10-26T15:02:36Z
ブレイクタイムの勾配ニキの登場演技感満載でおもろい笑,ブレイクタイムの勾配ニキの登場演技感満載でおもろい笑,びびのびー,2,2022-10-25T10:58:39Z,2022-10-25T10:58:39Z
今回、特に面白そう！^ ^,今回、特に面白そう！^ ^,Marcy,0,2022-10-26T11:59:07Z,2022-10-26T11:59:07Z
海くんの『モハンどーした』『モハンー』って言葉にモハンも泣きそうになってたね😭,海くんの『モハンどーした』『モハンー』って言葉にモハンも泣きそうになってたね😭,アン,3,2022-10-25T15:24:56Z,2022-10-25T15:24:56Z
弟子を大事にしている海師匠がかっこいい！！,弟子を大事にしている海師匠がかっこいい！！,田中智典,4,2022-10-25T17:07:44Z,2022-10-25T17:07:44Z
海くんが言ってるんじゃ空くんかなり期待できそうだ,海くんが言ってるんじゃ空くんかなり期待できそうだ,から揚げ,2,2022-10-25T13:56:00Z,2022-10-25T13:56:00Z
普通にインタビューうまいですよね。。勾配ニキ勝ってほしい,普通にインタビューうまいですよね。。勾配ニキ勝ってほしい,たた,2,2022-10-25T13:42:25Z,2022-10-25T13:42:25Z
空って呼んでるの見ただけでジーンとしたスター選手が裏方って贅沢過ぎる！楽しみなカードがたくさんあってBD最高！大きい箱でチケット数万円〜になってほしい,"空って呼んでるの見ただけでジーンとした
スター選手が裏方って贅沢過ぎる！
楽しみなカードがたくさんあってBD最高！
大きい箱でチケット数万円〜になってほしい",ぴーランド,0,2022-10-25T15:42:52Z,2022-10-25T15:42:52Z
海ちゃんの細やかな気遣い素敵☺️🙌みくるの真の優しさも👍ほんまに二人に救われた人いっぱいいるやろな✨️,"海ちゃんの細やかな気遣い素敵☺️🙌
みくるの真の優しさも👍ほんまに二人に救われた人いっぱいいるやろな✨️",誠爽花,4,2022-10-25T13:54:02Z,2022-10-25T13:54:02Z
海くんがそら！って呼んでるのいいな！！✨,海くんがそら！って呼んでるのいいな！！✨,岡本健太,10,2022-10-25T11:11:32Z,2022-10-25T11:11:32Z
勾配ニキ本当好き。主人公感ある！,勾配ニキ本当好き。主人公感ある！,よあ,7,2022-10-25T10:46:36Z,2022-10-25T10:46:36Z
