textDisplay,textOriginal,authorDisplayName,likeCount,publishedAt,updatedAt
ちょっと怖めのお姉さん達って感じで好きです,ちょっと怖めのお姉さん達って感じで好きです,Black,0,2022-10-26T15:52:14Z,2022-10-26T15:52:14Z
治安悪いちぇりーぺぇ良すぎんだろ…！,治安悪いちぇりーぺぇ良すぎんだろ…！,むぎ,3,2022-10-26T11:04:54Z,2022-10-26T11:04:54Z
治安の悪いちぇりーぺぇ最高かよ……,治安の悪いちぇりーぺぇ最高かよ……,荒垣停止,2,2022-10-26T12:43:52Z,2022-10-26T12:43:52Z
かっこいい...,かっこいい...,来世ネコ,1,2022-10-27T05:24:19Z,2022-10-27T05:24:19Z
アンジュのねぇんだよボイスたまらん,アンジュのねぇんだよボイスたまらん,【豆太】華布,6,2022-10-26T11:02:32Z,2022-10-26T11:02:32Z
1:47 ここの「ねぇ」が好きすぎる,1:47 ここの「ねぇ」が好きすぎる,ぱんだ,1,2022-10-26T13:42:52Z,2022-10-26T13:42:52Z
記憶を無くす前に撮れた一枚と書くとエモくなるが……,記憶を無くす前に撮れた一枚と書くとエモくなるが……,ムキムキ柴犬,1,2022-10-26T12:51:57Z,2022-10-26T12:51:57Z
かっこいいい💖,かっこいいい💖,ri k,0,2022-10-26T23:13:00Z,2022-10-26T23:13:00Z
アンジュ、おニュイ、おめえらの女にしてくれかっこよすぎる,"アンジュ、おニュイ、おめえらの女にしてくれ
かっこよすぎる",過去鯖,2,2022-10-27T00:58:52Z,2022-10-27T00:58:52Z
かっこいい女性最高,かっこいい女性最高,ワニ ワニ,0,2022-10-27T10:58:42Z,2022-10-27T10:58:42Z
低音かっけぇ…,低音かっけぇ…,しめさば,1,2022-10-26T12:52:21Z,2022-10-26T12:52:21Z
好きでしかない,好きでしかない,ma yo,0,2022-10-26T18:10:23Z,2022-10-26T18:10:23Z
いかんだろ最高すぎ,いかんだろ最高すぎ,いーな,1,2022-10-26T14:14:21Z,2022-10-26T14:14:21Z
とてもよいものでした,とてもよいものでした,シスターさん,1,2022-10-26T14:08:04Z,2022-10-26T14:08:04Z
これは百人斬りナイトバタフライですわ,これは百人斬りナイトバタフライですわ,U馬 SS,3,2022-10-26T13:54:20Z,2022-10-26T13:54:20Z
このアンジュは酒こぼさなそう！！！！！！,このアンジュは酒こぼさなそう！！！！！！,あたまかなや,6,2022-10-26T11:04:00Z,2022-10-26T11:04:00Z
色気を感じる素晴らしい作品でしたまったく関係ないがアンジュの鼻が天空のエスカフローネみたいな尖り鼻に空目してしまったw,"色気を感じる素晴らしい作品でした
まったく関係ないがアンジュの鼻が天空のエスカフローネみたいな尖り鼻に空目してしまったw",片翼の天使,0,2022-10-26T13:42:21Z,2022-10-26T13:42:21Z
安易なイケボは俺に効く…我が人生に一生の悔いなし…,"安易なイケボは俺に効く…
我が人生に一生の悔いなし…",Khimaira,1,2022-10-26T12:59:26Z,2022-10-26T12:59:26Z
かっこいいが渋滞している…！！,かっこいいが渋滞している…！！,からあげ,1,2022-10-26T17:01:04Z,2022-10-26T17:01:04Z
すべてのちぇりーぺぇにありがと,すべてのちぇりーぺぇにありがと,氷室,3,2022-10-26T11:16:16Z,2022-10-26T11:16:16Z
プロの声優さんだったり、某ホストさんだったり色々な人のコールボーイ聴いてきましたが、また新しいコールボーイを聴けて嬉しいです。お二人が歌われるとまた違った歌詞の受け取り方が出来て凄く素敵でした！,"プロの声優さんだったり、某ホストさんだったり色々な人のコールボーイ聴いてきましたが、
また新しいコールボーイを聴けて嬉しいです。
お二人が歌われるとまた違った歌詞の受け取り方が出来て凄く素敵でした！",ホープきゅん,4,2022-10-26T12:20:41Z,2022-10-26T12:20:41Z
かっこいいな！って思った次の瞬間には２人のを見比べてしまってすまん。,かっこいいな！って思った次の瞬間には２人のを見比べてしまってすまん。,虹鱒鷺,3,2022-10-25T22:09:39Z,2022-10-25T22:09:39Z
"Absolutely powerful cover, love it!","Absolutely powerful cover, love it!",FoxP,8,2022-10-26T11:40:11Z,2022-10-26T11:40:11Z
1:06くそがよが好きすぎる。,"1:06
くそがよが好きすぎる。",たよし暇人,2,2022-10-26T13:01:00Z,2022-10-26T13:01:55Z
サムネで尊死したし歌で尊死するだろうし余韻でもう一回死ねるありがとう……ありがとう……,"サムネで尊死したし歌で尊死するだろうし余韻でもう一回死ねる
ありがとう……ありがとう……",鮫肌ガブリアス,5,2022-10-25T22:28:02Z,2022-10-25T22:28:02Z
エロスとかっこよさが共存してるのやばい,エロスとかっこよさが共存してるのやばい,シグ大好きなゆっち,3,2022-10-26T11:54:34Z,2022-10-26T11:54:34Z
丁度飲み過ぎて昨日の記憶ないのでとても助かる,丁度飲み過ぎて昨日の記憶ないのでとても助かる,ቻンቻンハメ太郎,0,2022-10-26T17:33:36Z,2022-10-26T17:33:36Z
0:52何故誰も触れてないんだ！！ここのﾝｼﾞｭの「あぁ」良くない！？！？えぐいしぬ,"0:52
何故誰も触れてないんだ！！
ここのﾝｼﾞｭの「あぁ」良くない！？！？
えぐいしぬ",8mi2- 蜂蜜,7,2022-10-26T13:06:41Z,2022-10-26T13:06:41Z
こっちの顔も良いな……,こっちの顔も良いな……,Black,2,2022-10-26T13:56:27Z,2022-10-26T13:56:27Z
ちぇりーぺぇでカッコいい曲はズルじゃん…,ちぇりーぺぇでカッコいい曲はズルじゃん…,ともとも,2,2022-10-25T14:47:11Z,2022-10-25T14:47:11Z
ゲロ吐くほど好き,ゲロ吐くほど好き,れんがもち,0,2022-10-26T14:59:46Z,2022-10-26T14:59:46Z
このバーの店員になって2人に絡まれたい,このバーの店員になって2人に絡まれたい,ショウ。,2,2022-10-26T12:14:03Z,2022-10-26T12:14:03Z
ニュイ×アンジュヤバいどうしようありがとうございますありがとう…,ニュイ×アンジュヤバいどうしようありがとうございますありがとう…,天空山田返し,2,2022-10-26T11:02:55Z,2022-10-26T11:02:55Z
2:15 悪意のあるカットインすき,2:15 悪意のあるカットインすき,もろこし,9,2022-10-26T11:12:02Z,2022-10-26T11:12:02Z
聴くと『やべぇ』『かっえぇ』しか語彙力が残ってないんだか？どうすれば良い？,"聴くと『やべぇ』『かっえぇ』しか語彙力が残ってないんだか？
どうすれば良い？",タナイ,2,2022-10-26T11:50:31Z,2022-10-26T11:50:31Z
全然こんな素敵なイラストに大して言うことでは無いんだけどやっぱり壁なんだなぁ……,"全然こんな素敵なイラストに大して言うことでは無いんだけど


やっぱり壁なんだなぁ……",ちゃみ,1,2022-10-26T12:00:30Z,2022-10-26T12:00:30Z
イラストがえっっっっっっっっっどすぎて無音でも楽しめてしまった……けど、イヤホンも探してこよう…,"イラストが
えっっっっっっっっっ

どすぎて無音でも楽しめてしまった……けど、イヤホンも探してこよう…",RRR,2,2022-10-26T12:10:31Z,2022-10-26T12:10:31Z
いい女過ぎる　かっこいい,いい女過ぎる　かっこいい,kurokame / 黒光の亀,2,2022-10-27T00:56:40Z,2022-10-27T00:56:40Z
かっこいいて！！！、,かっこいいて！！！、,蒼,1,2022-10-26T14:15:35Z,2022-10-26T14:15:35Z
待っって軽率にタップしたらアンジュさんの女になりそう声が良すぎる…,"待っって軽率にタップしたらアンジュさんの女になりそう
声が良すぎる…",ふもふも,3,2022-10-26T12:29:59Z,2022-10-26T12:29:59Z
かぁっこよ,かぁっこよ,神鳥谷 詠(ヒトトノヤ レイ),2,2022-10-26T11:08:31Z,2022-10-26T11:08:31Z
かっこいい‥,かっこいい‥,shin778,1,2022-10-27T08:43:59Z,2022-10-27T08:43:59Z
Oh dang both looking smoking hot and dangerous.. Heh. Nice sings,Oh dang both looking smoking hot and dangerous.. Heh. Nice sings,Ashchi Salleh,3,2022-10-26T14:11:19Z,2022-10-26T14:11:19Z
競馬とウマ娘とRPGが好きなただのカプ厨じゃなかったんだ…,競馬とウマ娘とRPGが好きなただのカプ厨じゃなかったんだ…,SiU,2,2022-10-26T13:55:51Z,2022-10-26T13:55:51Z
これは時空の喧嘩屋キル,これは時空の喧嘩屋キル,かんだむ,0,2022-10-26T14:28:52Z,2022-10-26T14:28:52Z
素晴らしい治安の悪さだった...！！！,素晴らしい治安の悪さだった...！！！,佐久間有限,2,2022-10-26T11:04:06Z,2022-10-26T11:04:06Z
何回聞いても「オマエだ馬鹿」で鳥肌立つ,何回聞いても「オマエだ馬鹿」で鳥肌立つ,よしこ,0,2022-10-26T17:13:14Z,2022-10-26T17:13:14Z
これは100人斬り,これは100人斬り,EAST-Ⅴ,0,2022-10-26T20:28:16Z,2022-10-26T20:28:16Z
おいおいお前だ馬鹿ってとこで鳥肌立っちゃったじゃんか、、扉開くぞ？？,"おいおい
お前だ馬鹿ってとこで鳥肌立っちゃったじゃんか、、
扉開くぞ？？",えーりん,1,2022-10-27T05:19:13Z,2022-10-27T05:19:13Z
サムネで分かる尊死確定,サムネで分かる尊死確定,ちゃま,2,2022-10-26T10:56:08Z,2022-10-26T10:56:22Z
あれこの曲めっちゃリピートしてた時あったよななんでだっけって思ってたらあれや。にじさんじの引退した久遠千歳の動画無限にリピートしてたんだったわ懐かしくて泣けてきた。,"あれこの曲めっちゃリピートしてた時あったよななんでだっけって思ってたらあれや。
にじさんじの引退した久遠千歳の動画無限にリピートしてたんだったわ懐かしくて泣けてきた。",オギ,0,2022-10-26T14:20:31Z,2022-10-26T14:20:31Z
ちょっとアンジュがかっこよすぎて辛いんやが,ちょっとアンジュがかっこよすぎて辛いんやが,内田信和,3,2022-10-27T06:46:07Z,2022-10-27T06:46:07Z
かわいいかっこいい 愛している,かわいいかっこいい 愛している,もぶゔ,0,2022-10-26T14:13:37Z,2022-10-26T14:13:37Z
最近不破さんのコールボーイで初めて聞いたんやけど、その直後に二人のが聞けるなんて…運命かもしれん。だから俺と結婚しようアンジュ,最近不破さんのコールボーイで初めて聞いたんやけど、その直後に二人のが聞けるなんて…運命かもしれん。だから俺と結婚しようアンジュ,飼い慣らされたFCL,6,2022-10-26T10:58:23Z,2022-10-26T10:58:40Z
ア！好き😭😭😭,ア！好き😭😭😭,ℳ,1,2022-10-26T14:11:36Z,2022-10-26T14:11:36Z
思ってたよりマジで無かったけどなんでちゃんと色気あるんだろうな・・・それにしても2人のお前だバカ、助かりました,"思ってたよりマジで無かったけどなんでちゃんと色気あるんだろうな・・・
それにしても2人のお前だバカ、助かりました",らねちゃ,0,2022-10-26T14:24:41Z,2022-10-26T14:24:41Z
これはナイトバタフライ,これはナイトバタフライ,レイ,2,2022-10-26T14:41:48Z,2022-10-26T14:41:48Z
格好良くパイパイしてて草ちぇりーぺぇ最高好き,"格好良くパイパイしてて草
ちぇりーぺぇ最高好き",まるお,2,2022-10-26T11:08:39Z,2022-10-26T11:08:39Z
コールボーイって男性(某メッシュのホスト)が歌ってるイメージが強かったけど、女性の低音ボイスだとそれとはまた別の魅力があって好き,コールボーイって男性(某メッシュのホスト)が歌ってるイメージが強かったけど、女性の低音ボイスだとそれとはまた別の魅力があって好き,鶏唐揚げ,3,2022-10-26T14:24:50Z,2022-10-26T14:27:08Z
確かに元よりちぇりーぺぇの関係には悪友のそれを感じてたよ？でもまさかこんな治安悪わるでくるとは思わんやん…、破壊力えぐいよ……。,"確かに元よりちぇりーぺぇの関係には悪友のそれを感じてたよ？
でもまさかこんな治安悪わるでくるとは
思わんやん…、破壊力えぐいよ……。",しらいとさん,6,2022-10-25T15:29:54Z,2022-10-25T15:29:54Z
二人はそういうことをする立場じゃなくて毎日のように同じバーで同じもの頼んで遠くからそういう人たちを笑ってそう。,二人はそういうことをする立場じゃなくて毎日のように同じバーで同じもの頼んで遠くからそういう人たちを笑ってそう。,モンゴル 襲来,1,2022-10-26T11:45:13Z,2022-10-26T11:45:13Z
まじで、ありがとうございます。,まじで、ありがとうございます。,やまだ,1,2022-10-27T00:57:13Z,2022-10-27T00:57:13Z
イケメンすぎて更に惚れた呑みいく？,イケメンすぎて更に惚れた呑みいく？,あーる.,2,2022-10-26T14:18:37Z,2022-10-26T14:18:37Z
最高,最高,いづみん,1,2022-10-26T11:19:07Z,2022-10-26T11:19:07Z
コールガールも待ってます🥺🥺🥺,コールガールも待ってます🥺🥺🥺,くるりぁ,0,2022-10-26T14:41:16Z,2022-10-26T14:41:16Z
これ毎日聞いたら女の子になれそう,これ毎日聞いたら女の子になれそう,pepe,0,2022-10-26T20:54:41Z,2022-10-26T20:54:41Z
なんだろ、ただの低音でなくって、低さの中に艶やかさ？というか、ちょっと悪い大人の女性というか、夜中のネオンが光る治安が悪そうな街にいそうな声してる(),なんだろ、ただの低音でなくって、低さの中に艶やかさ？というか、ちょっと悪い大人の女性というか、夜中のネオンが光る治安が悪そうな街にいそうな声してる(),夜刀神アキラ,1,2022-10-26T15:05:13Z,2022-10-26T15:05:13Z
理想のナイトバタフライや,理想のナイトバタフライや,改名丸。,3,2022-10-26T11:36:24Z,2022-10-26T11:36:24Z
ソシエのうりゃ！とアンジュのクソがよぉ！が最高すぎる。てか、酒飲みたくならん？,ソシエのうりゃ！とアンジュのクソがよぉ！が最高すぎる。てか、酒飲みたくならん？,ねこを。,0,2022-10-26T17:04:25Z,2022-10-26T17:04:25Z
超絶かっこいいけど、実際バーでこの二人に合ったら死ぬほどウザ絡みされそうw,超絶かっこいいけど、実際バーでこの二人に合ったら死ぬほどウザ絡みされそうw,理想の眼鏡,7,2022-10-27T04:03:45Z,2022-10-27T04:03:45Z
これは百戦錬磨のナイトバタフライ🧈🦋,これは百戦錬磨のナイトバタフライ🧈🦋,不破ゆうVtuber準備中,2,2022-10-26T11:41:54Z,2022-10-26T11:41:54Z
激アツだぁ。。。,激アツだぁ。。。,がぶりえる,0,2022-10-26T21:44:33Z,2022-10-26T21:44:33Z
ベルアンラジオからずっっっっっっっっっっっと待ってたぞアンジュ,ベルアンラジオからずっっっっっっっっっっっと待ってたぞアンジュ,こーはく,1,2022-10-26T11:48:19Z,2022-10-26T11:48:19Z
にじさんじの女性ライバーが男性ライバーよりかっこよくなるのは何故なんだ？,にじさんじの女性ライバーが男性ライバーよりかっこよくなるのは何故なんだ？,プリンチップ,3,2022-10-26T15:26:37Z,2022-10-26T15:26:37Z
生きててよかった,生きててよかった,熱中症熱中症,2,2022-10-26T10:23:40Z,2022-10-26T10:23:40Z
久遠の歌ってみたもあるからか、ライバーさんたちもどこか避けちゃってるのかなと思ってたけどまさかこの2人のが聴けるとは…！,久遠の歌ってみたもあるからか、ライバーさんたちもどこか避けちゃってるのかなと思ってたけどまさかこの2人のが聴けるとは…！,ぴぴん,1,2022-10-27T06:14:11Z,2022-10-27T06:14:11Z
こんなにエロくみえるアンジュは存在しないはずものだ…このお姉さんはナイト・バタフライですね。,こんなにエロくみえるアンジュは存在しないはずものだ…このお姉さんはナイト・バタフライですね。,アンジュリウムがないせいで燃え尽きたや真っ白な灰になったAlarde枢機卿,7,2022-10-25T18:29:32Z,2022-10-25T18:29:32Z
2人にお持ち帰りされたい……ﾊｧ,2人にお持ち帰りされたい……ﾊｧ,03,2,2022-10-26T12:23:17Z,2022-10-26T12:23:17Z
ありがとう……ありがとう😭,ありがとう……ありがとう😭,ブブザウルス,1,2022-10-27T10:53:27Z,2022-10-27T10:53:27Z
あ゛あ゛あ゛あ゛がっ゛ご い゛い゛ぃ゛ぃ゛！！！,"あ゛あ゛あ゛あ゛
がっ゛ご い゛い゛ぃ゛ぃ゛！！！",DNAとDHA,2,2022-10-26T12:45:39Z,2022-10-26T12:45:39Z
ありがとうそれしか言葉が見つかりません,"ありがとう
それしか言葉が見つかりません",はくろう,5,2022-10-25T14:33:58Z,2022-10-25T14:33:58Z
2:42   「お前だ馬鹿」のところに不覚にもキュンとしてしまった…,2:42   「お前だ馬鹿」のところに不覚にもキュンとしてしまった…,たにぃ丸,3,2022-10-26T11:35:42Z,2022-10-26T11:35:42Z
ありがとうございます！,ありがとうございます！,小志,1,2022-10-26T13:01:48Z,2022-10-26T13:01:48Z
アンジュが盛ってないだとっっっっ！,アンジュが盛ってないだとっっっっ！,haaa,1,2022-10-26T11:45:31Z,2022-10-26T11:45:31Z
イヤホンで聞いたら治安の悪い声で罵られて目覚めかけたこのお姉さんたちにナンパしてけちょんけちょんにされて帰宅したい、強い女好…,"イヤホンで聞いたら治安の悪い声で罵られて目覚めかけた
このお姉さんたちにナンパしてけちょんけちょんにされて帰宅したい、強い女好…",あたりめ,2,2022-10-26T12:51:56Z,2022-10-26T12:51:56Z
2人の低音だいすき🥲🫶🫶てか服もどタイプすぎてる🫠,"2人の低音だいすき🥲🫶🫶
てか服もどタイプすぎてる🫠",むつき*,2,2022-10-26T13:35:01Z,2022-10-26T13:37:47Z
(  ･᷄ㅂ･᷅ )俺の中で歌ってみたシリーズで全メンバー中Ｎｏ．1になった,(  ･᷄ㅂ･᷅ )俺の中で歌ってみたシリーズで全メンバー中Ｎｏ．1になった,しなずの,1,2022-10-26T13:13:24Z,2022-10-26T13:13:24Z
イラストかつけぇー！,イラストかつけぇー！,りく,1,2022-10-26T14:42:45Z,2022-10-26T14:42:45Z
アンジュのクソがよめちゃくちゃかっこよくて辛いんだが　2:07 2:15,アンジュのクソがよめちゃくちゃかっこよくて辛いんだが　2:07 2:15,ﾈｺｻｼﾐ,1,2022-10-26T22:18:25Z,2022-10-26T22:18:25Z
初手ソシエに落とされて、アンジュに堕とされた,初手ソシエに落とされて、アンジュに堕とされた,むげん,0,2022-10-26T14:55:12Z,2022-10-26T14:55:12Z
これが欲しかったんだろ？例の部分と歌詞です。0:57 ⚖️「ねぇんだよ！」1:05 🎃「クソがよ！」1:34 🎃「結局ね」1:59 🎃「ねぇんだよ！」2:08 ⚖️「クソがよ！」2:50 🎃「ねぇんだよ！」2:59 ⚖️「クソがよ！」0:00 0:000:15繁華街地下場末のバーはボンクラ酔いどれ自称非凡人使い捨てしたいクズとされたい輩にて大繁盛0:24混ぜ物多めの安価なバーボン半端なアンタが良く似合う酔ったら同じ事なんてのがお決まりなんだけど0:32人は孤独を殺すため虚しいをもどすため酒を飲むんだ金も時間も肝臓もなぁ何でもやるからさ二人でいよう？0:52良いとか悪いとか言うそれ以前に俺には一切記憶がねぇんだよ明日もまた猛弁解1:01飲んだら明日に響くと言うけど飲まなきゃその明日すらもねぇんだよ嫌になるぜもう一杯don't stop　構わずにもう一杯1:17明日の行方も今夜の便も全部無くして尚大繁盛プライドと理性捨てりゃ愛を偽るのは簡単だ1:26「しー」人差し指で黙らして以下省略午前2時結局いつもの事と言やまぁお終いなんだけど1:34人は誰もが偽善者さ優しい嘘を餌に狩りをするんだ血酒　火の酒　苦い酒ねぇ優しくするからさ一人は嫌だ1:54愛だの恋だのやんやと騒ぐが酔ったら結局誰でもいいんだよ荒ぶりて暴言タイム2:03その「誰でも」すら俺は選ばれず泣くのもダセェし酒を浴びんだよ嫌になるぜもう一杯can't stop　意味も無くもう一杯2:26馬鹿と煙が梯子酒登る様はさながら蜘蛛の糸2:34何処もかしこもクソだらけってオイ　一番クソなのはオマエだ馬鹿2:45良いとか悪いとか言うそれ以前に俺には一切記憶がねぇんだよ嫌になるぜもう限界2:55飲んでもないのに難なく生きてるアンタの方こそ飲まれてるんだよ嫌になるぜもう一杯won't stop　死ぬ前に一杯0:00 0:00,"これが欲しかったんだろ？
例の部分と歌詞です。

0:57 ⚖️「ねぇんだよ！」
1:05 🎃「クソがよ！」

1:34 🎃「結局ね」

1:59 🎃「ねぇんだよ！」
2:08 ⚖️「クソがよ！」

2:50 🎃「ねぇんだよ！」
2:59 ⚖️「クソがよ！」

0:00 0:00

0:15
繁華街地下場末のバーは
ボンクラ酔いどれ自称非凡人
使い捨てしたいクズと
されたい輩にて大繁盛

0:24
混ぜ物多めの安価なバーボン
半端なアンタが良く似合う
酔ったら同じ事
なんてのがお決まりなんだけど

0:32
人は孤独を殺すため
虚しいをもどすため酒を飲むんだ
金も時間も肝臓も
なぁ何でもやるからさ
二人でいよう？

0:52
良いとか悪いとか言うそれ以前に
俺には一切記憶がねぇんだよ
明日もまた猛弁解
1:01
飲んだら明日に響くと言うけど
飲まなきゃその明日すらもねぇんだよ
嫌になるぜもう一杯
don't stop　構わずにもう一杯

1:17
明日の行方も今夜の便も
全部無くして尚大繁盛
プライドと理性捨てりゃ
愛を偽るのは簡単だ

1:26
「しー」人差し指で黙らして
以下省略午前2時
結局いつもの事
と言やまぁお終いなんだけど

1:34
人は誰もが偽善者さ
優しい嘘を餌に狩りをするんだ
血酒　火の酒　苦い酒
ねぇ優しくするからさ
一人は嫌だ

1:54
愛だの恋だのやんやと騒ぐが
酔ったら結局誰でもいいんだよ
荒ぶりて暴言タイム
2:03
その「誰でも」すら俺は選ばれず
泣くのもダセェし酒を浴びんだよ
嫌になるぜもう一杯
can't stop　意味も無くもう一杯

2:26
馬鹿と煙が梯子酒
登る様はさながら蜘蛛の糸
2:34
何処もかしこもクソだらけ
ってオイ　一番クソなのは
オマエだ馬鹿

2:45
良いとか悪いとか言うそれ以前に
俺には一切記憶がねぇんだよ
嫌になるぜもう限界
2:55
飲んでもないのに難なく生きてる
アンタの方こそ飲まれてるんだよ
嫌になるぜもう一杯
won't stop　死ぬ前に一杯


0:00 0:00",なるか,7,2022-10-26T12:17:38Z,2022-10-26T12:17:38Z
0:37アンジュ推しワイ、唐突に死亡,"0:37
アンジュ推しワイ、唐突に死亡",ぽぽふ,4,2022-10-26T11:45:07Z,2022-10-26T11:45:07Z
1億回聞きます🤓,1億回聞きます🤓,サンシャイン花澤,0,2022-10-26T14:01:03Z,2022-10-26T14:01:03Z
ちぇりーぺぇ、どこまでオタクの思考を読み取ってるんだ…？,ちぇりーぺぇ、どこまでオタクの思考を読み取ってるんだ…？,ほしのむこう,2,2022-10-26T10:59:50Z,2022-10-26T10:59:50Z
愛してる,愛してる,クリスチーネ殴田,0,2022-10-26T13:57:53Z,2022-10-26T13:57:53Z
助かるー,助かるー,のの,0,2022-10-26T14:18:57Z,2022-10-26T14:18:57Z
誰か俺の死体にもう一度この曲聞かしてやってくれ,誰か俺の死体にもう一度この曲聞かしてやってくれ,ラフィー,4,2022-10-26T11:06:14Z,2022-10-26T11:06:14Z
イラストが美しい…生まれて初めてンジュの体がえっちぃと思えた(おい),イラストが美しい…生まれて初めてンジュの体がえっちぃと思えた(おい),I am私,2,2022-10-26T13:59:52Z,2022-10-26T13:59:52Z
感謝,感謝,咲やん,1,2022-10-26T11:22:50Z,2022-10-26T11:22:50Z
んーこれはバタフライ,んーこれはバタフライ,ゴリラ伯爵,1,2022-10-26T12:24:41Z,2022-10-26T12:24:41Z
俺の推しかっこよ過ぎんか？,俺の推しかっこよ過ぎんか？,オーゴティン,1,2022-10-26T12:47:02Z,2022-10-26T12:47:02Z
カッコいい(⸝⸝⸝ ⸝⸝⸝)足して割る2したらちょうど良さそうだ🤔ナニが とは言わないけど...🤫,"カッコいい(⸝⸝⸝ ⸝⸝⸝)
足して割る2したらちょうど良さそうだ🤔
ナニが とは言わないけど...🤫",선미.,2,2022-10-26T13:38:49Z,2022-10-26T13:38:49Z
どこのボインと母音かとおもったわ,どこのボインと母音かとおもったわ,消しゴム,0,2022-10-26T14:33:21Z,2022-10-26T14:33:21Z
コールガールじゃないのか,コールガールじゃないのか,haku h,0,2022-10-26T13:59:20Z,2022-10-26T13:59:20Z
ニュイは記憶も乳もありそう,ニュイは記憶も乳もありそう,オーマン,1,2022-10-26T12:34:46Z,2022-10-26T12:34:46Z
最高か？,最高か？,CandyGhost 。,5,2022-10-25T14:27:24Z,2022-10-25T14:27:24Z
