textDisplay,textOriginal,authorDisplayName,likeCount,publishedAt,updatedAt
もうただただ好き…かっこよ…,もうただただ好き…かっこよ…,san aki,2,2022-10-26T13:03:20Z,2022-10-26T13:03:20Z
カッコ良さと大人の艶っぽさが最高です…。,カッコ良さと大人の艶っぽさが最高です…。,シオン,0,2022-10-26T23:56:21Z,2022-10-26T23:56:21Z
コーラスで口悪くなるのかっこよ怖いで最高すぎ2:02  1:00ここのフー好き,"コーラスで口悪くなるのかっこよ怖いで最高すぎ
2:02  1:00ここのフー好き",おじ吉,4,2022-10-26T13:29:41Z,2022-10-27T05:47:45Z
二人共、普段の配信とのギャップが凄いｗ次も楽しみにしていますｗ,"二人共、普段の配信とのギャップが凄いｗ
次も楽しみにしていますｗ",ふりかけ旨い,1,2022-10-26T17:34:34Z,2022-10-26T17:34:34Z
一番サビに入るところ、ニュイはセクシーアンジュは強いシャウトという、二人の武器が一気にやってくるので、5秒くらいの短い間なんだけど非常に価値があったfor me,"一番サビに入るところ、
ニュイはセクシーアンジュは強いシャウトという、二人の武器が一気にやってくるので、
5秒くらいの短い間なんだけど非常に価値があったfor me",右ねじRightscrew,4,2022-10-27T07:36:45Z,2022-10-27T07:36:45Z
私たちの、性癖を針の糸を通す繊細さでついてくる二人大好き,私たちの、性癖を針の糸を通す繊細さでついてくる二人大好き,みなとざき,2,2022-10-27T01:12:45Z,2022-10-27T01:12:45Z
すんごく良かったです…,すんごく良かったです…,あーる!あーる,3,2022-10-26T11:07:11Z,2022-10-26T11:07:11Z
"1:35普段すんごい優しい""""善""""のイメージのアンジュがここ歌うの、女の子引っかけるために優しくしてる感があって良い...(虚構)","1:35
普段すんごい優しい""""善""""のイメージのアンジュがここ歌うの、女の子引っかけるために優しくしてる感があって良い...(虚構)",滑りやすい靴,6,2022-10-26T21:33:50Z,2022-10-26T21:33:50Z
ただただかっこいいこれがあるから推し事ができるありがとう,"ただただかっこいい










これがあるから推し事ができる
ありがとう",Mk-2 Fukazume,2,2022-10-26T11:12:22Z,2022-10-26T11:12:22Z
コルボってペアで歌うイメージなかったからどうなんだろう...って思ってたけどはちゃめちゃにかっこよくて泣いた自分用 2:15,"コルボってペアで歌うイメージなかったからどうなんだろう...って思ってたけどはちゃめちゃにかっこよくて泣いた
自分用 2:15",わらこ,4,2022-10-26T12:43:34Z,2022-10-26T12:43:34Z
3分30秒間ずっと綺麗なお姉さんたちのイラストと素敵な声が聴こえてきて幸せでしかないです😭😭👍,3分30秒間ずっと綺麗なお姉さんたちのイラストと素敵な声が聴こえてきて幸せでしかないです😭😭👍,*ゆずれもん,1,2022-10-26T12:48:33Z,2022-10-26T12:48:33Z
女の人のイケボほんと好きだぁぁぁ！！憧れです、かっこいい🤤低音がガチの低音て感じで声質もほんとかっこよすぎる最高😭💗,"女の人のイケボほんと好きだぁぁぁ！！
憧れです、かっこいい🤤
低音がガチの低音て感じで声質もほんとかっこよすぎる最高😭💗",てん,2,2022-10-26T13:07:13Z,2022-10-26T13:07:13Z
もう最高過ぎて途中から笑う事しか出来んかった,もう最高過ぎて途中から笑う事しか出来んかった,ふくもってぃー,4,2022-10-26T11:55:25Z,2022-10-26T11:55:25Z
この治安の悪さ最高すぎる,この治安の悪さ最高すぎる,こつねぷ,4,2022-10-26T11:42:44Z,2022-10-26T11:42:44Z
ニュイさんにじ甲とジャッジアイズのイメージしかなかったけど声かっこよすぎて耳溶けた,ニュイさんにじ甲とジャッジアイズのイメージしかなかったけど声かっこよすぎて耳溶けた,ナチ,2,2022-10-27T09:49:24Z,2022-10-27T09:49:24Z
初めて行ったバーにいる、明らかにかかわっちゃいけないけどあまりにも魅力的で近づかざるを得ないお姉さんってかんじだ……………………,初めて行ったバーにいる、明らかにかかわっちゃいけないけどあまりにも魅力的で近づかざるを得ないお姉さんってかんじだ……………………,はむおいしい,2,2022-10-26T16:08:04Z,2022-10-26T16:08:04Z
ガチでやばい良すぎるなんだこれ最高か,ガチでやばい良すぎるなんだこれ最高か,otsuki,0,2022-10-26T23:58:09Z,2022-10-26T23:58:09Z
やべえ、最高の組み合わせ,やべえ、最高の組み合わせ,ドジー,1,2022-10-27T09:52:12Z,2022-10-27T09:52:12Z
カッコ良すぎる！低音最高です！,カッコ良すぎる！低音最高です！,もぐ,0,2022-10-26T15:51:21Z,2022-10-26T15:51:21Z
こんなかっこいいのに二人ともずっとほろ酔いのんでそうでかわいい笑,こんなかっこいいのに二人ともずっとほろ酔いのんでそうでかわいい笑,リアくん,7,2022-10-26T11:10:18Z,2022-10-26T11:10:18Z
死ぬほど好みです…,死ぬほど好みです…,ゆー,4,2022-10-26T12:18:52Z,2022-10-26T12:18:52Z
なんか、生きてて良かった…2人ともめっちゃかっこよくて最高だった！！！好きなとこ詰めタイムスタンプアンジュ0:57 「ねぇんだよ」2:072:59 「くそがよ」ソシエ1:06 「くそがよ」1:33 「結局ね」1:59 「いいんだよ」2:50 「ねぇんだよ」多分みんなが聞きたいところ()2:43,"なんか、生きてて良かった…
2人ともめっちゃかっこよくて最高だった！！！
好きなとこ詰めタイムスタンプ

アンジュ
0:57 「ねぇんだよ」

2:07
2:59 「くそがよ」

ソシエ
1:06 「くそがよ」

1:33 「結局ね」

1:59 「いいんだよ」

2:50 「ねぇんだよ」

多分みんなが聞きたいところ()
2:43",あーさん,33,2022-10-26T00:15:56Z,2022-10-26T11:15:12Z
ちぇりーぺぇがこの曲歌ってくれると思ってなかったからめっちゃ嬉しい！！！！この曲大好きだから推しがこの曲歌ってくれるとか最高か？マジでありがとうございます！！！,"ちぇりーぺぇがこの曲歌ってくれると思ってなかったからめっちゃ嬉しい！！！！
この曲大好きだから推しがこの曲歌ってくれるとか最高か？マジでありがとうございます！！！",七夕,6,2022-10-26T04:52:31Z,2022-10-26T04:52:31Z
アンニュイな雰囲気でめっちゃ格好よかったです！！ちぇりーぺぇ最高😭🙌🙌,アンニュイな雰囲気でめっちゃ格好よかったです！！ちぇりーぺぇ最高😭🙌🙌,飴林檎,10,2022-10-26T11:05:42Z,2022-10-26T11:05:42Z
2人の低音やべぇ....すき。,2人の低音やべぇ....すき。,【豆太】華布,9,2022-10-26T11:02:03Z,2022-10-26T11:02:03Z
Lovely Duet Cover!,Lovely Duet Cover!,JaoOtakuOutcomes,2,2022-10-26T18:45:57Z,2022-10-26T18:45:57Z
(  '-' )ｽｩｰｯ↑カッコよすぎ(語彙力),(  '-' )ｽｩｰｯ↑カッコよすぎ(語彙力),神影。(みかげ),1,2022-10-26T12:33:36Z,2022-10-26T12:33:36Z
ほんと神だわ,ほんと神だわ,ほうじ茶の間,2,2022-10-26T12:12:02Z,2022-10-26T12:12:02Z
この2人だからこそのカッコ良さ,この2人だからこそのカッコ良さ,しょーた,5,2022-10-26T11:05:03Z,2022-10-26T11:05:03Z
俺パート多めのンジュも、ガチカッコええソシエも本当にね、助かる😇😇😇「女性のイケボからでしか摂取出来ない栄養がある。」,"俺パート多めのンジュも、ガチカッコええソシエも本当にね、助かる😇😇😇

「女性のイケボからでしか摂取出来ない栄養がある。」",熊ku-ma,3,2022-10-26T12:52:19Z,2022-10-26T12:52:19Z
前回のピニャコラーダに続いていけないお姉さん役がバッチリ嵌っていらっしゃる……イケボ良きかなお二方とも忙しい中での収録お疲れ様でした、そして42万人おめでとうございます,"前回のピニャコラーダに続いていけないお姉さん役がバッチリ嵌っていらっしゃる……イケボ良きかな
お二方とも忙しい中での収録お疲れ様でした、そして42万人おめでとうございます",glass lily,0,2022-10-26T15:34:10Z,2022-10-26T15:34:10Z
2:12 好きすぎるアンニュイ最高😭,"2:12 好きすぎる
アンニュイ最高😭",れい,4,2022-10-26T11:08:02Z,2022-10-26T11:08:02Z
最高にパワフルで色っぽくて格好がキマってるちぇりーぺぇコールボーイ、最高ですありがとうございます,最高にパワフルで色っぽくて格好がキマってるちぇりーぺぇコールボーイ、最高ですありがとうございます,薄明りと天泣,3,2022-10-26T11:09:04Z,2022-10-26T11:09:04Z
ニュイさんのハスキーな低音がどタイプすぎて……😭好きです……😭アンジュの低音も相まって本当に最高です。ありがとうございます既にループ止まらん😭👏,"ニュイさんのハスキーな低音がどタイプすぎて……😭
好きです……😭
アンジュの低音も相まって本当に最高です。ありがとうございます既にループ止まらん😭👏",ぷるぷる,13,2022-10-26T13:00:46Z,2022-10-26T13:00:46Z
もうサムネの時点で、凄すぎて…うぉぉ。ってテンションが上がっちゃう！！(/・ω・)/,もうサムネの時点で、凄すぎて…うぉぉ。ってテンションが上がっちゃう！！(/・ω・)/,神谷亮,5,2022-10-26T09:48:33Z,2022-10-26T09:48:33Z
この勢いでコールガールも歌って欲しい……,この勢いでコールガールも歌って欲しい……,きさらぎ（H&CLI）,1,2022-10-26T13:06:00Z,2022-10-26T13:06:00Z
めちゃくちゃ好きな曲をニュイとアンジュが歌ってくれるの最高でしかないありがとう😭😭😭追記めっちゃ色気あって加えてかっこよくてしんだ推し、らぶです。,"めちゃくちゃ好きな曲をニュイとアンジュが歌ってくれるの最高でしかないありがとう😭😭😭

追記
めっちゃ色気あって加えてかっこよくてしんだ
推し、らぶです。",名前非公開,20,2022-10-25T14:34:15Z,2022-10-26T11:21:44Z
治安が悪いところに最高のセリフ部分。素晴らしい…そして何より「へそ」！！！,"治安が悪いところに最高のセリフ部分。素晴らしい…
そして何より「へそ」！！！",しみゃー,1,2022-10-27T00:21:12Z,2022-10-27T00:21:12Z
最高すぎて泣いた😭,最高すぎて泣いた😭,mao,5,2022-10-26T11:06:31Z,2022-10-26T11:06:31Z
曲は初めて知ったけど、おニュイの声は独特の主張があって、アンジュの声は楽器隊とのハーモニーがある気がする。二人の化学反応は凄いなあと感じました。,"曲は初めて知ったけど、おニュイの声は独特の主張があって、
アンジュの声は楽器隊とのハーモニーがある気がする。
二人の化学反応は凄いなあと感じました。",Millennium Engine,4,2022-10-26T11:18:48Z,2022-10-26T11:18:48Z
最高すぎんか！？ありがとう,最高すぎんか！？ありがとう,こなミカン,3,2022-10-25T14:41:17Z,2022-10-25T14:41:17Z
ちぇりーぺぇでのお歌、最高過ぎるでしょ,ちぇりーぺぇでのお歌、最高過ぎるでしょ,あかね,7,2022-10-25T14:43:05Z,2022-10-25T14:43:05Z
低音が…足りている…！かっっけぇ………ヘッドホンするとヤバい,"低音が…足りている…！
かっっけぇ………
ヘッドホンするとヤバい",みんてぃあ,2,2022-10-26T14:11:36Z,2022-10-26T14:11:36Z
最高すぎて泣いた,最高すぎて泣いた,あいうえ,1,2022-10-26T13:52:19Z,2022-10-26T13:52:19Z
女だけど、普通に惚れました…,女だけど、普通に惚れました…,もうふ,1,2022-10-26T13:03:56Z,2022-10-26T13:03:56Z
低音ボイスがめちゃめちゃかっこいい😖聞き入ってしまうまじでありがとう🫶🏻🫶🏻🫶🏻,"低音ボイスがめちゃめちゃかっこいい😖
聞き入ってしまう
まじでありがとう🫶🏻🫶🏻🫶🏻",つなまよ,1,2022-10-26T14:31:44Z,2022-10-26T14:31:44Z
やはりンジュはナイトバタフライより王子様のが似合うのよ…おニュイもかっこよい…すき,やはりンジュはナイトバタフライより王子様のが似合うのよ…おニュイもかっこよい…すき,ふるふら,1,2022-10-26T12:58:53Z,2022-10-26T12:58:53Z
おおー！アンジュさんとの歌ってみた動画！嬉しすぎる…歌ったのはコールボーイか… 楽しみだ。,"おおー！アンジュさんとの
歌ってみた動画！嬉しすぎる…
歌ったのはコールボーイか… 楽しみだ。",二代目ノーマルジャパン,4,2022-10-25T17:10:02Z,2022-10-25T17:10:02Z
これはお二人とも百人斬りナイトバタフライだわ…🦋,これはお二人とも百人斬りナイトバタフライだわ…🦋,飯テロリストのまひる,5,2022-10-26T11:05:45Z,2022-10-26T11:05:45Z
やっべえ ┉ かっこよすぎる ┉,やっべえ ┉ かっこよすぎる ┉,ぷぅちゃ,1,2022-10-26T12:27:03Z,2022-10-26T12:27:03Z
こんなにもかっこいい曲なのに、なぜかニュイさんの「オrrrラ！」を聞くたびに笑っちゃうｗ,こんなにもかっこいい曲なのに、なぜかニュイさんの「オrrrラ！」を聞くたびに笑っちゃうｗ,小志,2,2022-10-26T13:10:12Z,2022-10-26T13:10:12Z
めちゃ治安悪くて最高でした！,めちゃ治安悪くて最高でした！,魔界探偵,3,2022-10-26T11:05:34Z,2022-10-26T11:05:34Z
コールボーイめちゃ好きなので推しがそれ歌うって生きてて良かった😭,コールボーイめちゃ好きなので推しがそれ歌うって生きてて良かった😭,あいかむ,6,2022-10-25T15:45:01Z,2022-10-25T15:45:01Z
しっかりあって、しっかりないサ(ムネ)大好き,しっかりあって、しっかりないサ(ムネ)大好き,もちもち,1,2022-10-26T13:31:10Z,2022-10-26T13:31:10Z
金も時間もあるけど胸はない模様のアンジュ,金も時間もあるけど胸はない模様のアンジュ,クッキー大好き,4,2022-10-27T02:59:18Z,2022-10-27T02:59:18Z
改めて惚れ直したすっっき,改めて惚れ直したすっっき,希咲,2,2022-10-26T13:43:22Z,2022-10-26T13:43:22Z
おニュイの低音良すぎひん...??,おニュイの低音良すぎひん...??,海瑠–かいる,7,2022-10-26T11:05:36Z,2022-10-26T11:05:36Z
聴く前からかっこいいのは解ってたのに負けた かっこいい…！,"聴く前からかっこいいのは解ってた
のに負けた かっこいい…！",喉に刺さったサカナの骨,1,2022-10-26T12:58:53Z,2022-10-26T12:58:53Z
さわやかっこいい。この後の酒雑談とのギャップえぐそう（えぐい）,さわやかっこいい。この後の酒雑談とのギャップえぐそう（えぐい）,主査ンゴ,2,2022-10-26T11:07:19Z,2022-10-26T11:07:19Z
コールボーイの歌ってみたでここまでしっくりきた方々初めてなんだが……,コールボーイの歌ってみたでここまでしっくりきた方々初めてなんだが……,あ,1,2022-10-26T18:05:09Z,2022-10-26T18:05:09Z
聴く前から分かる最高ですありがとうございます,聴く前から分かる最高ですありがとうございます,いかりんぐ,2,2022-10-25T14:41:28Z,2022-10-25T14:41:28Z
惚れちまうわ,惚れちまうわ,あきとも,1,2022-10-26T13:09:16Z,2022-10-26T13:09:16Z
低音ボイスの色気がたまらん,低音ボイスの色気がたまらん,MN,7,2022-10-26T11:51:24Z,2022-10-26T11:51:24Z
めっちゃ好き,めっちゃ好き,かかあ,0,2022-10-26T15:11:14Z,2022-10-26T15:11:14Z
かっこいい、かっこいい…最高…,かっこいい、かっこいい…最高…,あっち,0,2022-10-26T16:32:27Z,2022-10-26T16:32:27Z
リピ確すぎる、、😭💞💞,リピ確すぎる、、😭💞💞,りり,1,2022-10-26T14:51:27Z,2022-10-26T14:51:27Z
レベル高い女すぎて絶対酔えない自信がある,レベル高い女すぎて絶対酔えない自信がある,ギラヴァンツS7イグナシオ,2,2022-10-26T15:25:54Z,2022-10-26T15:25:54Z
この二人になら全財産はたいて廃人になってもええなぁ…,この二人になら全財産はたいて廃人になってもええなぁ…,SHAKEチャンネル,2,2022-10-26T11:54:59Z,2022-10-26T11:54:59Z
あっこれは至高ですわ,あっこれは至高ですわ,シオン,3,2022-10-25T22:14:55Z,2022-10-25T22:14:55Z
ソシエとアンジュのかっこよさとかわいさを兼ね備えてるこのイラストからもう優勝。聞く前からわかる最高なやつだ,ソシエとアンジュのかっこよさとかわいさを兼ね備えてるこのイラストからもう優勝。聞く前からわかる最高なやつだ,さか,11,2022-10-25T22:16:09Z,2022-10-25T22:16:09Z
アンジュの「ねぇんだよ」が治安悪くて最高,アンジュの「ねぇんだよ」が治安悪くて最高,A「C」,7,2022-10-26T11:13:52Z,2022-10-26T11:13:52Z
ガチ好き,ガチ好き,ねむ,1,2022-10-27T08:05:39Z,2022-10-27T08:05:39Z
感謝......ただそれだけいい.....,感謝......ただそれだけいい.....,はるさめ,1,2022-10-26T14:51:42Z,2022-10-26T14:51:42Z
やっぱアンジュイケボすぎるな,やっぱアンジュイケボすぎるな,あ,2,2022-10-26T19:48:37Z,2022-10-26T19:48:37Z
治安悪すぎてむりすき…🫶2人におだてあげられて酒がぶ飲みして、ホテル直行して、朝起きたら自分しかいないっていう虚無感を味わいたい…。もし街中とかですれ違って、声かけてみたとしても、誰きみ？みたいな感じで、面倒くさそうにあしらわれたい。めげずに何回も会ったりしたら認知はしてくれるだろうけど、こっちのことをセフレみたいにカウントしててほしい…。替えのきく女と思ってて欲しいし、ほかの女につけられたキスマとか、匂いが2人のものじゃなくて明らかに違う人の女物の香水とかであってほしい。それを見て本当は口出ししたいけど、そんなこと言ったら萎えられるしって悶々と悩んで無意識に段々束縛とかを激しくしちゃって、重いって言って振られて、いつの間にか寝てる間とかに2人の連絡先を消されたい。ちなみに毎回朝起きたら2人はもういないし、（コールボーイちぇりーぺぇはクズだと思ってるので）あっちからは誘わないので毎回自分から誘う。既読無視とか必要最低限の会話しかしてくれない。それも自分はすごい嫌だから↑の通りめんどくさい女になっちゃう。それで、2人の連絡先がないって気づいて、ホテルの受付とか前2人と会った場所とか探し回るんだけど全く見つからなくて絶望したい。その後病みに病んで、回復したと思ってもあの2人に狂わされてから好みのタイプがクズ系とかちょっと見た目が似てるような人になっちゃって、行動とかしぐさにあの2人はもう少し乱暴とかそんなこと考える自分にも嫌になると思う。結婚とかしても心に穴がぽっかり空いたみたいで、ずっと消えないから旦那さんのことを心から愛せないと思う。そんな自分が嫌で嫌で仕方なくて自殺するか、そんな勇気が出ない自分に嫌気がさしながらずるずる生きていって老衰で死ぬ時、2人のことを考えながら息を引き取りたい。というか、そもそもまともな旦那じゃ無かったら借金払わされそうだし、風俗とかで働き始める。それだと毎日なんの幸せもないのでやっていけなくて、全部諦めてやっぱり自殺するかも。どっちにしたって、コールボーイちぇりーぺぇに会って人生狂わせられるモブになりたい。2人の記憶に残るかどうかぐらいの印象の女でありたい。オタクの長文厄介妄想失礼しました…🙏,"治安悪すぎてむりすき…🫶2人におだてあげられて酒がぶ飲みして、ホテル直行して、朝起きたら自分しかいないっていう虚無感を味わいたい…。もし街中とかですれ違って、声かけてみたとしても、誰きみ？みたいな感じで、面倒くさそうにあしらわれたい。めげずに何回も会ったりしたら認知はしてくれるだろうけど、こっちのことをセフレみたいにカウントしててほしい…。替えのきく女と思ってて欲しいし、ほかの女につけられたキスマとか、匂いが2人のものじゃなくて明らかに違う人の女物の香水とかであってほしい。それを見て本当は口出ししたいけど、そんなこと言ったら萎えられるしって悶々と悩んで無意識に段々束縛とかを激しくしちゃって、重いって言って振られて、いつの間にか寝てる間とかに2人の連絡先を消されたい。ちなみに毎回朝起きたら2人はもういないし、（コールボーイちぇりーぺぇはクズだと思ってるので）あっちからは誘わないので毎回自分から誘う。既読無視とか必要最低限の会話しかしてくれない。それも自分はすごい嫌だから↑の通りめんどくさい女になっちゃう。
それで、2人の連絡先がないって気づいて、ホテルの受付とか前2人と会った場所とか探し回るんだけど全く見つからなくて絶望したい。その後病みに病んで、回復したと思ってもあの2人に狂わされてから好みのタイプがクズ系とかちょっと見た目が似てるような人になっちゃって、行動とかしぐさにあの2人はもう少し乱暴とかそんなこと考える自分にも嫌になると思う。結婚とかしても心に穴がぽっかり空いたみたいで、ずっと消えないから旦那さんのことを心から愛せないと思う。そんな自分が嫌で嫌で仕方なくて自殺するか、そんな勇気が出ない自分に嫌気がさしながらずるずる生きていって老衰で死ぬ時、2人のことを考えながら息を引き取りたい。
というか、そもそもまともな旦那じゃ無かったら借金払わされそうだし、風俗とかで働き始める。それだと毎日なんの幸せもないのでやっていけなくて、全部諦めてやっぱり自殺するかも。
どっちにしたって、コールボーイちぇりーぺぇに会って人生狂わせられるモブになりたい。2人の記憶に残るかどうかぐらいの印象の女でありたい。
オタクの長文厄介妄想失礼しました…🙏",百華,3,2022-10-26T12:08:20Z,2022-10-26T12:08:20Z
選曲も歌声もMVもどストライク,選曲も歌声もMVもどストライク,かむ,1,2022-10-26T11:23:55Z,2022-10-26T11:23:55Z
この2人の声の相性エグくないか…好みドンピシャだわ🤩ウマ娘のおねーさんとビッパのおねーさんて認識を改めなイカン😮,"この2人の声の相性エグくないか…好みドンピシャだわ🤩

ウマ娘のおねーさんとビッパのおねーさんて認識を改めなイカン😮",RAS,4,2022-10-26T12:18:04Z,2022-10-26T12:20:11Z
ソシエのザ・セクシーって感じとアンジュのヘルシーなセクシーさが最高お腹の縦線たすかる、、、,"ソシエのザ・セクシーって感じと
アンジュのヘルシーなセクシーさが最高

お腹の縦線たすかる、、、",A,1,2022-10-26T13:13:13Z,2022-10-26T13:13:13Z
2人の、がなり聴けるのかな？楽しみ！,"2人の、がなり聴けるのかな？
楽しみ！",安藤あっちゃん,3,2022-10-25T15:12:20Z,2022-10-25T15:12:20Z
めちゃくちゃ神なんだが1日100回はきくわ,"めちゃくちゃ神なんだが
1日100回はきくわ",yachiyo,3,2022-10-26T11:05:49Z,2022-10-26T11:05:49Z
2人ともめちゃめちゃ声カッコよくてすこすこなんだけど、捉えようによっちゃ男にフラれたアンジュのヤケ酒におニュイが付き合ってるともとれるから情緒がイカれるそれはそれとしてほんとに2人ともかっこいいからこれ最強です,"2人ともめちゃめちゃ声カッコよくてすこすこなんだけど、捉えようによっちゃ男にフラれたアンジュのヤケ酒におニュイが付き合ってるともとれるから情緒がイカれる







それはそれとしてほんとに2人ともかっこいいからこれ最強です",しぉ〜ん,18,2022-10-26T11:23:18Z,2022-10-26T11:23:18Z
アンジュの合いの手、おらっ！とかチンピラ感強くて可愛い,アンジュの合いの手、おらっ！とかチンピラ感強くて可愛い,空の豆,3,2022-10-27T06:42:23Z,2022-10-27T06:42:23Z
ひ…神じゃん…,ひ…神じゃん…,k hr,2,2022-10-26T12:12:52Z,2022-10-26T12:12:52Z
