textDisplay,textOriginal,authorDisplayName,likeCount,publishedAt,updatedAt
アンジュの合いの手ウケるwフゥ⤴︎とかw,アンジュの合いの手ウケるwフゥ⤴︎とかw,むつらせい,3,2022-10-26T11:04:44Z,2022-10-26T11:04:44Z
えええええしぬううううううう！！,えええええしぬううううううう！！,Rudeus,0,2022-10-26T13:45:55Z,2022-10-26T13:45:55Z
もう一杯でパイをアップするの好きです,もう一杯でパイをアップするの好きです,どんみみ,0,2022-10-26T14:13:40Z,2022-10-26T14:13:40Z
えぐ、やば、え？,えぐ、やば、え？,第一号日本人,3,2022-10-26T13:03:11Z,2022-10-26T13:03:11Z
おニュイを酔わせまくって持ち帰りたい,おニュイを酔わせまくって持ち帰りたい,リア,1,2022-10-26T11:26:14Z,2022-10-26T11:26:14Z
僕は今幸せです,僕は今幸せです,ちゃあみぃ,0,2022-10-26T23:05:17Z,2022-10-26T23:05:17Z
ｵﾗｧｯ！,ｵﾗｧｯ！,パルピロ,1,2022-10-26T12:56:03Z,2022-10-26T12:56:03Z
アンジュひええええええええ,アンジュひええええええええ,cxl,0,2022-10-26T18:12:57Z,2022-10-26T18:12:57Z
😭🙏🏻💞,😭🙏🏻💞,IIIIi,2,2022-10-26T12:46:09Z,2022-10-26T12:46:09Z
やっぱりアンジュおとこだった。,やっぱりアンジュおとこだった。,クロトバロック,1,2022-10-26T13:13:42Z,2022-10-26T13:13:42Z
うーん、サティスファクションふじこ急上昇おめでとうございます,"うーん、サティスファクションふじこ
急上昇おめでとうございます",Chainsaw Man,1,2022-10-27T05:59:40Z,2022-10-27T05:59:40Z
調子乗って飲みすぎたアンジュがソシエに介抱されて家に帰り、ナツくんをゲロかまいして嫌がられて泣くとこまで見えた。,調子乗って飲みすぎたアンジュがソシエに介抱されて家に帰り、ナツくんをゲロかまいして嫌がられて泣くとこまで見えた。,みみあか,0,2022-10-26T16:53:19Z,2022-10-26T16:53:19Z
○○「ｱﾝｼﾞｭﾍﾟｯﾀﾝｺ!!!」,○○「ｱﾝｼﾞｭﾍﾟｯﾀﾝｺ!!!」,MISAKI,1,2022-10-26T12:18:42Z,2022-10-26T12:18:42Z
アンジュのカクテルがさんばかのペンライトの色ですき,アンジュのカクテルがさんばかのペンライトの色ですき,NKZR,0,2022-10-26T11:21:43Z,2022-10-26T11:21:43Z
クラブいってそう。,クラブいってそう。,むら,1,2022-10-26T12:48:01Z,2022-10-26T12:48:01Z
ホスト風キャバクラか？,ホスト風キャバクラか？,にんにくの芽と味噌煮込みうどんは叶勝の飲み物,2,2022-10-26T13:36:05Z,2022-10-26T13:36:05Z
本当にごめんおニュイもアンジュもかっこいいけど2:15 2:15 2:15のここがｵｯﾊﾟｧｲにしか聞こえんのよ,"本当にごめん
おニュイもアンジュもかっこいいけど
2:15 2:15 2:15のここが


ｵｯﾊﾟｧｲ

にしか聞こえんのよ",かりん,0,2022-10-26T15:16:25Z,2022-10-26T15:17:19Z
2:12意味もなくもういっパイ って事………？www,"2:12

意味もなくもういっパイ って事………？www",みっきー,1,2022-10-26T12:06:34Z,2022-10-26T12:06:52Z
2:15 なぜかここ「おっぱい」って言ってる気がするんだよなァ…ｗ,2:15 なぜかここ「おっぱい」って言ってる気がするんだよなァ…ｗ,ちゃーはん,1,2022-10-26T14:13:19Z,2022-10-26T14:13:19Z
耳が妊娠したぞ？,耳が妊娠したぞ？,黒助,1,2022-10-27T07:35:00Z,2022-10-27T07:35:00Z
おへそやば、,おへそやば、,ぶんぶん,0,2022-10-26T11:23:19Z,2022-10-26T11:23:19Z
もっと罵ってください、、、,もっと罵ってください、、、,莉.,0,2022-10-26T11:08:07Z,2022-10-26T11:08:07Z
2:15比較すな,2:15比較すな,不安定なフワンテ,2,2022-10-27T02:39:56Z,2022-10-27T02:39:56Z
ENCORE,ENCORE,Josué Veguilla,1,2022-10-26T11:09:59Z,2022-10-26T11:09:59Z
どうして高評価は1度しか押せないのですか？,どうして高評価は1度しか押せないのですか？,ちくわと消しゴム,1,2022-10-26T11:05:04Z,2022-10-26T11:05:04Z
2:16,2:16,男泣き小野小町,1,2022-10-26T12:27:09Z,2022-10-26T12:27:09Z
あんんんんんじゅゅゅんんんんんんんん,あんんんんんじゅゅゅんんんんんんんん,ヴァぁあゝ,0,2022-10-26T13:57:00Z,2022-10-26T13:57:00Z
どうしよう…お前だよ馬鹿って言われたい。こんないい女いたら持ち帰るわ。,"どうしよう…お前だよ馬鹿って言われたい。
こんないい女いたら持ち帰るわ。",くまださん,2,2022-10-26T11:04:54Z,2022-10-26T11:04:54Z
名前クソに変えてこようかな,名前クソに変えてこようかな,も も,1,2022-10-27T02:15:05Z,2022-10-27T02:15:05Z
🤠🤠🤠,🤠🤠🤠,Wanda Bagus Sebastian,0,2022-10-26T11:08:11Z,2022-10-26T11:08:11Z
歌とは関係ないんだけどアンジュ可哀そう,歌とは関係ないんだけどアンジュ可哀そう,くろむっしゅ,0,2022-10-26T12:58:46Z,2022-10-26T12:58:46Z
自分語りですが今日誕生日なので最高のプレゼントです…😭,自分語りですが今日誕生日なので最高のプレゼントです…😭,らいき,6,2022-10-25T15:32:34Z,2022-10-25T15:32:34Z
なア胸無,なア胸無,良いよねユウキ,1,2022-10-26T12:52:01Z,2022-10-26T12:52:01Z
