textDisplay,textOriginal,authorDisplayName,likeCount,publishedAt,updatedAt
好きなものをこんなに固められるのすごい…こんなに大きな買い物できるのも努力してきたからなんだなぁと尊敬👏😢,好きなものをこんなに固められるのすごい…こんなに大きな買い物できるのも努力してきたからなんだなぁと尊敬👏😢,むーみん,130,2022-10-26T11:58:00Z,2022-10-26T11:58:00Z
サムネ見て大金！と思ったけど、内容見たら全部高そうやしスペシャルなアイテムばっかりで「逆にこれ100万で収まったんだ？！」ってなりましたww買い物上手👏✨めちゃくちゃワクワクする購入品紹介ありがとうございました🌼❤,"サムネ見て大金！と思ったけど、内容見たら全部高そうやしスペシャルなアイテムばっかりで「逆にこれ100万で収まったんだ？！」ってなりましたww
買い物上手👏✨めちゃくちゃワクワクする購入品紹介ありがとうございました🌼❤",ずんずん,29,2022-10-26T14:17:27Z,2022-10-26T14:17:27Z
まぢでぎーにょちゃんのファッション系統が違うから全く参考にならんけど、選ぶものとかかわいいし、新しい服とか着てウキウキしてるの見て毎回こっちまで嬉しくなっちゃう🥰,まぢでぎーにょちゃんのファッション系統が違うから全く参考にならんけど、選ぶものとかかわいいし、新しい服とか着てウキウキしてるの見て毎回こっちまで嬉しくなっちゃう🥰,ひかちゅう,64,2022-10-26T10:41:47Z,2022-10-26T10:42:14Z
購入品がどれも予定通りなの？と思うくらいぎーにょちゃんにぴったりすぎるたくさん着替えるとすごく暑くなるよねお店の試着室が狭いとムンムンしちゃう,"購入品がどれも予定通りなの？と思うくらいぎーにょちゃんにぴったりすぎる
たくさん着替えるとすごく暑くなるよね
お店の試着室が狭いとムンムンしちゃう",ファーファねこ,12,2022-10-26T10:26:29Z,2022-10-26T10:26:53Z
いくら楽しめなくなるからといっても、値段見ないで好きなもの買って過ごせる財力よ、、さすがです、、私たちまで楽しませてくれてありがとうすぎ🥺,"いくら楽しめなくなるからといっても、値段見ないで好きなもの買って過ごせる財力よ、、さすがです、、
私たちまで楽しませてくれてありがとうすぎ🥺",むぎ,73,2022-10-26T12:46:12Z,2022-10-26T12:46:12Z
お店では超可愛い！！！！って思って買っても家で見るとなんで買った（？）と思ってしまうことあるけどぎーにょちゃんのほんっとうに似合ってておうちにも合ってて商品の良さがずっと出続けてる！,お店では超可愛い！！！！って思って買っても家で見るとなんで買った（？）と思ってしまうことあるけどぎーにょちゃんのほんっとうに似合ってておうちにも合ってて商品の良さがずっと出続けてる！,わかぎ,228,2022-10-26T11:06:12Z,2022-10-26T11:06:12Z
ぎーにょちゃんの海外旅行関連動画好きすぎて、見たいけど見たら終わっちゃう寂しさも感じる(˘•̥-•̥˘),ぎーにょちゃんの海外旅行関連動画好きすぎて、見たいけど見たら終わっちゃう寂しさも感じる(˘•̥-•̥˘),asuka,60,2022-10-26T10:45:11Z,2022-10-26T10:45:11Z
ぎーにょちゃんが可愛いものいっぱい紹介してくれる動画大好き。こっちまでときめいたり、一目惚れしたりするから見るのめっちゃ楽しい…！,ぎーにょちゃんが可愛いものいっぱい紹介してくれる動画大好き。こっちまでときめいたり、一目惚れしたりするから見るのめっちゃ楽しい…！,じはこ,5,2022-10-26T12:38:02Z,2022-10-26T12:38:02Z
ぎーにょちゃんのこの海外旅行の動画見たら私もロンドン行きたくなった！🥺💞,ぎーにょちゃんのこの海外旅行の動画見たら私もロンドン行きたくなった！🥺💞,ramune‪‪🏳️‍⚧️,56,2022-10-26T10:14:43Z,2022-10-26T10:14:43Z
更新多くてめっちゃくちゃ楽しい♥そしてぎーにょちゃんの可愛いを捕えるアンテナがすごい！,"更新多くてめっちゃくちゃ楽しい♥
そしてぎーにょちゃんの可愛いを捕えるアンテナがすごい！",shiotiny.matz22,10,2022-10-26T11:57:54Z,2022-10-26T11:57:54Z
すごいな、、、海外で色々あって更なる出費があったのに、それでも予定通り爆買いするって本当にすごいな,すごいな、、、海外で色々あって更なる出費があったのに、それでも予定通り爆買いするって本当にすごいな,オムライス,4,2022-10-26T21:19:40Z,2022-10-26T21:19:40Z
あさぎーにょちゃんのために作られたものをただお迎えに行ってるだけのように感じるくらい購入品が毎回素敵！！無駄なものなんてない！って感じ😂,あさぎーにょちゃんのために作られたものをただお迎えに行ってるだけのように感じるくらい購入品が毎回素敵！！無駄なものなんてない！って感じ😂,3,27,2022-10-26T13:04:14Z,2022-10-26T13:04:14Z
購入品紹介待ってました〜🎉サングラスめちゃくちゃ似合ってます！！かわいい〜〜❤❤,"購入品紹介待ってました〜🎉
サングラスめちゃくちゃ似合ってます！！かわいい〜〜❤❤",みい,13,2022-10-26T10:18:25Z,2022-10-26T10:18:25Z
100万円って凄すぎる...ぎーにょちゃんの努力も凄い,"100万円って凄すぎる...
ぎーにょちゃんの努力も凄い",kaori,43,2022-10-26T11:08:32Z,2022-10-26T11:08:32Z
ぎーにょちゃんの動画、全部夢が詰まってる！！！！キラキラしてて可愛いで溢れてる！！観てる側もワクワクがとまらない❤,"ぎーにょちゃんの動画、全部夢が詰まってる！！！！
キラキラしてて可愛いで溢れてる！！
観てる側もワクワクがとまらない❤",ピョンちゃん,4,2022-10-26T12:14:38Z,2022-10-26T12:14:38Z
ほんとにぎーにょちゃんの買うものが一つ一つ可愛いから購入品紹介とかいつも投稿されてるの見るとワクワクします😮💗,ほんとにぎーにょちゃんの買うものが一つ一つ可愛いから購入品紹介とかいつも投稿されてるの見るとワクワクします😮💗,ななな,2,2022-10-26T14:54:32Z,2022-10-26T14:54:32Z
購入品全部可愛すぎて最高です！！私も海外旅行行きたくなってきたよ〜最近投稿多くて嬉しい😆,"購入品全部可愛すぎて最高です！！
私も海外旅行行きたくなってきたよ〜
最近投稿多くて嬉しい😆",もるぺこ,12,2022-10-26T10:27:56Z,2022-10-26T10:27:56Z
あさぎーにょさんの動画、ばいばいじゃなくてバキュンで終わるのなんかすごくすきで... 見終わる瞬間笑顔になってしまう,あさぎーにょさんの動画、ばいばいじゃなくてバキュンで終わるのなんかすごくすきで... 見終わる瞬間笑顔になってしまう,すみれ,2,2022-10-26T15:59:01Z,2022-10-26T15:59:01Z
普段のスタイルは暗い服が好きでぎーにょさんと違うけど、ポップでカラフルな洋服見てるとこういうぎーにょスタイルも憧れる🌼🌷,普段のスタイルは暗い服が好きでぎーにょさんと違うけど、ポップでカラフルな洋服見てるとこういうぎーにょスタイルも憧れる🌼🌷,m,4,2022-10-26T11:05:23Z,2022-10-26T11:05:23Z
なんか、ちょっと海外行ったからといってこんなに人生変わったみたいになると思わなかったもっと世界知ってると思ってたなー,"なんか、ちょっと海外行ったからといってこんなに人生変わったみたいになると思わなかった
もっと世界知ってると思ってたなー",ただのひと,2,2022-10-27T08:20:29Z,2022-10-27T08:20:29Z
地獄も何もかもを最高に変えてしまうぎーにょ様が最強！！！！！ぜんぶ可愛いし、ぜんぶステキなお買い物だね❤,地獄も何もかもを最高に変えてしまうぎーにょ様が最強！！！！！ぜんぶ可愛いし、ぜんぶステキなお買い物だね❤,ぴっころちょこ,2,2022-10-26T12:33:15Z,2022-10-26T12:33:15Z
もっと買ってきてーと思うくらい全部ぎーにょちゃんの好き系ばかりで見てて幸せなりました💸♡,もっと買ってきてーと思うくらい全部ぎーにょちゃんの好き系ばかりで見てて幸せなりました💸♡,ななきな,1,2022-10-26T12:35:04Z,2022-10-26T12:35:04Z
わー購入品紹介待ってた！🥹やっぱり選ぶもの可愛くてセンスしかない最高だし北欧風のもの大好きだから嬉しい！寒暖差激しいから風邪ひかないようにね😌♡,"わー購入品紹介待ってた！🥹
やっぱり選ぶもの可愛くてセンスしかない最高だし北欧風のもの大好きだから嬉しい！
寒暖差激しいから風邪ひかないようにね😌♡",ぶらうにーぼーい,4,2022-10-26T10:20:00Z,2022-10-26T10:20:00Z
ここ最近毎日動画上げてくれててありがたい。でも無理しない程度にね〜,ここ最近毎日動画上げてくれててありがたい。でも無理しない程度にね〜,うみべの磯部,5,2022-10-26T12:43:56Z,2022-10-26T12:43:56Z
めちゃくちゃ可愛すぎて海外旅行いきたくなった✈️³₃,めちゃくちゃ可愛すぎて海外旅行いきたくなった✈️³₃,cocoon .3,1,2022-10-26T12:41:37Z,2022-10-26T12:41:37Z
ジュンヤワタナベのコートありえないくらいかわいい最高　しかもぎーにょちゃんのことロンドンで待ってたとしか思えないくらい似合いすぎ✨おめでとう✨,ジュンヤワタナベのコートありえないくらいかわいい最高　しかもぎーにょちゃんのことロンドンで待ってたとしか思えないくらい似合いすぎ✨おめでとう✨,にこ,7,2022-10-26T12:13:51Z,2022-10-26T12:13:51Z
最近おすすめに出てきたのであさぎーにょさんの動画見てます。モノクロ系統が好きで自分が着ることは無いかもしれませんがこんなにカラフルで可愛くて美しい世界をたくさん見せてくれて感謝です🙏🙏✨✨見てて楽しい動画いつもありがとうごさいます☺️✨,"最近おすすめに出てきたのであさぎーにょさんの動画見てます。
モノクロ系統が好きで自分が着ることは無いかもしれませんがこんなにカラフルで可愛くて美しい世界をたくさん見せてくれて感謝です🙏🙏✨✨見てて楽しい動画いつもありがとうごさいます☺️✨",dami,2,2022-10-26T10:49:11Z,2022-10-26T10:49:11Z
100万円分のかわいいに投資できるぎーにょさんの財力と努力を尊敬します✨👏🏻,100万円分のかわいいに投資できるぎーにょさんの財力と努力を尊敬します✨👏🏻,くまくまくまったちゃん,1,2022-10-26T11:41:42Z,2022-10-26T11:41:42Z
見てて気持ちいぐらいの爆買い🥹しかも全部可愛い…..😵‍💫❤️,見てて気持ちいぐらいの爆買い🥹しかも全部可愛い…..😵‍💫❤️,リン,3,2022-10-26T10:30:15Z,2022-10-26T10:30:15Z
なんでそれ似合うの！？可愛すぎん、、、？！？セレクトが天才すぎる,"なんでそれ似合うの！？可愛すぎん、、、？！？
セレクトが天才すぎる",emma fujiwa 𓂃◌𓈒𓐍,2,2022-10-26T14:12:46Z,2022-10-26T14:12:46Z
かわいいものやキレイなものを美しいって言うぎーにょさんがとっても美しいです。かわいいー,"かわいいものやキレイなものを
美しいって言うぎーにょさんがとっても美しいです。
かわいいー",和子,3,2022-10-26T10:26:52Z,2022-10-26T10:26:52Z
ぎーにょちゃん毎日投稿凄い！無理しないで💦,ぎーにょちゃん毎日投稿凄い！無理しないで💦,カレンダーしゃん,2,2022-10-26T10:36:11Z,2022-10-26T10:36:11Z
ぎーにょちゃんの動画みてたらモチベーション上がるからずっと見てられる！おしゃれだし、可愛いくて、最高💅,"ぎーにょちゃんの動画みてたら
モチベーション上がるから
ずっと見てられる！
おしゃれだし、可愛いくて、最高💅",kaochan!,0,2022-10-26T23:24:01Z,2022-10-26T23:24:41Z
購入品紹介待ってました🧚🏻‍♀️連日動画が見られて嬉しいです🤍,購入品紹介待ってました🧚🏻‍♀️連日動画が見られて嬉しいです🤍,gytn,1,2022-10-26T10:43:47Z,2022-10-26T10:43:47Z
買ったお洋服を現地で即着こなすのがさすがだな〜😊,買ったお洋服を現地で即着こなすのがさすがだな〜😊,、、,1,2022-10-26T13:56:41Z,2022-10-26T13:56:41Z
好きな物の世界観がブレないのすごいそんでもって似合ってるし、羨ましいっす,"好きな物の世界観がブレないのすごい
そんでもって似合ってるし、羨ましいっす",o d,0,2022-10-27T01:20:21Z,2022-10-27T01:20:21Z
あさぎーにょちゃんの動画見てると、洋服だけじゃなくて、人生のモチベーションが上がる🥰今現在ちょっと落ち込んでる日々なんだけど、すこし頑張ろっかな！,"あさぎーにょちゃんの動画見てると、洋服だけじゃなくて、人生のモチベーションが上がる🥰
今現在ちょっと落ち込んでる日々なんだけど、すこし頑張ろっかな！",身から出たわさび,0,2022-10-26T15:35:03Z,2022-10-26T15:35:03Z
購入品紹介待ってました～！サングラス似合ってる😍,"購入品紹介待ってました～！
サングラス似合ってる😍",マドレーヌ,1,2022-10-26T10:40:04Z,2022-10-26T10:40:04Z
ぎーにょちゃんが笑うと幸せに感じます☺️❤️,ぎーにょちゃんが笑うと幸せに感じます☺️❤️,かれん,1,2022-10-26T11:07:29Z,2022-10-26T11:07:29Z
お洋服みんな素敵😍😍😍ぎーにょさんは本当に買い物上手ですね。,お洋服みんな素敵😍😍😍ぎーにょさんは本当に買い物上手ですね。,生クリームぷりん,0,2022-10-27T09:46:54Z,2022-10-27T09:46:54Z
いつか企画やって欲しい！！ぎーにょちゃんの洋服、可愛くて欲しくてたまらないのだけど、洗濯とかどうしてるのかな？って。洗濯機にポンッと入れられないような生地の洋服多い気がするから、洗濯してるところ見たい(-人-;)ジュンヤワタナベのコート、めちゃくちゃ可愛い(*≧з≦)♪♪,"いつか企画やって欲しい！！
ぎーにょちゃんの洋服、可愛くて欲しくてたまらないのだけど、洗濯とかどうしてるのかな？って。洗濯機にポンッと入れられないような生地の洋服多い気がするから、洗濯してるところ見たい(-人-;)
ジュンヤワタナベのコート、めちゃくちゃ可愛い(*≧з≦)♪♪",mm mmームムム,3,2022-10-26T12:34:10Z,2022-10-26T12:37:42Z
全部可愛い！見てるだけでも楽しい🧚🏻‍♀️,全部可愛い！見てるだけでも楽しい🧚🏻‍♀️,あったかうどん,0,2022-10-26T17:45:21Z,2022-10-26T17:45:21Z
旅動画からのおうちで購入品紹介、ここまでが本当に楽しみ💓💓,旅動画からのおうちで購入品紹介、ここまでが本当に楽しみ💓💓,na kochang,2,2022-10-26T10:19:57Z,2022-10-26T10:19:57Z
私も大人になったらぎーにょちゃんみたいな可愛いお洋服とか雑貨とか自分で買ってみたい！と思った❤ぎーにょちゃんの天才的な最高のセンスが大好きです🥰🥰,"私も大人になったらぎーにょちゃんみたいな可愛いお洋服とか雑貨とか自分で買ってみたい！と思った❤
ぎーにょちゃんの天才的な最高のセンスが大好きです🥰🥰",H S,0,2022-10-26T15:29:12Z,2022-10-26T15:29:12Z
購入品紹介待ってました！年齢も系統も全く違うけど、いつも楽しく拝見しています♡,購入品紹介待ってました！年齢も系統も全く違うけど、いつも楽しく拝見しています♡,F M,0,2022-10-26T11:14:27Z,2022-10-26T11:14:27Z
黄色ワンピースと付け襟、めっちゃ合う！あとめっちゃポムポムプリンみあって可愛い❤,"黄色ワンピースと付け襟、めっちゃ合う！
あとめっちゃポムポムプリンみあって可愛い❤",わく,3,2022-10-26T13:43:15Z,2022-10-26T13:43:15Z
ぎ-にょちゃん全部可愛い💕とっても似合ってるよ-❤,"ぎ-にょちゃん全部可愛い💕
とっても似合ってるよ-❤",晴美野田,1,2022-10-26T11:04:06Z,2022-10-26T11:04:06Z
入りのゆる〜いラップと円安最悪の歌で仕事の疲れが癒された😂,入りのゆる〜いラップと円安最悪の歌で仕事の疲れが癒された😂,茶葉ミックス,2,2022-10-26T10:48:01Z,2022-10-26T10:48:01Z
サングラス似合ってるよ！！！まじでもっと旅行の動画観てたい,サングラス似合ってるよ！！！まじでもっと旅行の動画観てたい,うどん,1,2022-10-26T13:32:21Z,2022-10-26T13:32:21Z
ぎにょちゃんがおばあちゃんになったときに食器集めしてる動画にもコメント書きにいくわっ…！🥰どれもかわいい〜！,ぎにょちゃんがおばあちゃんになったときに食器集めしてる動画にもコメント書きにいくわっ…！🥰どれもかわいい〜！,ポポカレー,2,2022-10-26T12:30:31Z,2022-10-26T12:30:31Z
どれも可愛くてお似合いでした！！自分が買った訳じゃないけど、買い物してきたあとのワクワク感をお裾分けしてもらえた気分😊✨🌈登録者数、あと数万人で80万人ですね！ワクドキ💘💕,"どれも可愛くてお似合いでした！！
自分が買った訳じゃないけど、買い物してきたあとのワクワク感をお裾分けしてもらえた気分😊✨🌈
登録者数、あと数万人で80万人ですね！
ワクドキ💘💕",ochicoa,1,2022-10-26T11:51:50Z,2022-10-26T11:51:50Z
爆買いみるの好き〜❤,爆買いみるの好き〜❤,さらさ,2,2022-10-26T10:17:05Z,2022-10-26T10:17:05Z
序盤に色々あったからお家で普通に紹介動画撮ってるの安心する🥹ぎーにょ見てるとカラフルなお洋服着たくなる〜！,序盤に色々あったからお家で普通に紹介動画撮ってるの安心する🥹ぎーにょ見てるとカラフルなお洋服着たくなる〜！,てふてふ,1,2022-10-26T11:39:56Z,2022-10-26T11:39:56Z
可愛すぎるー！🥰🥰私もイギリス行きたい…,可愛すぎるー！🥰🥰私もイギリス行きたい…,あるたのん,1,2022-10-26T10:25:33Z,2022-10-26T10:25:33Z
本当に楽しくてワクワクするたくさんの動画をありがとう！！,本当に楽しくてワクワクするたくさんの動画をありがとう！！,西村チョルス,1,2022-10-26T10:15:51Z,2022-10-26T10:15:51Z
食器集めて大人になったこと感じるのわかる〜！！お花もじゃない？？😮,食器集めて大人になったこと感じるのわかる〜！！お花もじゃない？？😮,やまみ,1,2022-10-26T11:14:51Z,2022-10-26T11:14:51Z
ぎーにょちゃんの購入品紹介大好き🎉,ぎーにょちゃんの購入品紹介大好き🎉,ちゅうりっぷ,0,2022-10-26T10:16:08Z,2022-10-26T10:16:08Z
100万円が飛んでいったの歌が可愛すぎて何回も見ちゃう😂円安すぎて海外行くの怖いなー,"100万円が飛んでいったの歌が可愛すぎて何回も見ちゃう😂
円安すぎて海外行くの怖いなー",shiiiiiiiiichan,0,2022-10-26T10:38:39Z,2022-10-26T10:38:39Z
サングラスめっちゃ似合ってる！🕶✨かけた時のフィット感すごかったです！！笑,"サングラスめっちゃ似合ってる！🕶✨
かけた時のフィット感すごかったです！！笑",藻,0,2022-10-26T22:29:56Z,2022-10-26T22:29:56Z
どれもかわいい💖全部とってもあさちゃんにピッタリだけど　チュールスカートとジャケットとっても似合ってる！！😍,どれもかわいい💖全部とってもあさちゃんにピッタリだけど　チュールスカートとジャケットとっても似合ってる！！😍,ぺいもん,0,2022-10-26T10:32:08Z,2022-10-26T10:32:08Z
全部ぜんぶかわいいですね！🥰お買い物行きたくなりました✨✨✨,全部ぜんぶかわいいですね！🥰お買い物行きたくなりました✨✨✨,ATmamaYUKI / lulu room 000,0,2022-10-26T12:51:30Z,2022-10-26T12:51:30Z
全部可愛い❤サングラス、似合ってるよー。,"全部可愛い❤
サングラス、似合ってるよー。",あさあさ,1,2022-10-26T10:44:54Z,2022-10-26T10:44:54Z
ぎーにょちゃんの動画見てデンマーク、ロンドン行きたくなりました🥺インスピレーション受けたこれからの作品たちも楽しみにしています！♥︎,"ぎーにょちゃんの動画見てデンマーク、ロンドン行きたくなりました🥺
インスピレーション受けたこれからの作品たちも楽しみにしています！♥︎",生ハムちゃん,0,2022-10-26T10:36:45Z,2022-10-26T10:36:45Z
購入品紹介待ってました〜〜😍✨,購入品紹介待ってました〜〜😍✨,大きいたまご,0,2022-10-26T11:53:41Z,2022-10-26T11:53:41Z
最近毎日ぎーにょちゃんが動画上げてくれて嬉しい💓今日もありがとう🥺お疲れ様です✨,"最近毎日ぎーにょちゃんが動画上げてくれて嬉しい💓
今日もありがとう🥺お疲れ様です✨",みにゃちょ,0,2022-10-26T10:14:52Z,2022-10-26T10:14:52Z
購入品紹介嬉しすぎます！！！うきうきしながら嬉しそうなあさぎちゃんを見れて楽しかったです🥰🥰サングラスお似合いでしたよ〜😎💕,"購入品紹介嬉しすぎます！！！
うきうきしながら嬉しそうなあさぎちゃんを見れて楽しかったです🥰🥰
サングラスお似合いでしたよ〜😎💕",むつみ,0,2022-10-26T11:46:34Z,2022-10-26T11:46:34Z
全部めちゃくちゃ可愛い❤,全部めちゃくちゃ可愛い❤,ももとともと,0,2022-10-26T13:20:22Z,2022-10-26T13:20:22Z
ぎーにょのセンスが素敵すぎ♡おでこ出てんのもかわい♡,"ぎーにょのセンスが素敵すぎ♡
おでこ出てんのもかわい♡",りんごチョコ,0,2022-10-26T12:21:20Z,2022-10-26T12:21:20Z
今日ずっと、過去の購入品紹介見てました💗ぎーにょちゃんに影響受けてポップなカラーのものに惹かれまくりです🥺🫶🧡💛💚💙,今日ずっと、過去の購入品紹介見てました💗ぎーにょちゃんに影響受けてポップなカラーのものに惹かれまくりです🥺🫶🧡💛💚💙,あきさこ,0,2022-10-26T11:01:12Z,2022-10-26T11:01:12Z
爆買い購入品動画待ってましたー！でも、あさぎーにょちゃんの元にあるもの達って飾るものも着るものも、使うものもぜーんぶ大事にされてる感があるからすごいなぁって思います✨家全体が幸せそうなんです👸お洋服もすごく似合ってる‼️海外のブランドが映えるって素敵です🥰大変なこともたくさんありましたが、おつかれ様でした🥳私もデンマーク行きたくなりました🇩🇰✨,"爆買い購入品動画待ってましたー！
でも、あさぎーにょちゃんの元にあるもの達って飾るものも着るものも、使うものもぜーんぶ大事にされてる感があるからすごいなぁって思います✨家全体が幸せそうなんです👸
お洋服もすごく似合ってる‼️海外のブランドが映えるって素敵です🥰
大変なこともたくさんありましたが、おつかれ様でした🥳私もデンマーク行きたくなりました🇩🇰✨",mochi,0,2022-10-26T13:15:43Z,2022-10-26T13:15:43Z
購入品紹介待ってましたㅠㅠ,購入品紹介待ってましたㅠㅠ,オリーブの木,0,2022-10-26T15:46:15Z,2022-10-26T15:46:15Z
ぎにょちゃん安心して！サングラス似合ってる♡,ぎにょちゃん安心して！サングラス似合ってる♡,も *も,1,2022-10-26T11:04:50Z,2022-10-26T11:04:50Z
彼氏がイギリスに留学にいくかもしれないからその時は絶対ぎーにょちゃんの動画見返してお買い物行くんだ🇬🇧!!!!,"彼氏がイギリスに留学にいくかもしれないから
その時は絶対ぎーにょちゃんの動画見返してお買い物行くんだ🇬🇧!!!!",やえちゃん,0,2022-10-26T12:15:44Z,2022-10-26T12:15:44Z
本当におしゃれすぎる可愛い！！！！,本当におしゃれすぎる可愛い！！！！,Hana,0,2022-10-26T12:41:54Z,2022-10-26T12:41:54Z
