textDisplay,textOriginal,authorDisplayName,likeCount,publishedAt,updatedAt
グラサンめちゃくちゃ似合ってるやんけ,グラサンめちゃくちゃ似合ってるやんけ,ぱんたろ,0,2022-10-26T11:03:07Z,2022-10-26T11:03:07Z
前世に住んでた国わかる方法あるから、やってみて欲しい！,前世に住んでた国わかる方法あるから、やってみて欲しい！,はねしろ,0,2022-10-27T08:02:23Z,2022-10-27T08:02:23Z
今アメリカ留学中だから円安で買い物辛い🥺,今アメリカ留学中だから円安で買い物辛い🥺,ハナ,0,2022-10-26T13:46:13Z,2022-10-26T13:46:13Z
ぎにょちゃんと同い年くらいの女性が同じようにお買い物できると思ったらわりと大間違い😂,ぎにょちゃんと同い年くらいの女性が同じようにお買い物できると思ったらわりと大間違い😂,Nanchan Nancholo,3,2022-10-26T10:16:36Z,2022-10-26T10:16:36Z
好きを突き詰めてきたことで稼いだお金で、さらに好きを極める。幸せってそういうことかな〜ってみてておもう,好きを突き詰めてきたことで稼いだお金で、さらに好きを極める。幸せってそういうことかな〜ってみてておもう,o 157,0,2022-10-27T02:00:06Z,2022-10-27T02:00:06Z
インスタでカーキのコートの事聞いちゃいました💦すみません💦日本で数点….可愛すぎる❤あさぎーにょさん選ぶものにキュンが止まらない❤コート欲しい(´°̥̥̥̥̥̥̥̥ω°̥̥̥̥̥̥̥̥｀),"インスタでカーキのコートの事聞いちゃいました💦すみません💦
日本で数点….可愛すぎる❤あさぎーにょさん選ぶものにキュンが止まらない❤
コート欲しい(´°̥̥̥̥̥̥̥̥ω°̥̥̥̥̥̥̥̥｀)",na* na,0,2022-10-26T10:34:07Z,2022-10-26T10:34:07Z
7:04いい意味で子どもみたいで可愛い🤍,"7:04
いい意味で子どもみたいで可愛い🤍",Neyu _,0,2022-10-26T11:05:09Z,2022-10-26T11:05:09Z
これ待ってた！☺️🫶🏻,これ待ってた！☺️🫶🏻,ramune‪‪🏳️‍⚧️,1,2022-10-26T10:13:19Z,2022-10-26T10:13:19Z
キャスキッドソンは私の青春なので、絶対に現地に買いに行きます！！！🔥,キャスキッドソンは私の青春なので、絶対に現地に買いに行きます！！！🔥,おじ,0,2022-10-26T15:03:42Z,2022-10-26T15:03:42Z
参考にならないけど好き!!!楽しい!!!っていうコメントちょくちょく色んな動画で見るけど、その前置きいるかねぇ??? 良いことで始まって終わればいいじゃないか!!,参考にならないけど好き!!!楽しい!!!っていうコメントちょくちょく色んな動画で見るけど、その前置きいるかねぇ??? 良いことで始まって終わればいいじゃないか!!,さかな くん,4,2022-10-26T10:48:00Z,2022-10-26T10:48:00Z
おでこ可愛い❤️前髪上げたら似合うと思います！,おでこ可愛い❤️前髪上げたら似合うと思います！,chi- yan,0,2022-10-26T19:44:56Z,2022-10-26T19:44:56Z
そんなにたくさんどうやって持って帰ってきたんですか😮今度海外旅行行こうと思うんですけど大きいスーツケース持ってなくて、けどたくさん買い物したいなって思ってるんで教えて欲しいです🥹機内持ち込みできそうなサイズの一つと2、3日用のやつ２つは持ってるんですけどやっぱりスーツケース２つ持ちとかですかね😅,そんなにたくさんどうやって持って帰ってきたんですか😮今度海外旅行行こうと思うんですけど大きいスーツケース持ってなくて、けどたくさん買い物したいなって思ってるんで教えて欲しいです🥹機内持ち込みできそうなサイズの一つと2、3日用のやつ２つは持ってるんですけどやっぱりスーツケース２つ持ちとかですかね😅,シ,1,2022-10-26T11:58:38Z,2022-10-26T11:58:38Z
あさぎーにょさんの動画をみると、わくわくしたり自分もそこにいるかのように楽しい気持ちになれます😢✨とてもネガティブな性格なので、毎度救われています😢有難うございます😢,あさぎーにょさんの動画をみると、わくわくしたり自分もそこにいるかのように楽しい気持ちになれます😢✨とてもネガティブな性格なので、毎度救われています😢有難うございます😢,ゆんゆん,0,2022-10-26T17:45:04Z,2022-10-26T17:45:04Z
自分でお金貯めて絶対に行きます✈️,自分でお金貯めて絶対に行きます✈️,あおは,0,2022-10-26T11:31:24Z,2022-10-26T11:31:24Z
ストーリータグ付けさせて頂いたものです❤パリ興味ない事なかったんですけど、むちゃくちゃ行きたくなりすぎます🤩✨非日常でワクワクさせてくれてありがとうございました😍🎶お金貯めて頑張っていきまーす🗼,"ストーリータグ付けさせて頂いたものです❤
パリ興味ない事なかったんですけど、
むちゃくちゃ行きたくなりすぎます🤩✨
非日常でワクワクさせてくれて
ありがとうございました😍🎶
お金貯めて頑張っていきまーす🗼",浪速におるおばちゃん,0,2022-10-26T10:18:36Z,2022-10-26T10:18:36Z
かわいいがいっぱい🎉,かわいいがいっぱい🎉,megmic,0,2022-10-26T12:28:28Z,2022-10-26T12:28:28Z
ぎーにょちゃんが旅行に持っていってた無印のヘアアイロンって使い勝手どうでしたか？今度旅行の予定があって、コードレスかミニアイロン探してて。無印の口コミがあんまり良いのがなくて迷ってるんです😢,"ぎーにょちゃんが旅行に持っていってた無印のヘアアイロンって使い勝手どうでしたか？
今度旅行の予定があって、コードレスかミニアイロン探してて。
無印の口コミがあんまり良いのがなくて迷ってるんです😢",み。,0,2022-10-26T11:51:00Z,2022-10-26T11:51:00Z
素敵ー！！！！すごい素敵✨✨私には飛ばせる諭吉が100人もいないwww動画を見て飛ばしたつもりになります笑,"素敵ー！！！！
すごい素敵✨✨

私には飛ばせる諭吉が100人もいないwww
動画を見て飛ばしたつもりになります笑",A,0,2022-10-26T10:38:30Z,2022-10-26T10:38:30Z
最初から可愛い,最初から可愛い,マンモス.,0,2022-10-27T05:24:23Z,2022-10-27T05:24:23Z
黄色のデニムワンピと茶色の付け襟...ポムポムプリンやね🍮,"黄色のデニムワンピと茶色の付け襟...
ポムポムプリンやね🍮",kino!,1,2022-10-26T12:11:49Z,2022-10-26T12:11:49Z
サングラスめっちゃ似合ってる！！！😆全部可愛い！！！😆そして脚が細い！！！😆,"サングラスめっちゃ似合ってる！！！😆
全部可愛い！！！😆
そして脚が細い！！！😆",ai,0,2022-10-26T13:41:49Z,2022-10-26T13:41:49Z
黄色のワンピースとブラウンの付け襟でポムポムプリンみたい！かわいいねえ！,黄色のワンピースとブラウンの付け襟でポムポムプリンみたい！かわいいねえ！,No. 83,0,2022-10-26T12:43:19Z,2022-10-26T12:43:19Z
きゃあかわいい,きゃあかわいい,heykazma,0,2022-10-26T11:28:57Z,2022-10-26T11:28:57Z
ボリューミーな子たちばっかりだから帰り大丈夫だったですか😃笑？キャリーケース入りましたか？どれも凄く可愛い💕ぎーにょちゃんめっちゃ似合うしすてき。,"ボリューミーな子たちばっかりだから帰り大丈夫だったですか😃笑？キャリーケース入りましたか？
どれも凄く可愛い💕ぎーにょちゃんめっちゃ似合うしすてき。",やすだかな,0,2022-10-26T11:08:35Z,2022-10-26T11:08:35Z
サングラス似合ってる😎🫰,サングラス似合ってる😎🫰,あかふく,0,2022-10-26T12:43:21Z,2022-10-26T12:43:21Z
はぁ~❤️かわいいいいいい🧚,はぁ~❤️かわいいいいいい🧚,chi E,0,2022-10-26T10:42:39Z,2022-10-26T10:42:39Z
ぎーにょちゃん見てSister Janeのドレス買おうと思ってるー！ぎーにょちゃんサイズSかなぁ？,ぎーにょちゃん見てSister Janeのドレス買おうと思ってるー！ぎーにょちゃんサイズSかなぁ？,Alice,1,2022-10-26T10:33:30Z,2022-10-26T10:33:30Z
黄色のワンピースとつけ襟ポムポムプリンちゃん😂,"黄色のワンピースとつけ襟
ポムポムプリンちゃん😂",akiko,0,2022-10-26T11:39:36Z,2022-10-26T11:39:36Z
百万円が飛んでｯた🤣,百万円が飛んでｯた🤣,じょじょ,0,2022-10-26T12:41:26Z,2022-10-26T12:41:26Z
ドトール的なところで6000円😂😅😂😅😂😅そりゃ値段見たら楽しめへんわ‼️でも、100万円で済んだの？？？もっとかかりそう！！,"ドトール的なところで6000円😂😅😂😅😂😅
そりゃ値段見たら楽しめへんわ‼️でも、100万円で済んだの？？？もっとかかりそう！！",akiko,0,2022-10-26T11:36:20Z,2022-10-26T11:36:20Z
黄色ワンピにブラウンのつけ襟はポムポムプリンすぎてかわいい🥹💞,黄色ワンピにブラウンのつけ襟はポムポムプリンすぎてかわいい🥹💞,わち,1,2022-10-26T10:50:06Z,2022-10-26T10:50:06Z
ビーズのお花かわいすぎる🥲どこのお店だろ🤔,"ビーズのお花かわいすぎる🥲
どこのお店だろ🤔",本川。,0,2022-10-27T06:58:37Z,2022-10-27T06:58:37Z
あれ？白のウェディングドレスは？あれ、もう一度見たかった〜。,"あれ？白のウェディングドレスは？
あれ、もう一度見たかった〜。",月詠藍斗,0,2022-10-26T12:14:55Z,2022-10-26T12:14:55Z
やー！かわいい！,やー！かわいい！,ve lo,0,2022-10-26T22:50:08Z,2022-10-26T22:50:08Z
マリメッコも、北欧だよー✨,マリメッコも、北欧だよー✨,しましの,0,2022-10-26T12:11:11Z,2022-10-26T12:11:11Z
他の人もハイブランド買って１０００万円超えとか凄い買物してますよね。田舎だと皆ユニクロかな?都会の人の財力は凄いなぁ元キャバクラ社長の財力が凄いなぁ😭,他の人もハイブランド買って１０００万円超えとか凄い買物してますよね。田舎だと皆ユニクロかな?都会の人の財力は凄いなぁ元キャバクラ社長の財力が凄いなぁ😭,すがのみゆき,0,2022-10-27T05:38:50Z,2022-10-27T05:38:50Z
サイコー😍💓💓💲,サイコー😍💓💓💲,KS,0,2022-10-26T10:23:28Z,2022-10-26T10:23:28Z
初めてはやくみれた！,初めてはやくみれた！,ついんくる,0,2022-10-26T10:14:24Z,2022-10-26T10:14:24Z
ウェディングドレスはまた別なのかな？？それとも前回の動画でおしまい？👭✨,"ウェディングドレスはまた別なのかな？？
それとも前回の動画でおしまい？👭✨",もぐもぐ,0,2022-10-26T11:49:59Z,2022-10-26T11:49:59Z
うーん、サティスファクション急上昇おめでとうございます,"うーん、サティスファクション
急上昇おめでとうございます",Chainsaw Man,0,2022-10-27T02:37:39Z,2022-10-27T02:37:39Z
ジャポン😂,ジャポン😂,ちゃるcharu,0,2022-10-26T10:19:22Z,2022-10-26T10:19:22Z
*かわよ*,*かわよ*,Misarmy,0,2022-10-26T11:12:07Z,2022-10-26T11:12:07Z
金持ち〜💰,金持ち〜💰,平島ポンタ,0,2022-10-27T09:04:30Z,2022-10-27T09:04:30Z
ウェディングドレスが出てこなかった・・・,ウェディングドレスが出てこなかった・・・,わらび,0,2022-10-26T11:45:20Z,2022-10-26T11:45:20Z
じゅんやわたなべ？のコート✨カッコいい❤️🎵😀いいわー🎵✨オリジナリティがあって他には無い❗しかも軽いのも、さらにいい❗,じゅんやわたなべ？のコート✨カッコいい❤️🎵😀いいわー🎵✨オリジナリティがあって他には無い❗しかも軽いのも、さらにいい❗,kona sara-,0,2022-10-26T11:53:24Z,2022-10-26T11:54:55Z
お金持ち😅,お金持ち😅,tmjjmなな,0,2022-10-26T14:23:27Z,2022-10-26T14:23:27Z
あれ？ウェディングドレスは？買わなかったのかな？,あれ？ウェディングドレスは？買わなかったのかな？,くまさぁ,1,2022-10-26T10:34:55Z,2022-10-26T10:34:55Z
お帰り～,お帰り～,わわ,0,2022-10-26T10:28:10Z,2022-10-26T10:28:10Z
あれ？ウエディングドレスは？😀,あれ？ウエディングドレスは？😀,kona sara-,1,2022-10-26T11:26:44Z,2022-10-26T11:26:44Z
ドレスは？？,ドレスは？？,あつこ たかの,0,2022-10-26T11:50:17Z,2022-10-26T11:50:17Z
ウエディングドレスどこいったーん？,ウエディングドレスどこいったーん？,S A,0,2022-10-26T15:43:27Z,2022-10-26T15:43:27Z
Hello💕🥳,Hello💕🥳,ayappe lapin,1,2022-10-26T10:13:16Z,2022-10-26T10:13:16Z
いちー,いちー,ちとせあみ,0,2022-10-26T10:13:10Z,2022-10-26T10:13:10Z
９！,９！,Cookie,0,2022-10-26T10:15:07Z,2022-10-26T10:15:07Z
